"id","req_specification","class"
"623","Maybe just one question, you don't have to necessarily answer it now, but maybe note it down to, to get back to me whether the reports should be exportable, for example, to, to PDF files or anything, or, or CSV.","F"
"595","So these three languages will be available at the very last launch of the software.","A"
"452","So maybe let's say a survey can maximum at the, at the maximum contain 10 questions.","A"
"96","Like maybe a team miniature or some sort of friend business unit manager.","F"
"586","So once the Spanish has been done.","NULL"
"196","So as to assign, um, which team leader can interact with which employees, so where, where does, where do they belong in, in the hierarchy or maybe even from the project manager side, uh, which team leaders belong to this, uh, project manager.","F"
"59","So, I mean, of course there are like you have to properly already, um, think of how, how we possibly can reflect such a hierarchical, um, role system in a technical way.","F"
"423","Stressful day.","NULL"
"659","We have to reschedule many more meetings also just with you and your team Janik and Mark with, with the designers as well.","NULL"
"181","Like an employee or what do you think?","NULL"
"58","Um, yeah, exactly.","NULL"
"42","And depending on your user role, you have different rights.","F"
"13","Yeah.","NULL"
"349","I mean, we could just make it so that these ideas are submitted in raw text and then, or displayed and in the report to the manager.","F"
"111","What if he has every survey available?","F"
"538","I think that's, that's a good, a good way.","NULL"
"251","Yeah, that, that allows us particularly because yeah, it's made me more intuitive for, for P for computer users using a mouse.","A"
"55","That makes sense.","NULL"
"607","So all the elements are there in three different languages and their manager, he can switch the language somewhere on a taco to his liking.","F"
"335","So he, at the end, in the report, he sees all the feedback of the users, but then he himself can decide which of these he liked.","A"
"389","If you once built the comment box, you can simply copy paste it from, from your perspective, right?","NULL"
"362","I can say this question should be commented.","F"
"431","So, so now you're, you're sitting at home enjoying your life or?","NULL"
"600","Yeah.","NULL"
"23","Oh yeah, right.","NULL"
"511","Then again, customization brings a certain instability to the responsive design, because we can probably not predict how it's going to look.","NULL"
"493","I like this idea.","NULL"
"469","Yeah, of course.","NULL"
"295","So technically, I mean, we, we have a timeframe of around six months for this phase one, so I'm not sure if this is all working, maybe only you can.","NULL"
"540","This should also be specifically responsive so that all the costumers can fill out the surveys wherever they are.","F"
"454","Yeah.","NULL"
"441","Okay.","NULL"
"372","So he can really add new ideas or innovative ideas, or maybe even this way, patients, which then can generally be seen by others and the opera download it.","F"
"539","And also in the survey interface, you can fill out the questions.","F"
"603","Yeah.","NULL"
"558","We really have to think about this actually, because my wish needs that it's, that the language can be, or the available language to the project have to be set when we, as a super admin, create the project for a customer, right?","F"
"25","I haven't seen this email.","NULL"
"550","Yeah, yes.","NULL"
"114","Maybe, I don't know.","NULL"
"137","Yeah.","NULL"
"642","And if yes, in which form it should come across.","NULL"
"268","Yeah.","NULL"
"500","I think, I don't know if the programming part will be a lot more complicated.","NULL"
"392","But, but nice to know that it should have this flag.","F"
"495","That's that's a really good idea.","NULL"
"338","The really unnecessary I listen is in his opinion, from the really nice things which he sees worth sharing.","NULL"
"348","No, but I think we sh we wouldn't have to go that far.","NULL"
"574","I think they have to be hard coded in different languages actually.","A"
"366","Yeah.","NULL"
"492","I like this idea, yeah.","NULL"
"107","Do you think this will be a big problem in terms of, um, um, technique, you know, programming?","NULL"
"253","Yeah, no, no, no, not the swipe, but the click, you mean that you accidentally clicked somewhere.","NULL"
"563","Are there, can you translate them?","NULL"
"323","So maybe, yeah.","NULL"
"426","Yes, since I got tested positive.","NULL"
"279","Bring your others as well.","NULL"
"247","Cool.","NULL"
"6","Yeah.","NULL"
"381","Yeah, it definitely has to be configurable because otherwise let's say I, as a manager, create the survey, complaining five questions.","F"
"345","So just keep in mind, open text is evil.","NULL"
"634","Okay.","NULL"
"312","That's a great idea.","NULL"
"490","Yeah, it makes sense.","NULL"
"43","So I think there will be something like managers and maybe something like, um, uh, super admin.","F"
"440","I thought it was, it was kind of, kind of a joke, but if it weren't for Corona, I would have gone to work without any problems, honestly.","NULL"
"126","Uh, I didn't get to think about this, but probably predefined would be easy to manage.","F"
"483","Not, yeah, yeah.","NULL"
"174","Maybe what's important is, uh, I mean, we have some customers with different which are based in different countries, right.","NULL"
"597","Yeah, while on the other hand, we cannot expect this from the customer, they pay for something","NULL"
"654","So maybe if something comes up, there are some unclarities we can talk in the next week for sure.","NULL"
"535","Yes.","NULL"
"467","Should be.","NULL"
"463","I think it's impossible to sort of group the questions by, by meaning of the question for this week.","NULL"
"450","Let's say a survey can only contain so many questions.","A"
"605","That I expect that the tool is a way otherwise it's already ran another tool.","NULL"
"612","I mean, that's also, that's quite important for you and your team.","NULL"
"504","It depends on, on how we entirely approach the thing.","NULL"
"105","I'm not really sure here.","NULL"
"518","I mean, think about, think about the manager who's often walking around or visiting different I don't know, departments, and instead of laptops, they have iPads.","NULL"
"215","So apart from, from the, from the mailing list, um, which Mark, uh, mentioned, what else is there?","NULL"
"122","How, how do you mean text?","NULL"
"92","No, no, that's okay.","NULL"
"446","So where were we?","NULL"
"581","And then for German, you would translate it into one word.","NULL"
"176","I mean, actually I really like what Mark said.","NULL"
"639","Yeah.","NULL"
"337","It's like the manager then will be like a first filter that filters out.","F"
"140","But I get your point on that.","NULL"
"118","Yeah, I think this would be a good approach.","NULL"
"10","Okay, cool.","NULL"
"466","But normally the questionnaire is already grouped by, by topic, isn't it?","NULL"
"84","Uh, let me just quickly write this down here as a side note.","NULL"
"631","Can","NULL"
"464","We will have to include really complicated the algorithms, maybe even NLP or something, which should be way out of scope.","NULL"
"88","Yeah.","NULL"
"165","Ah, okay.","NULL"
"125","Would that be a fully customizable tag or predefined texts?","F"
"588","Then it will be blah, blah, blah, for all future Spanish customers, right?","F"
"568","I mean, I was just also the other day I was searching the net and I found DeepL this translation API, and maybe it would also be possible to include some sort of deeper API as in if a manager or now if a user creates an English question, people will automatically translate it to German storing the germ part of this question.","F"
"460","Then we have the same for open text question, multiple single choice and so on.","NULL"
"21","Uh, this information didn't reach me, but, uh, that's fine with me.","NULL"
"94","Oh yeah.","NULL"
"211","Certainly depends on, on which exact client we're talking about.","NULL"
"365","Well, I can do that.","NULL"
"582","For English you would translate it into a different word and maybe someone wants to do Spanish, but they will have to provide a translation for Spanish, but we can simply register this translation.","F"
"653","I'm good to, I'm just looking forward to all the notes you took.","NULL"
"592","That's, that's really important.","NULL"
"503","So it shouldn't be so much of an issue to move these blocks around, right?","NULL"
"309","Um, yeah.","NULL"
"34","Yeah.","NULL"
"342","You can use the Reddit approach again, where you can have comments you can upvote or downvote and then you can.","F"
"305","So the questions evolve around motivation.","A"
"608","Okay.","NULL"
"232","I mean, the types of questions I just mentioned there, everyone knows them, but maybe we could come up with something innovative, which will be a unique selling point for our application.","NULL"
"590","Okay.","NULL"
"400","So I'm not sure here how we should actually display the results of these different questions.","NULL"
"350","So the manager sees, okay, user one set, blah, blah, blah, user two set blah, blah, blah, nothing more than that.","NULL"
"533","I think for the beginning, this would surely be enough.","NULL"
"39","We have really staffs how this payment bottles should work, but it should be a recurring payment model.","F"
"46","Right.","NULL"
"302","But not channel it's channel in terms of the survey, let's say a survey is about user satisfaction or umm, employee motivation.","NULL"
"657","Yeah, yeah, yeah.","NULL"
"644","I think they just want to have nice widgets, which they can include in their internal meetings or yeah.","F"
"332","And then that then remains the question with, with the voting.","A"
"275","Okay.","NULL"
"567","I think that would actually make sense that we keep it like that in this tool as well.","NULL"
"572","One is the interactive part, which should be translated for, for the users between them.","F"
"298","Just, just to clarify this, this, if I understood this correctly, this is about users pitching new survey questions.","NULL"
"237","So first, uh, I would, I thought about open text questions.","F"
"456","So scale question, one of the reports will get its own, which is fair.","NULL"
"222","Um, yeah.","NULL"
"243","How, how would you solve this if someone uses a traditional computer or notebook?","A"
"579","I don't know what you mean by that.","NULL"
"45","I mean, we need some, some, uh, sort of, um, possibility to manage this entire tool.","F"
"146","I mean, we ha we, we don't, we have a lot of customers, but it's still quite, um, well, it's, we, we don't serve the whole world.","NULL"
"627","I mean, other bar plots and so on.","F"
"398","And also the report that results out of survey will be really messed up and bloated with, if every question cook will be commendable, I mean, maybe we can just use this to transition to the reporting system because that's also something which should be like the part of, of course, from an ice service to this, this is really important to, right.","NULL"
"664","Thank you and have a nice day.","NULL"
"385","Okay, okay, yep.","NULL"
"7","So let me just quickly.","NULL"
"448","Well, I think maybe we should, we should limit the service to specific topics, right?","A"
"142","Yeah.","NULL"
"624","I don't know, because for now what we were talking about is that is all online in a widget or somewhere, but maybe, maybe you, he also has to report to someone else and would require it to as a file.","F"
"565","Yeah, I see.","NULL"
"195","So we would need, uh, maybe this part.","NULL"
"508","Yeah, right.","NULL"
"22","Well, it was decided yesterday.","NULL"
"327","Yeah, yeah.","NULL"
"293","So this will be a big benefit for the manager in the end, because then he gets ideas and already has them sort of pre-filtered by their importance or, you know, um, on Reddit, they have a similar system when you post something Reddit, people can opt for download it so that the most relevant topics on Reddit in our cases will be ideas they're on the top.","F"
"277","Yeah.","NULL"
"193","Yeah.","NULL"
"283","So, okay.","NULL"
"564","Would that make sense?","NULL"
"8","Wait, wait.","NULL"
"541","That's also really important.","NULL"
"547","If we could nail this for phase one, actually, yeah.","A"
"120","And, um, he can filter them.","NULL"
"106","Maybe we have to think about this.","NULL"
"71","Or do you have any questions just before we go into detail now, do you guys have any questions overall?","NULL"
"584","But this, the Spanish translation has to be valid for all future Spanish companies that join our software as well, right?","NULL"
"172","I mean, are there additional configuration issues or any other thing that we would require users for?","NULL"
"641","Whereas let's say a CSV file simply contain the data, which is in the charts, but just let me know if, if there is the requirement to do so.","F"
"131","The team leaders or the employees could, could simply select out of these predefined tags.","F"
"393","Yeah right, yeah, yeah.","NULL"
"217","Yeah, I mean that, there are a lot of unclear, um, topics still.","NULL"
"240","And maybe the left side is no, the right is yes.","F"
"151","Okay.","NULL"
"119","So, uh, I think he should be able to see all the, uh, the surveys from the normal metrics by business unit.","F"
"340","I mean, maybe, maybe you would want to say more to explain on why you like, or don't like this, what, what is there out of your mind?","NULL"
"621","Maybe we should leave it at that for now because I have another meeting, which I have to attend soon.","NULL"
"76","I mean, this is, as you said, a, a tool for, for survey management or like creation and organization and reporting.","F"
"594","Yeah, I need one of these languages.","NULL"
"658","For sure.","NULL"
"12","But I can, yeah.","NULL"
"208","You don't need a lot of, I mean, we, we talk, um, top level managers of a business here probably to be overkill if, if a business would have more than one managing this, this, this little, um, aspect of the business, right.","NULL"
"128","You're maybe, maybe we can say the project manager can define these texts for his company.","F"
"510","Because it has to be viewable on different devices.","F"
"173","Yeah.","NULL"
"515","I would have to collaborate on this, yeah.","NULL"
"536","I mean, we can choose an approach, which would make the global possibility for responsive design, but maybe just not in detail implemented on each side.","A"
"134","Okay.","NULL"
"203","Okay.","NULL"
"343","Or making maybe, maybe we should just create a new question type.","NULL"
"410","But one is a swipe question.","NULL"
"645","You know, you know?","NULL"
"124","Um, like, um, the, the content of the survey, so maybe it's about employee happiness or customer satisfaction, and we can use texts.","F"
"287","They should not just be there in click to questions they should of bringing in their own ideas, which in turns can then be seen by other users.","F"
"552","No, it's okay, I'm listening.","NULL"
"487","That's actually the exact input I was hoping for, because I mean, technically you, if, if within the same survey you have different topics for some reason, technically you could assign ma as in a group to, to the questions so that it would be possible to, to then in the report group by, by these question groups for, for the results.","NULL"
"41","It's like, um, an online application that has different user roles.","F"
"549","Yeah, so that's","NULL"
"615","So keep that in mind too.","NULL"
"201","We could talk about, I think there should be the possibility to have multiple.","A"
"359","Or, or explain why you don't like it.","NULL"
"394","I mean, yeah.","NULL"
"399","Because the manager, they want to be clean, clean, and easy to understand view what's happening within their survey or what are the results.","F"
"307","So the users should have the possibility to bring in their own ideas, should the manager have missed them.","F"
"57","Yeah.","NULL"
"150","I think that's already quite a good input.","NULL"
"321","True, true.","NULL"
"77","Um, yeah, I think, I think I got, I got most of the parts, so let's, let's start.","NULL"
"81","Okay.","NULL"
"100","How much is there to abstract?","NULL"
"324","I don't know.","NULL"
"154","I'm wondering, do you think it is necessary for users to even have like a in or something?","NULL"
"264","Yeah.","NULL"
"544","So we have two elements with which for sure need to be responsive, which is the reporting and survey mask.","F"
"438","My friends it's the only rough, but otherwise probably same as me.","NULL"
"501","I think honestly, I don't know.","NULL"
"412","And one is, uh, the scale of satisfaction, something.","NULL"
"473","Exactly.","NULL"
"461","And then of course, it's, it's the manager who created the survey.","NULL"
"606","Yeah, I think we have to keep it simple here as well for this project phase one and just go with three languages, German, English, and French and French, and just make sure that at the launch day, these languages are implemented completely.","F"
"224","I mean, let's say a manager, a manager creates a survey.","NULL"
"587","So for example, scale question is blah, blah, blah.","NULL"
"468","Yeah.","NULL"
"219","So I would really like it, if an employee doesn't have to do any, it doesn't have to do anything to, to be part of a project.","A"
"573","And what I meant is like the entire GUI, so the, all, all the fixed static texts from menus and that stuff,","F"
"311","And then maybe the teams like, Oh yeah, we all need the espresso machine.","NULL"
"371","I think we accidentally here hit another idea, which I didn't want to, to point at, but I think I would just track this down because I really liked the comment ability of questions, but it still doesn't really solve the problem, which I initially mentioned in as in to include the user.","NULL"
"387","Yeah.","NULL"
"185","Chris makes, makes a lot of sense because of the stuff you mentioned.","NULL"
"333","Um, maybe we could do it that way.","NULL"
"40","So they just sign up in order to use the services and, um, the service as itself.","F"
"453","And then we should probably group not really group the question and group.","NULL"
"262","Yeah, yeah, yeah.","NULL"
"69","I mean, do you have the overall idea of the, of the project, right?","NULL"
"183","Yeah.","NULL"
"578","No, technically we don't have to, we can hard-code translation, codes, and then simply register translations for these codes.","A"
"288","And maybe, I don't know, you know, where.","NULL"
"290","Yeah.","NULL"
"72","Uh, for me, I think it's clear.","NULL"
"368","Yeah.","NULL"
"252","But, but we would have to, to, to maybe restrict that on the mobile devices.","A"
