"id","req_specification","class"
"287","They should not just be there in click to questions they should of bringing in their own ideas, which in turns can then be seen by other users.","F"
"174","Maybe what's important is, uh, I mean, we have some customers with different which are based in different countries, right.","NULL"
"407","Just like maybe all the open text questions are grouped together in the report and all other types of questions are also grouped together,","A"
"475","I also didn't.","NULL"
"286","You know, like I would really like it if you have something like they have on Reddit or somewhere like where you could maybe also as a, you somehow have to involve the users into the survey.","F"
"584","But this, the Spanish translation has to be valid for all future Spanish companies that join our software as well, right?","NULL"
"110","I mean, depending on how big this entire thing gets, maybe he simply has too many surveys to manage and loses track of what is important.","F"
"175","So we also have to consider language settings for users. I'm not really sure how we could address this problem.","A"
"160","So they're just having an account such that, uh, the managers can send them, uh, uh, emails, you know what I mean?","F"
"635","Okay, cool.","NULL"
"45","I mean, we need some, some, uh, sort of, um, possibility to manage this entire tool.","F"
"404","I think maybe for the swipe questions, we can have some, some, uh, a bar graph that shows the sides they swiped to.","F"
"188","Yeah.","NULL"
"622","So I show it, just clarify some, some more things that might be unclear for you, because from my side, I'm quite happy with our outcome of this meeting.","NULL"
"328","Well maybe, maybe we could include them in the, you know, at the end of the survey, a report is created out of this survey, which lists the results of the different questions, right?","F"
"292","And these people can then decide if these are good ideas or not.","NULL"
"657","Yeah, yeah, yeah.","NULL"
"428","It's really tough when","NULL"
"168","That's what I meant.","NULL"
"150","I think that's already quite a good input.","NULL"
"201","We could talk about, I think there should be the possibility to have multiple.","A"
"270","So like the answers, Hey, that's what you answered to use submit this.","NULL"
"227","I mean, we could probably just stick to our, to our typical survey model where we have scale questions with, with disliking scale and we have open tax questions and we have multiple and single choice questions, right.","F"
"572","One is the interactive part, which should be translated for, for the users between them.","F"
"580","Let's say you have the translation code, which should the books scale.","NULL"
"458","One of the survey, we will get its own way too in the report.","NULL"
"74","Yeah.","NULL"
"369","I mean, I really liked the idea of making questions commendable like that.","NULL"
"459","And then all the other scale questions are in the same area of the report.","F"
"322","That's for sure a big problem.","NULL"
"385","Okay, okay, yep.","NULL"
"548","I just put this here in the projects goals, you guys see it in the documents I'll share afterwards, but that's that's yeah, that that's, that would be a really important.","NULL"
"104","Um, so I wonder, I wonder if, if it makes sense that, that a project manager should be able to also see and maybe even be able to add it surveys from managers below him, or should he just exclusively, um, be able to manage his own service?","F"
"23","Oh yeah, right.","NULL"
"491","Yes.","NULL"
"488","I don't know how much sense this makes, but I think it, it should be possible from a technical aspect.","NULL"
"609","And then maybe just keep the possibility in the backlog, but that's certainly not for phase one.","F"
"236","Um, yeah, I noted some types of questions here in preparation for this awesome meeting.","NULL"
"591","Yeah.","NULL"
"372","So he can really add new ideas or innovative ideas, or maybe even this way, patients, which then can generally be seen by others and the opera download it.","F"
"608","Okay.","NULL"
"61","Because we really need to think about how, um, to distribute rights in order to, to only show specific information to specific roles.","F"
"133","Yeah.","NULL"
"25","I haven't seen this email.","NULL"
"79","Yeah.","NULL"
"421","Well fine so far.","NULL"
"523","Maybe because you, you need also a good input device, like a keyboard or something, because if you create new employees or new questions, you need to type a bit of text,","F"
"232","I mean, the types of questions I just mentioned there, everyone knows them, but maybe we could come up with something innovative, which will be a unique selling point for our application.","NULL"
"114","Maybe, I don't know.","NULL"
"266","I mean, I don't know how, you know, the functionality, but sometimes if you just try swiping through and then you realize, Oh, that was the wrong side.","NULL"
"218","I mean, we just talked about those now more or less, but I mean, and, and also now about the communication, so just let me briefly get, um, pinpoint this down.","NULL"
"516","I just start wondering if it even makes sense that this, their manager platform is responsive, because does it make sense for a manager to manage all his employees create service and stuff on iPhone or iPad?","F&A"
"424","It's always.","NULL"
"332","And then that then remains the question with, with the voting.","A"
"143","Right.","NULL"
"493","I like this idea.","NULL"
"276","Yeah, I like that.","NULL"
"209","Yeah.","NULL"
"476","I really, yeah, I'm really sorry.","NULL"
"329","So the math, maybe, maybe we put.","NULL"
"624","I don't know, because for now what we were talking about is that is all online in a widget or somewhere, but maybe, maybe you, he also has to report to someone else and would require it to as a file.","F"
"233","Um, I cannot hear you both.","NULL"
"554","I think in the beginning somewhere you were talking about languages two questions, one to the business side, as in what languages are there is there a default language or how, how do we handle this?","NULL"
"3","Uh, let me just quickly get my notes.","NULL"
"633","I get the message for really bad network quality.","NULL"
"237","So first, uh, I would, I thought about open text questions.","F"
"197","And this again would be like a hierarchy that we will have to store and to represent somewhere.","A"
"339","But then, then I would maybe I know how, how from the, from the UX perspective, this goes, but like simple swipe would not be sufficient for this.","NULL"
"463","I think it's impossible to sort of group the questions by, by meaning of the question for this week.","NULL"
"355","That's all, there shouldn't be any, um, post-processing of these ideas.","NULL"
"41","It's like, um, an online application that has different user roles.","F"
"109","Um, I'm, I'm thinking more of a, of a usage issue.","NULL"
"333","Um, maybe we could do it that way.","NULL"
"63","I don't think that should be that much of a problem.","NULL"
"16","Where the hell did I put my, um, my notes?","NULL"
"406","What do you think about this?","NULL"
"325","Maybe we can collect these questions and make us a follow-up survey, which then, or something like that in the end.","F"
"593","I mean, I like this, but probably you should, we should just start with the English German French set, because the most of our customers are either one of these.","F"
"29","Just, uh, the one that briefly describes our mission about this project.","NULL"
"75","Um, from my side, I think it is mostly clear.","NULL"
"278","That's actually a really cool idea, but the answer yeah.","NULL"
"449","So it's not really getting messy.","NULL"
"9","Oh yeah.","NULL"
"565","Yeah, I see.","NULL"
"460","Then we have the same for open text question, multiple single choice and so on.","NULL"
"338","The really unnecessary I listen is in his opinion, from the really nice things which he sees worth sharing.","NULL"
"562","And from previous projects where I think we handled it the way that our client had to provide translations for the languages they wanted, where we just sent them, Hey, there are the terms like the, these these words and sentences.","F"
"579","I don't know what you mean by that.","NULL"
"598","So for sure they don't want to provide additional work in order to be able to use it","NULL"
"494","That's, that's something I just noted it down, but something we have to keep in mind and go more into that.","NULL"
"154","I'm wondering, do you think it is necessary for users to even have like a in or something?","NULL"
"180","And from there on, he will receive mails, but all this language setting stuff, maybe shouldn't concern that the user, I mean, with user, I mean the survey filler, right?","NULL"
"152","I mean, there, there will also of course be this, the role of the employee or of the servery filler him or herself, right.","F"
"555","Yep.","NULL"
"405","And for all the questions we can have all the types, but all in all, I would say for the, um, usability or visibility of the results, it would be good to, to group the question types together.","F"
"541","That's also really important.","NULL"
"308","So maybe me as a user can just submit that.","F"
"348","No, but I think we sh we wouldn't have to go that far.","NULL"
"279","Bring your others as well.","NULL"
"83","So, um, typically the company there will be, uh, like our manager, like, uh, some sort of top manager, maybe, I don't know, maybe a project manager will be suitable word.","F"
"44","So this will be asked.","NULL"
"540","This should also be specifically responsive so that all the costumers can fill out the surveys wherever they are.","F"
"400","So I'm not sure here how we should actually display the results of these different questions.","NULL"
"231","Yeah, we need something fancy looking and also something innovative.","A"
"92","No, no, that's okay.","NULL"
"226","What kind of question makes sense in it?","NULL"
"101","Yeah.","NULL"
"312","That's a great idea.","NULL"
"88","Yeah.","NULL"
"556","I think it would make sense to have a default language for approach check.","F"
"434","But what about symptoms?","NULL"
"363","So the comment will be on this question specifically.","NULL"
"346","As in, if you have simple possibilities, then the processing is also simple.","NULL"
"302","But not channel it's channel in terms of the survey, let's say a survey is about user satisfaction or umm, employee motivation.","NULL"
"220","This is solely the, um, the task of a manager.","A"
"52","Yeah, exactly.","NULL"
"531","I mean, yeah, yeah.","NULL"
"398","And also the report that results out of survey will be really messed up and bloated with, if every question cook will be commendable, I mean, maybe we can just use this to transition to the reporting system because that's also something which should be like the part of, of course, from an ice service to this, this is really important to, right.","NULL"
"381","Yeah, it definitely has to be configurable because otherwise let's say I, as a manager, create the survey, complaining five questions.","F"
"230","What looks fancy?","NULL"
"146","I mean, we ha we, we don't, we have a lot of customers, but it's still quite, um, well, it's, we, we don't serve the whole world.","NULL"
"326","But then you get two emails.","NULL"
"454","Yeah.","NULL"
"42","And depending on your user role, you have different rights.","F"
"387","Yeah.","NULL"
"443","Sorry, I'm back.","NULL"
"96","Like maybe a team miniature or some sort of friend business unit manager.","F"
"316","But I don't really see how this should be working, right.","NULL"
"359","Or, or explain why you don't like it.","NULL"
"515","I would have to collaborate on this, yeah.","NULL"
"98","Depends on what they should be able to do.","NULL"
"441","Okay.","NULL"
"273","That's, that will be really important there.","NULL"
"37","But now we want to have a means that our customers can easily and without much effort create service from wherever they are using their mobile device or also their notebook, whatever, you know, it's just currently in all the survey basis, it's like a trend to ease up the process of creating new service.","F"
"172","I mean, are there additional configuration issues or any other thing that we would require users for?","NULL"
"212","But I think I get you a general concept.","NULL"
"661","So I'll just stack get all this information in a readable document and I'll provide you with it.","NULL"
"267","Is there intended to be a functionality to retrieve a card?","F"
"526","So like the, the actual configuration would probably happen on a, on a desktop or laptop, but for, for the single reporting, if you are in a meeting, you have your iPad with you.","NULL"
"123","I don't really understand this.","NULL"
"26","Um, so yeah.","NULL"
"509","I mean, that's, that's good that you mentioned the point of, of, of how it actually should look in there because here, we also have to keep in mind that the design of this tool has to be responsive, right.","A"
"341","Is there a, an approach for this?","NULL"
"495","That's that's a really good idea.","NULL"
"115","Maybe Mark, you can get some important because you have probably the best knowledge about user experience.","NULL"
"100","How much is there to abstract?","NULL"
"207","Normally you would have like at most, maybe one project manager, which corresponds or communicates with the human resources department of the business and that's about it, right.","NULL"
"564","Would that make sense?","NULL"
"438","My friends it's the only rough, but otherwise probably same as me.","NULL"
"465","Yeah, I think you're somewhat right.","NULL"
"94","Oh yeah.","NULL"
"193","Yeah.","NULL"
"221","So, uh, let me just quickly write this down here.","NULL"
"503","So it shouldn't be so much of an issue to move these blocks around, right?","NULL"
"295","So technically, I mean, we, we have a timeframe of around six months for this phase one, so I'm not sure if this is all working, maybe only you can.","NULL"
"420","How's your life going?","NULL"
"275","Okay.","NULL"
"55","That makes sense.","NULL"
"479","Like otherwise, if someone really wants to create the, in that survey, even use our other services, we have flooded with a lot of them on our home page to create a really full flex drownded survey.","NULL"
"210","Yeah.","NULL"
"498","Yeah.","NULL"
"77","Um, yeah, I think, I think I got, I got most of the parts, so let's, let's start.","NULL"
"324","I don't know.","NULL"
"34","Yeah.","NULL"
"297","Um, I think just for the technical side, it should, of course be possible, but I'm not sure about budget or time scope.","NULL"
"161","What I want to say.","NULL"
"59","So, I mean, of course there are like you have to properly already, um, think of how, how we possibly can reflect such a hierarchical, um, role system in a technical way.","F"
"520","But certainly it makes sense.","NULL"
"417","I'm thinking actually, but I, yeah, I haven't really thought about this specific scenario, which is quite an important one.","NULL"
"629","I'm sorry, I didn't get that.","NULL"
"392","But, but nice to know that it should have this flag.","F"
"36","So yeah, I mean that overall wish actually is to extend our, um, services, you know, as for now our costumer mainly, um, fill out service your post or over the, um, portal, which we've set up last year.","NULL"
"153","Because let's say a manager runs the survey, so you will receive the survey in some form and then be able to fill it out.","F"
"73","There's just some, some small stuff that we need to specify, but, uh, I think that's the reason why we have this meeting in the end.","NULL"
"435","No, nothing.","NULL"
"390","And then this is a simple flag displayed or not displayed.","F"
"490","Yeah, it makes sense.","NULL"
"147","So I think maybe, yeah, maybe it will make sense to sort of come up with the generalized, um, set of texts.","A"
"651","Yeah, I think I'm good.","NULL"
"641","Whereas let's say a CSV file simply contain the data, which is in the charts, but just let me know if, if there is the requirement to do so.","F"
"314","Okay.","NULL"
"646","Yeah, makes sense.","NULL"
"81","Okay.","NULL"
"578","No, technically we don't have to, we can hard-code translation, codes, and then simply register translations for these codes.","A"
"148","But I mean, I already liked the idea of text.","NULL"
"513","I'm not sure.","NULL"
"660","So yeah, I think it's, you, you both have a good overview now and you'll hear from me soon.","NULL"
"306","Maybe he asks them what motivates you most at work.","NULL"
"409","I mean, what if let's, let's say you have, um, out of 10 questions in your survey, you have three questions regarding, uh, let's say communication within the team and these three questions they are related.","NULL"
"343","Or making maybe, maybe we should just create a new question type.","NULL"
"315","So yes, exactly.","NULL"
"246","You can just use the mouse cursor and drag the cart to the, to the area.","A"
"437","Maybe a little cough.","NULL"
"656","Trust me.","NULL"
"241","At the bottom side is, I don't know, or I don't care.","F"
"427","Oh yeah?","NULL"
"19","No, he is not.","NULL"
"296","Honestly I cannot say just out of my head, I guess I would have to like do that.","NULL"
"289","So you mean like in the end of the survey, you can have, uh, some of that somewhat the first question creator and, uh, the, the guys of the survey of the guys that they decided to be off, the roads can agree to this or, or something like that.","F"
"62","Yeah.","NULL"
"396","That we are now found the concepts about this, because this will be a really, really important feature.","NULL"
"196","So as to assign, um, which team leader can interact with which employees, so where, where does, where do they belong in, in the hierarchy or maybe even from the project manager side, uh, which team leaders belong to this, uh, project manager.","F"
"208","You don't need a lot of, I mean, we, we talk, um, top level managers of a business here probably to be overkill if, if a business would have more than one managing this, this, this little, um, aspect of the business, right.","NULL"
"171","We already have that, but two, we actually need to have underlying users.","F"
"263","Because this is already really, it was just a really idea actually.","NULL"
"586","So once the Spanish has been done.","NULL"
"99","Yeah.","NULL"
"21","Uh, this information didn't reach me, but, uh, that's fine with me.","NULL"
"254","Right.","NULL"
"280","It's the scale question, like some engagement questions and like that, uh, they can only be used to measure engagement or engagement related topics.","F"
"364","Yeah.","NULL"
"234","I think you're both muted, but maybe, maybe, so maybe Mark, can you hear me now?","NULL"
"571","But now, well, I would give the admin the possibility to correct the translation at least, but just, just as we clear, we are now talking about two different things.","F"
"49","No, actually there, there isn't, I mean, super admin.","NULL"
"46","Right.","NULL"
"170","If, if you're talking about, we simply send an email, I mean, you could just, um, specify a list of emails and that's fine.","F"
"260","Yeah.","NULL"
"658","For sure.","NULL"
"157","Yeah.","NULL"
"402","Um, yeah, I have a small, um, how should I say I thought about this and maybe we talked about the different, uh, types of questions.","NULL"
"173","Yeah.","NULL"
"353","This idea of user one is nice.","NULL"
"238","Like everybody knows them, uh, of course single and multiple choice questions, and maybe we can also add something like swipe questions so that you can have maybe a left-hand side, the right-hand side and a button bottom side.","F"
