"id","req_specification","class"
"726","As a tester, I want to ensure that FABS is deriving fields properly through a robust test file plus a follow up check.","A"
"742","As a Publisher, I want to know how many users have previewed a dataset, so that I know how interest in a dataset relates to its actual download numbers.","F"
"1087","The other one, would it be something we could do? Just run a query and let them pick it up? Isn't that all you're doing?","NULL"
"1034",".","NULL"
"33","As a site visitor, I want to subscribe to an RSS feed of upcoming courses and events, so that I am up to day without having to visit the site.","F"
"1050","As a Staff member, I want to Manage Affidavits, so that I can ensure compliance with the requirements prior to the hearing.","F"
"1097","Do we have anything that we need to talk to them about today? No? That's good. Today is what? 3/18. Friday.","NULL"
"650","I know what project this is.","NULL"
"491","I don't know what's going on, still opening.","NULL"
"174","The easier thing to do is have Data Collector. The previous screen do something similar in Data Collector and then do a web service call. I don't know what that XML file is, if that's anything.","NULL"
"201","When you all did the warehouse...","NULL"
"305","Thanks.","NULL"
"191","That's right.","NULL"
"765","As a designer, I want to have a style guide / design guide / content guide, so that we have a uniform way of delivering product.","F"
"367","Is it?","NULL"
"371","As a Publisher, I want to publish a dataset, so that I can share the dataset publicly with everyone.","F"
"342","These don't look like anything I've ever seen before, so Ken and I were talking about it, and...","NULL"
"541","As a Technical Staff member, I want to update the GIS Property Management, so that I can successfully update the transactional Parcel Pin to reference the GIS layer where the Split or Merged Parcel Pin exists.","F"
"852","As a FABS user, I want to make sure the historical data includes all necessary columns, so that the information in the database is correct.","F"
"1103","That really doesn't mean anything. It used to put a file on the FTP server, but now if you go back to...","NULL"
"1176","That seems...","NULL"
"973","As a moderator, I want to delete a game, so that stories and estimates for this game are no longer stored.","F"
"419","As a user, I want to be able to view a map display of the public recycling bins around my area.","F"
"439","This has got to be cheaper than buying wireless scanners.","NULL"
"36","As an admin, I want to be able to block specific users based on IP address, so that I can prevent spamming on the websites.","F"
"54","As a site visitor, I want to do a full-text search of article body, title, and author name, so that I can find what I want.","F"
"1130","Mike was willing, if we could...","NULL"
"880","I've already got the data in place?","NULL"
"109","As a FABS user, I want to have read-only access to DABS, so that I can view DABS pages without wanting two sets of permissions.","A"
"777","As a Staff member, I want to Assign a Hearing Date, so that I can present the application to the appropriate governing body within the timelines dictated by the relevant County rules and procedures.","F"
"948","And today they're not doing them in LCAM. They just go off and...They print off their inventory and then they checklist it as they're doing their cycle count.","NULL"
"871","As an author, I want to be able to indent / outdent content.","F"
"280","This one escapes the edge for me. It could go either way. That's why I'm asking.","NULL"
"241","Because it's like a sales tool. Our competitors can get there if they want to get there.","NULL"
"226","As a Developer, I want to prevent users from double publishing FABS submissions after refreshing, so that there are no duplicates.","A"
"1163","She was talking about being here.","NULL"
"882","My God.","NULL"
"886","As a Developer, I want to get a Data Package into Julia in seconds, so that I can start using the data in doing analysis and visualizations.","A"
"207","As a trainer, I want to turn a course into an event or an event into a course, so that I can correctly classify anything that was entered incorrectly.","F"
"1189","As an agency user, I want the FABS validation rules to accept zero and blank for non-loan records.","F"
"499","As a user, I want to have nice error pages when something goes wrong, so that I can trust the system and its developers.","A"
"1049","OK, anything else?","NULL"
"562","As an Admin, I want to have a pricing plan and billing system, so that that I can charge users and make my platform sustainable.","F"
"396","When you push record, it starts recording what you write, and there's a little camera in here, and it picks up the things that...","NULL"
"927","Then for the IBT group that we were trying to target, most critical thing, what's coming up and biggest holdback is SCC scan error correction screen. First request, , go to the active logs . We're finding everything. Narrow those certain criteria. With project-related, OK.","NULL"
"71","As a team member, I want to have an updated acquisitions roadmap, so that I can plan accordingly.","A"
"685","Then you would just exclude the other one that has the map point stuff in it? That's what he said.","NULL"
"458","As a developer, I want to have a list of definitions for commonly used terms, so that everyone working on the project can understand each other more easily.","F"
"338","The different swath of epics would be . Not all of them would be by role. Not only would you have epics on both the slides but then you might have, underneath that, another swath of epics for that particular epic that you're breaking down by a particular role.","NULL"
"408","If you think about it from a mirror image perspective, it's like, 'Now I want to go and deal with my contracts.' Is that all? Then you've got to bring in some kind of navigation because you have to have the flow of how you get back to and you'd put that under Navigation.","NULL"
"515","As a Researcher, I want to get a Data Package into SPSS in seconds, so that I can start using the data for doing analysis and visualizations.","A"
"1002","What are we looking at here? What is Trello?","NULL"
"791","What the heck. Can't type.","NULL"
"606","Did the emails say that they're disconnect?","NULL"
"528","As an Inspection Staff member, I want to Create an Inspection, so that I can schedule and assign the inspection.","F"
"943","As a trainer, I want to see the upcoming courses are what I want visitors to notice, so that they register and there's a benefit to my membership.","F"
"134","That would be in line with trying to give direction to new hires about where they need to invest their time, what type of technologies that you should probably be focusing on. That would feed in with our organizational goals as well.","NULL"
"916","OK.","NULL"
"1169","As a participant, I want to be shown all estimates at the same time after all estimators have given their estimate, so that I can be sure estimates are independent and not influenced by other estimates given in the same draw.","F"
"1177","As a moderator, I want to create a new game by entering a name and an optional description, so that I can start inviting estimators.","F"
"1008","As a camp administrator, I want to be able to schedule activities for campers, so that camp workers can easily keep track of who is where at all times.","F"
"1152","Jenny's joining the police force?","NULL"
"306","So what do we have?","NULL"
"202","As a Consumer, I want to download the data package in one file, so that that I don't have to download descriptor and each resource by hand.","F"
"114","But that would only apply to hardwire.","NULL"
"970","Jim, Violet, and Kim. Anybody else?","NULL"
"1141","You're good?","NULL"
"551","As a site administrator, I want to understand how other similar organizations are handling visual design, so that I can make informed decisions about what appears to work well and what doesn't.","A"
"14","As a visitor, I want to download presentations, PDFs, etc. on Scrum, so that I can learn from them or use them.","F"
"1171","I forgot what it was.","NULL"
"1017","Hey Violet, hey Kim.","NULL"
"997","I think if the teams are structured the right way and the iterations are structured the right way, then the mix will be good on each team to where the new hire can pair program with the thing that they're interested in accomplishing.","NULL"
"477","As a team member, I want to see the first iteration of beta up on cloud.gov.","A"
"583","As a site admin, I want to move people in a trainer's class from a pending state to the registry once I have received proof of payment from the trainer.","F"
"1036","No, plugs. This only applies to plugs. If I went back and do a hardwire, then it'll have estimate through here.","NULL"
"251","As a Researcher, I want to be able to translate my EML dataset to a Data Package, so that I can benefit from the wide array of tools available for Data Packages.","F"
"884","As a website user, I want to see updated financial assistance data daily.","F"
"878","As an Applicant, I want to Complete Building Development Project, so that I can receive any posted bond and/or obtain occupancy.","F"
"494","I'm thinking that scenario. That choose hardwire and plug. I'll put the estimate field up here, which, we want that now...","NULL"
"295","Which one?","NULL"
"863","As a site editor, I want to maintain a FAQ section, so that support gets fewer easily answered questions.","F"
"780","As an agency user, I want to use the schema v1.1 headers in my FABS file.","A"
"667","That's the kind of thing that we want to capture, put on the issues log and .","NULL"
"240","It's managing assets and then actions. I think there's still going to be two.","NULL"
"75","Yeah.","NULL"
"423","That's what's next thing on deck. It's just a matter of trying to wrap things up. Getting better about scope creep, so we can get onto these. Get these things up, , is the best thing our team can do.","NULL"
"751","As a FABS user, I do not want DABS banner messages and vice versa, so that I have the appropriate information for my application.","F"
"869","Yeah, Susan, no rush on the email I sent yesterday for the change request. I know they want to take their time and do it right and give as correct an estimate as possible. We did our best-guess scenario, and that's all we could do. I wanted to let you know not to have to push that through faster than they wanted to do it.","NULL"
"1027","I'm sorry. Deal with it. I haven't even written down what day of the week it is yet.","NULL"
"1111","Yes.","NULL"
"9","As a site admin, I want to delete any course or event, so that I can remove things that will no longer occur.","F"
"995","they go directly to the landing spot or whatever.","NULL"
"736","Are you logging is as CinBell?","NULL"
"399","As a Developer, I want HDF5 integration, so that I can integrate data-packaged data with pipelines that use HDF5.","A"
"575","Moral of the story...","NULL"
"569","As a Publisher, I want to know what do next after signing up, so that that I can get going quickly.","F"
"919","As a user, I want to be able to create an acocunt, so that I can create my own profile.","F"
"231","As a trainer, I want to copy one of my courses or events, so that I can create a new one.","F"
"245","something missing.","NULL"
"152","As a Consumer, I want to download a Data package at a particular version, so that that I know it is compatible with my scripts and system.","F"
"1009","As a site editor, I want to create the content of the What Is Scrum section, so that it's there for visitors.","F"
"766","No.","NULL"
"1028","But you might have...","NULL"
"888","I did find several locations that seemed to be where the primary account was, a 12, 20, 6, 10, which is the new, right? One of them was the RDC, which was in there, which looked like it was grapevine...Something like that.","NULL"
"447","Hopefully it worked for you, but we had to go through some crazy hoops with the IIS stuff that Michael couldn't initially. It's kind of crazy.","NULL"
"149","I'm not touching that.","NULL"
"622","Fast Path. Path. Like a walkway, pathway.","NULL"
"330","There's two other items on there that I'm still looking into, and we'll get back to you guys as soon as we can. Regarding the that seems to be occurring, and the part number. The batches and the part number.","NULL"
"314","Or we can do it at a different time.","NULL"
"277","A new interface is safer. It's a safer way to do it.","NULL"
"764","You sure ?","NULL"
"679","As a site editor, I want to be able to designate whether or not an ever makes the home page, so that the best content is featured most prominently.","A"
"590","As an NSF employee, I want to narrow down the universe of CMS options and identify/prioritize key considerations for getting to the next step.","A"
"1046","Why?","NULL"
"275","As a Staff member, I want to Prepare for and Support Hearing Execution, so that I can ensure all pre-hearing requirements are satisfied and staff and Applicant are ready for the hearing.","F"
"1166","I got it.","NULL"
"717","He just showed up.","NULL"
"27","As an NSF employee, I want to have a final workshop to identify key lessons and features for the content management system decision.","A"
"159","As a company, I want to join the Scrum Alliance by paying a corporate membership fee, so that I can show the company's support of Scrum.","F"
"300","As a moderator, I want to edit an item in the list of items to be estimated, so that I can make it better reflect the team's understanding of the item.","F"
"315","As a camp administrator, I want to be able to suspend a camper who had behavioral problems.","F"
"561","As a company accountant, I want to view all available activity fees online, so that I can easily create a bill statement.","F"
"694","As a FABS user, I want to have my validations run in a reasonable amount of time.","A"
"1110","As an admin, I want to be able to add or remove recycling facilities' information, so that users get the most recent information.","F"
"674","As an data user, I want to receive updates to FABS records.","F"
"1162","Smiley recognizes that this will be chargeable work. What they want is they have these 22,000 disconnects. They want to retire all the items that are not related to the central office code, and not do anything to the ones that are already color coded.","NULL"
"1035","As a Developer, I want to get a Data Package into Python in seconds, so that I can start using the data for doing analysis and visualizations.","A"
"641","Can we have a for the attitude?","NULL"
"225","As a user, I want more information about how many rows will be published prior to deciding whether to publish.","F"
"287","As a tester, I want to have access to test features in environments other than Staging, so that I can test any nonProd feature in any environment.","F"
"355","As an owner, I want to invite someone using their email to sign up and become a member of my Publisher, so that that they are authorized to publish data packages under my Publisher.","A"
"918","Right now you cannot retire inventory equipment. You have to move it to in service and then retire it. This one I remember, because I asked him about this 166. I sent him a bazillion emails on it. I remember, when I finally understood it. It makes perfect sense...","NULL"
"1201","As a Publisher, I want to be able to provide a visualization of data in the Data Package, so that I can provide my analysis and show my work to users of the data.","F"
"414","As a workshop attendee, I want to have a summary of what we learned, so that I can understand our next steps and how they apply to me.","A"
"272","That's .","NULL"
"403","In two weeks we've got a URL, and you logon, and it checks your credentials through the Notify test, whatever, database, and he's got that home page with that data behind it.","NULL"
"1144","As a broker team member, I want to ensure the Broker resources, validations, and P&P pages are updated appropriately for the launch of FABS and DAIMS v1.1.","F"
"700","Those are the kind of issues that scare the crap out of me. I know they're trying to use it.","NULL"
"795","As a corporatesponsor, I want to make my logo randomly appear on the home page, so that others see the company's support of Scrum.","F"
"102","As a Broker user, I want to have PPoPZIP+4 work the same as the Legal Entity ZIP validations.","A"
"189","As a site visitor, I want to view lists on the site of all Certified Scrum Masters, Practitioners, Trainers, and Certified Scrum Product Owners.","F"
"167","OK, well. Estimate.","NULL"
"45","What are you saying, 'Fast pass,' or...?","NULL"
"350","As a site member, I want to subscribe to an RSS feed of news, so that I remain sufficiently and easily informed.","F"
"800","As a designer, I want to have a new social media wireframe, so that I can begin implementing design.","A"
"695","As an estimator, I want to see all items we will try to estimate this session, so that I have a feel for the sizes of the various items.","F"
"968","we should change it to 2.0Male Participant: What's being worked on then?","NULL"
"618","As a Developer I want to quickly access Broker application data, so that I can investigate issues.","F"
"744","It would be right here.","NULL"
"1191","Have the statuses.","NULL"
"633","Will this take scanning information?","NULL"
"985","As a researcher, I want to develop the user research protocol for internal workflows, so that we can begin testing against a CMS prototype.","A"
"758","","NULL"
"438","SQL could be . Commands can go back and forth a lot.","NULL"
"986","As a camp administrator, I want to be able to notify parents all at once, so that they can be notified of any upcoming events.","F"
"1042","Yeah. That'll be the easy one.","NULL"
"793","As a company, I want to have a website that is easy to use, so that I can upload or delete stuff step by step.","A"
"595","That is weird.","NULL"
"304","If the humidity wasn't so high, it wouldn't be as bad. I don't think so.","NULL"
"307","As a site editor, I want to assign priority numbers to news items, so that I can indicate which articles I want featured most prominently on the site.","F"
"118","It's exactly the same thing.","NULL"
"368","As a CSM, I want to be charged a fee once I am approved for Practitioner status, so that my certification status can be activated.","A"
"233","As a FABS user, I want to submit a citywide as a PPoPZIP and pass validations.","F"
"827","As a participant, I want to always have the cards in the same order across multiple draws, so that it's easy to compare estimates.","A"
"484","You can very well have an acceptance criteria that says, 'When I login I'm redirected to a page that shows me what stuff is assigned to me.' That's perfectly valid.","NULL"
"947","at some level, that's fine, we can stick it in there.","NULL"
"170","Estimate for those?","NULL"
"1106","That's in the embedded file. At the bottom it says powered by . That's a link to one's home page. Maybe I can...","NULL"
"552","As a site member, I want to view the profiles of other members, so that I can find others I might want to connect with.","F"
"972","I know, I care. Then CTDI and shift two. That's what I have to talk to them about. What do you all have?","NULL"
"452","As a UI designer, I want to redesign the Resources page, so that it matches the new Broker design styles.","F"
"696","I can ask him. I can say, 'We talked about this, would you want us to verify that the clause are closed in LCAM as well, or is that not part of what we're doing?' And say, it's two if we don't have to worry about the clause, it's three if we have to worry about the clause.","NULL"
"7","As a parent, I want to be able to create an account, so that I can sign up my kids for camp online.","F"
"310","I'm doing it . It should be...","NULL"
"1117","I know.","NULL"
"574","As a Broker user, I want to submit records for individual recipients without receiving a DUNS error.","F"
"169","As a moderator, I want to delete an item from the list of items to be estimated, so that we can remove it and not estimate it.","F"
"932","As a site visitor, I want to know as soon as I visit what on earth Scrum is and why it needs an alliance, so that I don't bounce immediately oﬀ the page.","F"
"25","As a moderator, I want to copy/paste stories from a spreadsheet, so that I can get started more quickly.","F"
"52","As a Broker user, I want the D1 file generation to be synced with the FPDS data load, so that I don't have to regenerate a file if no data has been updated.","A"
"1065","As a camp administrator, I want to provide bi-weekly feedback to camper's parents, so that they can be aware of their child's behavior and performance at camp.","F"
"294","As a Plan Review Staff member, I want to Assign Plans for Review, so that I can ensure plans have been assigned to the appropriate Plan Reviewer.","F"
"757","Even worse, really high. See if anybody notices. I might do that, now that you said that . Whenever I get to the 90s, instead of it being issue number 90 it will be like 92. Or something.","NULL"
"328","This would mean that DC3 would need to be loaded on those techs' laptops?","NULL"
"58","What's the Search at the top and the Search as a tile? That's confusing to me. What does that mean?","NULL"
"412","Not on the journal change. Estimate is, but isn't. So, that's what this change is, which it only took us 45 minutes to get there.","NULL"
"199","As a Publisher, I want to be able to overwrite the previously tagged datapackage, so that that I can fix it if I mess up.","F"
"987","Presently, those release counters, how many business days have we...","NULL"
"665","What did the login page .","NULL"
"358","Did she give you that template data or anything?","NULL"
"1172",".","NULL"
"825","Yeah.","NULL"
"171","As a site member, I want to subscribe to an RSS feed of jobs available, so that I can read them without visiting the site.","F"
"1079","Sorry.","NULL"
"84","As a Publisher, I want to add type information to my data, so that it is more useful to others and can be used better with tools like visualization programs.","A"
"862","Mm-hm. Look at the paper. It's super cool.","NULL"
"1202","As a RepositoryManagerResearcher, I want an app that acts as a match-making service for packaging data, so that owners are paired with data packagers.","F"
"418","Should be in charge of doing that...","NULL"
"450",".","NULL"
"442","As a site administrator, I want to understand how other similar organizations are handling content, so that I can make informed decisions about what appears to work well and what doesn't.","A"
"804","As a team member, I want to have a prototype strategy, so that I understand how we will gain understandings from tests that will drive recommendations.","A"
"197","As a moderator, I want to have the 'estimate' field filled in automatically if all estimators show the same card, so that I can accept it more quickly.","F"
"518","As a ProspectiveApplicant, I want to research requirements and to select a service, so that I can find the relevant service and/or application type to initiate via the online portal.","F"
"605","As a user researcher, I want to set up a website recruitment test, so that I can see if we can recruit users in real time from the website.","A"
"1037","As a user, I want to have the application respond quickly to my actions, so that I don't get bored.","F"
"1125","As a Civic Tech Activist, I want to make it easy to assess the quality of data stored by the government, so that I can make sure that government is living up to its transparency commitments.","A"
"445","Please enter the conference pin number.","NULL"
"747","As a broker user, I want the historical FABS loader to derive fields, so that my agency codes are correct in the PublishedAwardFinancialAssistance table.","F"
"774","As an NSF employee, I want to know where the initial in-person meeting will be, so that I can plan on attending.","F"
"64","As an Owner, I want to edit my profile, so that that it is updated with new information.","F"
"493","We've got Fast Path.","NULL"
"755","As a camp administrator, I want to be able to schedule tasks/activities for a specific camp group, so that I can track each groups daily/weekly and monthly activities.","F"
"69","As a user, I want to see sensible and predictable URLs, so that the application feels logical and transparent.","A"
"761","Yes.","NULL"
"187","As an agency user, I want the FABS validation rules to accept zero and blank for loan records.","F"
"920","Do you know which report she was running?","NULL"
"299","As a camp administrator, I want to store camper's immediate parent/guardian's information, so that I can easily call to notify them in case a grossly unacceptable behavior.","A"
"81","As a moderator, I want to delete my account, so that account information and games are no longer stored.","F"
"136","As a Developer, I want to add the updates on a FABS submission to be modified when the publishStatus changes, so that I know when the status of the submission has changed.","F"
"112","As an Agency user, I want FPDS data to be up-to-date daily.","A"
"67","Me?","NULL"
"1146","Patrick's our DC3 expert. It's his baby.","NULL"
"1081","until now.","NULL"
"1056","As a broker team member, I want to add the 00***** and 00FORGN PPoPCode cases to the derivation logic.","F"
"278","As a Data Analyst I want to download a data package, so that that I can study it and wrangle with it to infer new data or generate new insights.","F"
"267","I don't know if that one's as good an example. I think, we had the right people on that.","NULL"
"61","Either way, it'll be a change for us. It is not like we could just allow them to send it to the existing interface and it'll change the part with what they want.","NULL"
"56","OK.","NULL"
"1012","Good.","NULL"
