"id","req_specification","class"
"527","As a camp administrator, I want to be able to remove campers if they don't attend the camp anymore, so that I can keep the records organized.","F"
"250","As a site editor, I want to set the following dates on a news item: Start Publishing Date, Old News Date, Stop Publishing Date, so that articles are published on and through appropriate dates.","A"
"1155","As a Public User, I want to Search for Information, so that I can obtain publicly available information concerning properties, County services, processes and other general information.","F"
"1198","As a Publisher, I would like a tool to check data availability persistence after publication.","F"
"1124","As a Plan Review Staff member, I want to Review Plans, so that I can review them for compliance and either approve, or fail or deny the plans and record any conditions, clearances, or corrections needed from the Applicant.","F"
"487","Right. Whenever we deploy the test then I'll do that.","NULL"
"166","As an owner, I want to view all the people in my organization and what roles they have, so that that I can change these if I want.","F"
"610","As a VisualDesigner, I want to create a moodboard to aid with visual design concepts for the nsf.gov website, so that we can discuss different design concepts with stakeholders.","A"
"805","Yeah. Today, for hardwire the screen has frame, but for plugs it does not.","NULL"
"155","That they didn't have CLLIs because initially they were thinking that the ship to codes, or the to location codes were CLLIs. But, no we haven't tried to do the Fuzzy Logic Lookup.","NULL"
"952","Yeah. I finished a script recently, was finishing up early this morning, to take all those and get them back to where they'll go through workflow again, reprocess so I can execute that procedure.","NULL"
"928","As a camp worker, I'm able to report necessary repairs to the manager that the camp is needed of.","F"
"407","As a Website user, I want to access published FABS files, so that I can see the new files as they come in.","F"
"478","Then the asset .","NULL"
"1147","As an estimator, I want to see the item we’re estimating, so that I know what I’m giving an estimate for.","F"
"657","As a Practitioner, I want to write an article for the site with a small graphic shown with the article showing my CSP or CST status, so that others know my certifications when reading.","F"
"714","As a Staff member, I want to Process the Appeals, so that I can track the outcome and record the impact on the relevant records.","F"
"661","As a camp worker, I'm able to report a list of supplies to the manager that the camp is short of.","F"
"177","As a stakeholder, I want to have a decision on whether or not the blog aggregator may work for beta, and if not what will.","A"
"796","The login.","NULL"
"1186","As a site admin, I want to be emailed whenever a job is submitted, so that I am aware of it and can decide if I want to post it.","F"
"799","Yeah.","NULL"
"461","Where the grid is right now.","NULL"
"99","As a trainer, I want to be assured that no one can submit the same answers multiple time and skew my results, so that my ratings are accurate.","A"
"262","As an Applicant, I want to Modify my Application, so that I can successfully change information on an application.","F"
"429","As an NSF employee, I want to understand the process of switching the cloud.gov hosting plan over from prototype to FISMA low.","A"
"597","Here is an example for code files, where we're going to be implementing the Telerik control map, I guess.","NULL"
"844","Yeah. I can do that, going to get things going. You said David installed that, or who installed that for you?","NULL"
"123","If somebody wants to do that for me, that would help me out.","NULL"
"1119","As a team member, I want to have a platform that allows me to rapidly prototype HTML ideas.","A"
"940","As a camp administrator, I want to be able to add campers, so that I can keep track of each individual camper.","F"
"686","As a developer, I want to have created database indexes, so that the queries run as fast as possible.","A"
"784","Yeah, we've done it forever.","NULL"
"711","As an NSF employee, I want to understand work performed, so that I can understand when and what I can use later.","A"
"340","...from meeting they called me about how it's done. I said, 'The meeting was only 20 minutes. I should have been in the meeting.' 'Why?' 'I wasted one hour explaining to three different people, all in the same meeting. I was not in the meeting.' This would have saved time, everybody's time. That's number one.","NULL"
"699","As a camp administrator, I want to be able to delete tasks/activities I scheduled, so that I can keep the schedule clean of unneeded activities.","F"
"604","Filtered by color?","NULL"
"646","As a site administrator, I want to set the annual fees for members, Practitioners and Trainers, so that fees can be set without involving a programmer.","F"
"106","As a user, I want the DUNS validations to accept records whose ActionDates are before the current registration date in SAM, but after the initial registration date.","A"
"666","Who do you need to sit down with?","NULL"
"1173","That's because we went in and cleaned those up prior to passing the data to you.","NULL"
"692","As a user, I want to have my personal information kept securely in the database of the website, so that I will not suffer from identity theft or telephone harassment.","A"
"860","As a camp administrator, I want to be able to delete parents from the database, so that I can keep my pages free of unneeded clutter.","F"
"533","As a trainer, I want to read information of relevance only to trainers, so that the Scrum Alliance can share information with me easily.","F"
"227","As a Consumer, I want to browse and find publishers, so that that I can find interesting publishers and their packages.","F"
"1208","As a Trainer, I want to include additional details in my profile page about me, so that others can learn about me and decide if I am the right trainer for them.","F"
"288","There was always a big debate on the equipment is not worth to roll a truck, to go out and actually get. They're so far behind on it. They don't have the people to do it. They want to clean the records off.","NULL"
"1121","As a Publisher, I want to use a publish command to update a data package that is already in the registry, so that it appears there.","F"
"1032","Sure, no problem. .","NULL"
"621","I've got to see. Mike was thinking that those would be treated as two separate records. I hear what you're saying. We have a whole record leaving and a whole record coming in. To me, it would be changing the VIN.","NULL"
"324","As a corporatesponsor, I want to display my logo on a corporate sponsors page, so that others see the company's support of Scrum.","F"
"1025","As a Staff member, I want to Manage Bonds, so that I can track and manage bonds throughout the lifecycle of the project until release.","F"
"1005","As an agency user, I want to ensure that deleted FSRS records are not included in submissions.","F"
"509","Yeah.","NULL"
"416","When we did a look at the data that was falling into , I haven't looked at the data falling into LCAM, but nearly every Saturday and Sunday, weekend days, and even sometimes holidays, we saw transactions falling into from people doing scanning.","NULL"
"388","As a camp administrator, I want to be able to delete campers from the database, so that I can keep my pages free of clutter.","F"
"1134","That makes sense, because it's his data.","NULL"
"346","As a stakeholder, I want to see the results of user research, so that I can determine if the CMS is right for me.","F"
"720","As an owner, I want to be sure that USAspending only send grant records to my system.","A"
"1137","As a Practitioner, I want to include additional details about me in my profile page, so that I can showcase my experience.","F"
"908","Don't want it to get lost.","NULL"
"942","As an Admin, I want to invite someone to join the platform, so that that they can start contributing or using data.","F"
"992","As a Researcher, I want an app that generates an OpenRefine reconciliation API endpoint from a Tabular Data Package, so that I can use it to clean messy data.","F"
"253","We not even know. You're just walking in, and finding out yesterday afternoon. You said, 'What's going on?' , 'We need some help from somebody.' Get all the people as soon as possible, so we can all work together and then go through like 10 different , and finally come to you for three minutes work.","NULL"
"684","Just like the home search sites where you'd start on the map and then you can add criteria to it to narrow your search down. If you only want to see single family homes, or condos, you can filter that out. That would be like poles or...","NULL"
"145","I don't know where to find it, to be honest.","NULL"
"778","As an owner, I want to remove someone from membership in my publisher, so that they no longer have ability to publish or modify my data packages.","F"
"1093","As a user, I want to be able to view a map display of the special waste drop off sites around my area.","F"
"670","As a recyclingfacility, I want to be able to communicate directly with the site admin and convey any issues or concerns I have, so that they fix them.","F"
"753","you and Larry and Kim think about that.","NULL"
"488","As a CSM, I want to have my name listed in the registry without becoming a member of the site, so that employers or others can verify my certification.","F"
"850","As a camp administrator, I want to be able to make nametags faster, so that I don't have to spend two hours making 200+ nametags","A"
"269","As a user researcher, I want to know when outreach to lists is successful, so that I can plan on a new release to the next listserv on the priority list.","F"
"234","I know we said, 'Home page, basically that's where you're going to .' I think when we talked about that, how will that tie this together?","NULL"
"309","As a user, I want the flexfields in my submission file to appear in the warning and error files when the only error is a missing required element.","F"
"803","As a developer, I want to have the subdomain beta.nsf.gov be set up, so that I can deploy a beta site to it.","A"
"212","Your login was not successful.","NULL"
"232","As a Researcher, I want to get a Data Package into Excel in seconds, so that I can start using the data for doing analysis and visualizations.","A"
"832","As a user, I want to get feedback when I enter an invalid zip code.","F"
"741","Side bar. Part of this, I'm going to talk with Michael about it. As far as the context switching, maybe we can talk about this in the next meeting, and continue onto this. Let's start thinking about this, but we, as a group, need to start doing a much better job at estimating.","NULL"
"808","and then he can mock up something.","NULL"
"428","By credentials. There's things we can put in an iteration so that in two weeks when we have our...","NULL"
"1158","I've got much better ideas after this conversation.","NULL"
"903","Yes.","NULL"
"140","Get the whole team, except for Susan!","NULL"
"301","That's right. I guess the first question is, is this really chargeable work because they pay for maintenance. Smiley's under the impression that...","NULL"
"465","Hi, .","NULL"
"401","As a site visitor, I want to access old news that is no longer on the home page, so that I can access things I remember from the past or that others mention to me.","F"
"856","Does LCAM store the clause?","NULL"
"614","That's the way our mind works. Not yet. This one in particular we're going to definitely be working through. But as far as the other ones that are in class people can pick the ones they'd like to see first. With that, on to issues. Did everybody see these? A couple of seconds. Any new ones anybody wants to add to the list?","NULL"
"348","As an agency user, I want to have all derived data elements derived properly.","F"
"503","As a parent, I want to be able to see if I made all the necessary payments.","F"
"1204","As an NSF employee, I want to know how visual design directions were developed, so that I can make better design decisions in the future.","A"
"436","","NULL"
"326","As a Data user, I want to have the 12-19-2017 deletions processed","F"
"906","There it is. All of this has my name on it. Let's see what Kevin . Yeah, he's supposed to test that and...","NULL"
"1174","If you're running it on your phone.","NULL"
"840","As a Staff member, I want to Send or Post Citations and Fines, so that I can successfully send the Notice Of Violation document to the property owner and log information about the action.","F"
"361","Jasmine and...","NULL"
"266","It's planned to be in there.","NULL"
"540","As a Publisher, I would like an integration with Open Refine, so that I can output cleaned Data Packages.","A"
"37","Go with one hour.","NULL"
"563","It'll compile well. That's really all we need. It compiles. Adam. So you know how this one's...So you need to...","NULL"
"1132","What do we know about the answers? What do we have on there?","NULL"
"121","I have a couple of questions. When they're doing this cycle count can the equipment be moving behind the scenes?","NULL"
"1113","As a Publisher, I want to have private data packages, so that I can share just with my team.","F"
"1080","What? I'm deaf now. I can't hear anything.","NULL"
"959","As a site member, I want to scroll through a listing of jobs, so that I can see if there any I am interested in.","F"
"385","I just saw the number of people.","NULL"
"184","You have it broken down a little bit more inside there.","NULL"
"824","We're attacking it from the opposite side. We're attacking it from the top down instead of the bottom up. Now I've got a placeholder for blah, and I need it to do blah really, really well, but I don't know what blah looks like yet.","NULL"
"23","It's Friday.","NULL"
"873","As a Developer, I want to prevent duplicate transactions from being published and deal with the time gap between validation and the publishing decision.","A"
"293","As a Publisher, I want to unpublish a data package, so that it is no longer visible to anyone.","F"
"769","Don't worry, so I think we've","NULL"
"612","Oh, OK.","NULL"
"377","As a moderator, I want to estimate a story we estimated earlier in the session again, so that we can give a new estimate if we feel different about the story after estimating other related stories.","F"
"224","Fast Path.","NULL"
"89","As a Developer, I want to get a Data Package into Clojure in seconds, so that I can start using the data in doing analysis and visualizations.","A"
"1115","As a trainer, I want to show my rating up on my profile page, so that site visitors can choose wisely.","F"
"545","The face for the control, it should have...","NULL"
"133","As a UI designer, I want to report to the Agencies about user testing, so that they are aware of their contributions to making Broker a better UX.","F"
"511","As an executive, I want to have full access to data related to my company, so that I can have a sense of my company's performance.","A"
"104","Open a given single conversation?","NULL"
"647","Bye","NULL"
"204","As a Researcher, I want a tool that can generate basic statistics about a dataset, so that I can get a quick preview of the data.","F"
"268","As a Developer , I want to clarify to users what exactly is triggering the CFDA error code in each case.","F"
"651","As an Agency user, I want historical FPDS data loaded.","F"
"1206",".","NULL"
"341","'Then, you can try it out, and then I can help you with it, and then maybe next week I'll give you just a small thing that you can do by yourself.' Then, so on and so forth. That's a huge concern of mine.","NULL"
"19","Just to say, 'This is what we're doing,' and then build from there, unless you...","NULL"
"469","It doesn't matter. I don't care. There's...","NULL"
"1039","As a web recruiter manager, I want to confirm the recruiter is set up and working properly, so that I can deploy it on more pages.","A"
"616","As a developer, I want to attend some UI/UX lessons, so that I can develop an awesome and beautiful features website.","A"
"1142","?","NULL"
"122","As a site administrator, I want to read practicing and training applications and approve or reject them, so that only applicants who qualify can become CSPs or CSTs.","F"
"809","As a Staff member, I want to Develop a Staff Report, so that I can publish and distribute the report according to business rules.","F"
"1185","As a ResearcherPublisher, I want to know that my data conforms to its Data Package profile, so that I can feel trust in the validity and usefulness of the data.","F"
"216","As a Customer, I want to Create a Customer Portal User Account, so that I can log on to the Customer Portal and perform transactions that first require user authentication.","F"
"392","What we need then, is, we need specific things with dashboard, sharing functionality, and managing projects.","NULL"
"495","Yeah.","NULL"
"963","We need to some of these things. Baski, did you figure out how to give a response on some things?","NULL"
"192","If we get a meeting .","NULL"
"649","Yeah.","NULL"
"547","As a camp administrator, I want to be able to keep track of which camper submitted which forms, so that legal issues are avoided.","F"
"899","On what CLLI ?","NULL"
"559","Then you can slowly move one function over at a time.","NULL"
"949","We will provide the front page with conversations.","NULL"
"648","As a Consumer, I want to know that the data I am downloading is good and can be relied on, so that that I don't have to check it myself or run into annoying bugs later on.","F"
"1099","Yeah.","NULL"
"489","Yeah, I looked. It was OK.","NULL"
"70","The beginning of April is next week.","NULL"
"5","As an NSF employee, I want to see how the user recruitment form looks and behaves on a sample page, so that I can understand the impact the recruitment will have on the NSF page.","A"
"362","I'd say at least, if you're thinking you don't want to bother somebody when you're having a meeting, put them on there as optional. At least then they know that it's going on. If they don't have time, they can know that if they're getting questions from three different people, and those three different people are at the meeting...","NULL"
"116","As a Consumer, I want to see some example data packages quickly, so that I get a sense of what is on this site and if it is useful to look further.","A"
"818","As an Owner, I want to design a schedule from the UI SME, so that I know the potential timeline of the UI improvements wanted.","F"
"516","As a Developer, I want to get a Data Package into Node, so that I can start using the data for doing analysis and visualizations.","A"
"637","Only a dozen of six words. You're going to ask your ,so that port work with the tile service. Michael, is starting today, what he did. If there is a little background, I can compile.","NULL"
"124","They've got the scanner. They can have their cycle count up and scan the stuff in. That stuff sounds more like DC3, which I did have that thought when I was talking to him about it. I don't know why I didn't invite you to this meeting. My bad.","NULL"
"768","As an Agency user, I want to be able to include a large number of flexfields without performance impact.","F"
"662","...your desktop. Internet Explorer...","NULL"
"291","Do we need to...?","NULL"
"391","I just wanted to clarify.","NULL"
"8","Yeah, that's fine.","NULL"
"446","OK. I guess if we're through talking about that the third thing on my list was...I don't know. I heard somebody else join. Was that Ron, by any chance? OK, I guess not. The Shields interface stuff I know Brenda sent another email this morning, and we've looked briefly at that.","NULL"
"966","There is TFS. My point is that, from my experience, allocating somebody 60 percent to one thing and 40 percent to another thing doesn't allow you to develop a true velocity for your team, so you'll never know what your team is capable of.","NULL"
"1190","As a Developer, I want Feather integration, so that I can integrate data-packaged data with pipelines that use Feather.","A"
"366","As a Broker user, I want to help create content mockups, so that I can submit my data efficiently.","F"
"553","If I see a bunch sixes or sevens or something or a bunch of tens and somebody uses a seven, then it's like, 'Why is it?' and then try to address what the concern is. So like Patrick in , what would make it better than a seven?","NULL"
"801","I just sent it a few minutes ago. Let me see. I see...","NULL"
"1003","If it's going to be database also, I'd take a and set a task for that.","NULL"
"1073","As a UI designer, I want to schedule user testing, so that I can give the testers advanced notice to ensure buy-in.","F"
"732","No. It's the second part of that because I don't think we do. I want them to know it's not our problem.","NULL"
"454","All right, I'll take that back to them.","NULL"
"529","As a moderator, I want to view a transcript of a game, so that I can see the stories and estimates.","F"
"72","As a research participant, I want to make sure that the appearance of the prototype does not distract from the workflow, so that I can complete the user interview.","A"
"779","We decided Baski was going to see if that was possible .","NULL"
"603","As a user, I want to choose a flexible pick up time, so that I can more conveniently use the website.","F"
"510","As a Publisher, I want to be able to restore the deleted data package via cli, so that that it is back visible and available to view, download.","A"
"198","That's right. Once you have that streamlined, then I give you everything and say, ' , come back in two weeks .'","NULL"
"455","As an Agency user, I want to be able to include a large number of flexfields without performance impact.","F"
"430","As a moderator, I want to import stories from a spreadsheet, so that I don't have to copy and paste each individual story.","F"
"578","As a user, I want to be able to use Unicode, so that I can use any language I like.","A"
"951","That's something that's maybe not really there. In Notify it's there right now. But to me, managing a project is the combination of those conversations and assets. That's more of a, 'How do I take all of these assets I have and these things I have to do and reconcile those together?'","NULL"
"806","As a Publisher, I want to add useful metadata or add in new data columns to make the dataset more useful.","F"
"915","We as a group have caused a lot of our need to do context switching, because we oftentimes aren't done when we say we're going to be done. For whatever reason that is, and then we end up in a bind because we can't wait until we're done with something before we say we can...We have to keep things in the queue, in the schedule. Maybe next time, be thinking about that.","NULL"
"1040","As a site visitor, I want to view a course I can click on the trainer's name and be taken to the trainer's profile, so that I can read more about a trainer before registering for a course.","F"
"389","As a recruiter, I want to post a help wanted ad, so that I can attract candidates.","F"
"958","As an NSF employee, I want to have high-level strategy recommendations to implement in conjunction with the new CMS.","A"
"1187","They asked me from the meeting, 'How long is it going to take you to swap the MapPoint for this?' I said, 'It's going to take two weeks.' That's my understanding, but it's not going to be for everybody, because I worked on application I know where to change it. If somebody is learning a new technology, the time frame is completely different.","NULL"
"776","All right. Bye.","NULL"
"617","It could be. I don't know.","NULL"
"887","As a developer, I would like to create a web socket protocol for Frictionless data tools, so that I can easily use data packages with additional data analysis tools.","A"
"580","I guess it's going to be...","NULL"
"1114","There's no way you could . 30,000 locations have fallen out right now.","NULL"
"127","It's a lot of emails I've gone through. I've gone through more in the last two weeks than ever in a two week time span. OK. Did you all have anything specific you wanted to talk about?","NULL"
"896","I can't do it, but...","NULL"
"239","I'm going to check with them and see if that's something we're missing here. Because it's new, it's coming direct from the vendor, they would place the unique bar code they had it in, so I would assume pulled it out of...","NULL"
"582","As a camp administrator, I want to be able to see only events for a specific group/groups on the event calendar, so that I can easily read the data on the calendar without too much clutter.","F"
"158","Please enter your conference...","NULL"
"398","As a camp administrator, I want to be able to upload consent forms, so that campers or their parents can easily access the forms.","F"
"629","As a parent, I want to be able to connect with the staff in case of an emergency.","F"
"482","As a site visitor, I want to click the link from the article teaser to take me directly to the body of the article. not to another teaser setup, so that I can easily finish the article.","F"
"819","As a camp administrator, I want to create an avenue so parents can submit feedback and general concerns, so that I can keep improving the services I provide.","F"
"586","I'm here. I am desperately trying to get the board to show up.","NULL"
"601","As an Admin, I want to set key configuration parameters for my site deployment, so that that I can change key information like the site title.","F"
"103","I probably haven't seen it. I have problems logging into my computer from the conference room this morning. If you sent it in the last 30 minutes, then I haven't seen it yet.","NULL"
"1019","As a FABS user, I want the language on FABS pages to be appropriate for me, so that I am not confused.","F"
