"id","req_specification","class"
"214","As a participant, I want to be able to see each estimator's prior estimates for the story being estimated, so that I can see how his or her opinion has changed so I can ask questions.","F"
"557","As a Web Developer, I want to be able to install multiple versions of the same datapackage separately, so that that all my projects could be developed independently and deployed locally.","F"
"567","As a participant, I want to be able start a two-minute countdown timer that all participants can see, so that I can limit the time spent discussing the estimates when I think we’ve talked long enough.","F"
"941","action. I can see the entities, I can see the contacts. I can sign in. Although there should be stories listed under there.","NULL"
"35","It's week three now.","NULL"
"296","As a camp worker, I want to be able to see which campers I am in charge of and where, so that I can make sure I am doing my job properly.","F"
"156","As an employee, I want to access the route planning system during work, so that I can be guided through the neighbourhood.","A"
"331","As a data user, I want to see the office names derived from office codes, so that I can have appropriate context for understanding them.","F"
"930","As a parent, I want to be able to see a schedule of the activities my children are involved in at camp, so that I can be more informed as to what they are doing at camp.","F"
"792","As a site visitor, I want to view a section of the website that teaches me the basics of what Scrum is, so that I can learn that quickly.","F"
"110","As a UI designer, I want to move on to round 2 of Homepage edits, so that I can get approvals from leadership.","F"
"526","OK.","NULL"
"333","No.","NULL"
"1000","I think so. I'm not 100 percent sure.","NULL"
"836","But it could have chose hardwire and plug, right?","NULL"
"476","Come April, we need everything checked into that code base, in the Notify code base now, here and more so, an emergency release going on in a couple of weeks. None of this stuff...","NULL"
"1112","As a Consumer, I want to search among all data packages owned by a publisher, so that that I can easily find one data package amongst all the data packages by this publisher.","F"
"668","As a user, I want the publish button in FABS to deactivate after I click it while the derivations are happening, so that I cannot click it multiple times for the same submission.","F"
"1197","Once you approve the order. You have to, after you handle each of your detail line items, however you're going to handle, then you approve the whole order, and that's what .","NULL"
"710","As a site member, I want to download the latest training material and methodology PDFs, so that I have them.","F"
"298","...a canned query. I can't remember what the title was called, of the report. I'd have to double check it. She was getting some random results and others were getting good results query, sensitive to multi, people trying to use it at the same time. The point is that current results were impaired.","NULL"
"100","As a user, I want to generate and validate D Files from FABS and FPDS data.","F"
"508","Go ahead and finish what you're saying.","NULL"
"372","As a Researcher, working with data in NetCDF, I want NetCDF integration, so that I can store my data in plaintext while still retaining its metadata.","F"
"270","Yeah, and I don't even touch that partly, so there's still that whole falling out there. I'm trying to get at least to the point where they're functional business wise so I need to get the work orders in there. I think ship orders escaped my...I was looking at the publish package for this version, and I noticed that I was publishing ship orders before and I'm not even importing those now.","NULL"
"349","I grew up in... DuChock.","NULL"
"924","Hi, who's on the call?","NULL"
"752","Oh.","NULL"
"935","As an Applicant, I want to Submit Application, so that I can provide my information, plans and/or documents to initiate a transaction with the County.","F"
"1095","As a Researcher, I want to get a Data Package into Julia in seconds, so that I can start using the data for doing analysis and visualizations.","A"
"504","As a Publisher, I want to data to be validated when I publish it, so that that I know immediately if I have accidentally broken my data or have bugs and can take action to correct.","A"
"119","Yes.","NULL"
"1074","Hi. Who just joined?","NULL"
"677","As a Publisher, I want to publish a dataset, so that I can view just the dataset with a few people.","F"
"1164","As a Developer, I want a jQuery plugin for Core Data Packages, so that I can use it to apply to form control that uses a core dataset for autocompletion.","F"
"901","I said it before, I'm not a data guy, but I play one on TV. I did stay at Holiday Inn Express last night.","NULL"
"1060","As an Applicant, I want to Submit Supporting Documentation, so that I can satisfy documentation requirements for my application.","F"
"1207","Are there enough floater owner laptops around to where if a tech needs to go out and say, 'Hey, I need to spend an afternoon doing these cycle counts,' he could get one?","NULL"
"1107","As a moderator, I want to select whether to have the team estimate with {0, 1/2, 1, 2, 3, 5, 8, etc.} or {0, 1, 2, 4, 8, 16, 32, etc.}, so that the team can use either the modified Fibonacci sequence or powers of 2.","F"
"669","Start with a plug. Start with a plug and try a frame.","NULL"
"379","Yeah. You can't retire one . That's why I've always been .","NULL"
"1211","Yeah, actually...","NULL"
"857","Because during the last four iterations of testing, now I'm starting to plan out the next release.","NULL"
"347","","NULL"
"1139","Both for DC3 and for LCAM.","NULL"
"689","As a user, I want to be able to check transaction history and keep a record of it, so that I can go back when needed.","F"
"544","Would you like us to run that overnight, Jim?","NULL"
"485","About the...? OK.","NULL"
"950","There's nothing wrong with that.","NULL"
"593","Then I'm just going to do a merge after this, get the code from 109 back to the trunk.","NULL"
"762","As a developer, I want to access an API from the website, so that I can integrate it and implement certain features in my own iOS application.","A"
"745","As an owner, I want to make a user an owner, so that they have full control.","F"
"286","As a user researcher, I want to test the user research plan, so that I make sure the in-person interviews are effective and capturing the right information.","F"
"543","As a CST, I want to pay an annual fee, so that my CST status is active.","F"
"729","No. I'm on .","NULL"
"659","As a Publisher, I would like an integration with Excel, so that I can output cleaned Data Packages.","A"
"733","They can spell their name.","NULL"
"107","I don't either.","NULL"
"1092","Phone, tablet, tablet, right.","NULL"
"576","However, that's not an iteration that's actually ever delivered. It gets put into the actual Notify iterations. Is that what you're saying?","NULL"
"1150","I know, but what are your tasks ? Do you want me to make one, and you can go off and research this?","NULL"
"196","As a participant, I want to scroll back through the stories and estimates from prior rounds, so that I can use this information when I estimate the item of the current round.","F"
"1149","As a site administrator, I want to set the listing fee per Other Course or Event, so that we have flexibility on what to charge in the future.","F"
"564","As a camp administrator, I want to be able to create groups and add campers to the groups, so that I can easily organize the campers.","F"
"658","As a parent, I want to be able to sign and submit consent forms online, so that I don't have to deal with my child losing a consent form.","F"
"523","As a moderator, I want to change my account details, so that I can keep my account details up-to-date.","F"
"404","As a user, I want to be able to select different types of recyclable waste, so I have and get a list of facilities that accept each type and their opening hours, so that I can find an optimal route and schedule.","F"
"193","OK, is one story.","NULL"
"931","As an Inspection Supervisor, I want to Manage Inspector Workload, so that I can meet service level and quality requirements.","F"
"105","As a Developer , I want to ensure that attempts to correct or delete non-existent records don't create new published data.","A"
"961","As a site visitor, I want to be able to read some of your articles, so that I can learn without first joining the site.","F"
"1024","Just so we are clear, your stuff is what you get done by April 2nd. After that it becomes their stuff, unless they decide to push after release. I know that's not the best possible solution we can turn over, but that's the one that they had given us. If they refuse to push that day, and they say they'll handle the fallout. There we go. Karen?","NULL"
"1159","As a participant, I want to have the two-minute timer reset itself as soon as we all play an estimate, so that it's ready for use on the next round.","F"
"130","I would think we would give them back, but for one spreadsheet that says, 'Here's all the stuff we've retired, in case you want to double check it. Here's all the stuff we didn't touch, that was in your spreadsheet.' Right?","NULL"
"38","Brian, I've got here, I think he deciphered these Verizon three warehouses, but I'll double check and arrange to send something. I know they went back and forth a few times. It would be the as far as what they're taking in to the setting, so I'll get back with you on that.","NULL"
"874","As a site member, I want to send an email to any member via a form, so that we can connect.","F"
"318","As a developer, I want an DSpace integration, so that I can integrate data-packaged data with pipelines that use Dspace.","A"
"1006","Fast Path and...We need to make sure we can fit some user storage in there to keep Mahesh going. What's happening right now? You've got your user environment set up in your...? How are these designs that Corey's given being implemented right now?","NULL"
"531","As a Publisher, I want to permanently delete a data package, so that that it no longer takes up storage space.","F"
"781","Anybody can leave.","NULL"
"640","As a CSM, I want to be sent an email welcoming me to the Scrum Alliance and with instructions to register or activate my membership once my name has been loaded to the registry.","F"
"532","For them.","NULL"
"1108","Just first guess. .","NULL"
"219","Make sure it's the middle finger.","NULL"
"247","As a Consumer, I want to see a publisher's profile, so that that I can discover their packages and get a sense of how active and good they are.","F"
"448","As a parent, I want to be able to submit various type of forms to the camp management.","F"
"393","As a user researcher, I want to have the finalized OLPA task script, so that I can begin testing with internal users.","A"
"317","As a camp administrator, I want to store campers' emergency information in a database, so that I can easily notify the necessary parties in case of an emergency.","A"
"230","When Drake is out, and somebody can step in and be Drake, or Baski's out, and somebody can step in and be Baski, or when Corey's out, then somebody can step in and be a Corey. We're sharper that way.","NULL"
"466","As a site member, I want to have full access to all articles, so that there is a benefit to being a member.","F"
"785","As an NSF person interested in attending user interviews, I want to know when they are scheduled and the type of user that will be interviewed.","F"
"90","Can we look at that?","NULL"
"1083","For the pseudos.","NULL"
"885","As a parent, I want to be able to see and edit my enrolled children to the camp year, so that I can know who I already enrolled to camp, who is still pending admission etc.","F"
"1059","Let's estimate that from both sides, from whatever Baski needs to do, whatever Mahesh is going to...","NULL"
"835","In the Agile classes, we're always taught the user story, 'As a something-something user, I can do this,' and we'll have a task that needs to be done to accomplish that as far as the development tasks go.","NULL"
"923","For that particular project, you guys...","NULL"
"218","As a Publisher, I want to be able to preview the views of the current data package using cli prior to publishing, so that that I can refine the json declarations of datapackage view section to achieve a great looking result.","F"
"369","As a moderator, I want to invite estimators by giving them a URL where they can access the game, so that we can start the game.","F"
"705","Knocking some stuff off the list. It is helpful. It is generally good, but not has been better or worse than the other. We've started knocking stuff off the list and maybe get more fuzzy .","NULL"
"456","As a user researcher, I want to begin identifying interview participants, so that I can understand what educators and science influencers need from a future nsf.gov website.","A"
"28","I saw the start date at 3/14 .","NULL"
"721","As the site editor, I want to add an article to the site, so that the site has plenty of content.","F"
"73","As a developer, I want to have the application function correctly in Internet Explorer 6 and 7, Firefox 1.5 and 2, and Safari 2, so that as many people as possible can fully use the application.","A"
"630","As a user, I want to have accurate and complete data related to PPoPCode and PPoPCongressionalDistrict.","A"
"505","Stuff is breaking. It shouldn't be.","NULL"
"960","What are you talking about?","NULL"
"849","As a ResearcherPublisher, I want validate my data with a minimum of clicks, so that I can feel trust in the validity and usefulness of the data.","F"
"402","Right. Maybe it's like you have your home page and you're doing it, or maybe you duplicate these for different things like for and for conversations, and .","NULL"
"998","As a ResearcherPublisher, I want to publish Data Packages to CKAN, so that my data is findable, and I can have a data API.","F"
"957","As a Consumer, I want to get a sense of the age of the datapackage that I have downloaded before, so that that I can decide if I should update or not.","F"
"82","As a moderator, I want to browse through previous games, so that I can find the previous game I’m looking for.","F"
"210","I'm shipping to a pseudo?","NULL"
"360","As a Staff member, I want to Manage Hearing Calendars, so that I can track hearing-related activities and due dates.","F"
"142","The existing interface doesn't change part numbers now. We would either have to change the existing interface to make it change part numbers -- which is not what the interface is designed for -- or we create a new interface to allow them to change part numbers. That's all they're doing with it.","NULL"
"600","As a Developer, I want an Elasticsearch integration, so that I can integrate data-packaged data with pipelines that use Elasticsearch.","F"
"316","So, the other thing is, when you do a journal change for hardwire, you have to enter an estimate. If you do a journal change and it's non-hardwire, you don't have to enter an estimate.","NULL"
"507","Navigation is the bar on the top, so the thing that was already in there and then in the report we added Navigation.","NULL"
"868","When you login on the mobile device all you see are the tiles. Once you click the tile that's when it brings up whatever you put it in. On a mobile device you can't have it to where you just logon and it , you have to know what you're searching for.","NULL"
"883","As a team member, I want to know what visual design related tasks we might need to plan for this sprint, so that I can assign tasks as necessary.","A"
"1021","As a Publisher, I want to publish a data package in the UI, so that that it is available and published.","F"
"743","...that happens.","NULL"
"479","As a Researcher, I want to be able to reference a remote-controlled vocabulary for my dataset, so that I can be sure that column of my dataset are valid against a single shard list of terms.","F"
"282","We do.","NULL"
"722","As a user, I want the DUNS validations to accept records whose ActionTypes are B, C, or D and the DUNS is registered in SAM, even though it may have expired.","A"
"101","I've only got a little bit left on LCAM, I've probably got another hour or two to finish that up. There's so much for that, then I can actually look at this code and give . Then I'll start again tomorrow because I think that's it. We have a few more hours on the LCAM.","NULL"
"335","As a ResearcherGovernment Publisher, I want to add general reference data to my narrow dataset, so that my dataset is more useful.","F"
"1013","As the site editor, I want to have pretty good control over how the article, so that articles are visually appealing.","F"
"1085","I do, because if we have a problem we need to know, but I don't think we do.","NULL"
"519","That'd be good. I don't know if Miranda feels this way, but I feel like we need to know what the long term goal is for us. There are times where everyone's busy, and we don't want to bother everybody, and we need to know what we can be doing.","NULL"
"68","As a Developer , I want to update the FABS sample file to remove FundingAgencyCode after FABS is updated to no longer require the header.","F"
"1199","As a moderator, I want to export a transcript of a game as a HTML file, so that I can save the stories and estimates locally.","A"
"1168","As an agency user, I want to know when the submission periods start and end, so that I know when the submission starts and ends.","A"
"222","So it'll really remove estimate in it?","NULL"
"981","As a site visitor, I want to have an advanced search option that lets me fill in a form of search criteria, so that I can quickly find what I am looking for.","F"
"440","frame to do customers.","NULL"
"431","As a Broker user, I want to have updated error codes that accurately reflect the logic and provide enough information, so that I can fix my submission.","A"
"345","Bye.","NULL"
"206","Yeah. These are all disconnect. Sorry if I didn't make that clear.","NULL"
"1018","As an Owner, I want to invite an existing user, so that the user can become a member of my publisher.","F"
"833","As a Developer, I want an SPSS integration, so that I can integrate data-packaged data with pipelines that use SPSS.","F"
"353","Does it stop it from sourcing when you say you're doing a cycle count?","NULL"
"94","You guys went to Mugshots?","NULL"
"839","What you used in training, everything, as far as I know, works that's there already. I just have to put it in production.","NULL"
"731","As a FABS user, I want to link the SAMPLE FILE on the 'What you want to submit' dialog to point to the correct file, so that I have an accurate reference for my agency submissions.","F"
"175","As a content designer, I want to develop a better understanding of NSF's content types and editorial plan, so that I can make more informed recommendations going forward.","A"
"1200","These profile editor location groups, then you retire them. You give them back the ones that you didn't touch, so that they know they still need to go and manually look at those.","NULL"
"599","As a content editor, I want to be able to easily find content, so that I can edit it.","F"
"506","As a site visitor, I want to read current news on the home page, so that I stay current on agile news.","F"
"596","As a Visitor, I want to sign up via github or google, so that that I don't have to enter lots of information and remember my password for yet another website.","A"
"15","As a site member, I want to mark my email address as private even if the rest of my profile is not, so that no one can contact me.","F"
"895","As a Publisher, I want to be warned that a tag exists when I try to overwrite it, so that that I don't accidentally overwrite stable tagged data which is relied on by consumers.","F"
"79","As a ResearcherDeveloper, would like the ability import/export from MS-SQL, so that I can use Data Packages in workflows that involve MS-SQL.","F"
"397","Mostly that was to Jimmy. I don't know if I other one . This one was from Linda. They were kind of describing the same thing. It has IM group on there. I don't know if you're part of that or not, Larry.","NULL"
"853","That was from CTDI what they got from Afinium? We're talking the same thing, right?","NULL"
"290","If you want to make it...I don't care.","NULL"
"728","As a Publisher, I want to publish a data package where its resource data is stored on my servers but the registry caches a copy of that data, so that that if my data is lost or gets broken I still have a copy people can use.","F"
"811","As a Developer, I want a Mongo integration, so that I can integrate data-packaged data with pipelines that use Mongo.","F"
"718","As an owner, I want to remove a user as an owner, so that they are just a member and no longer have full control.","F"
"453","Don't you all have to, or somebody have to map these CLLIs to Infinium?","NULL"
"1","As a camp administrator, I want to be able to keep camper records from previous years, so that the amount of work I need to do is lowered.","F"
"1061","As a camp worker, I'm able to report a camper to the manager with an inappropriate behavior.","F"
"783",".","NULL"
"153","I chatted with him this morning, I IMd with him this morning and he said that there's nothing else that he's aware of, that he's heard of, or seen that would be similar to what we're experiencing.","NULL"
"41","Help.","NULL"
"281","Because we're not just pulling a query...","NULL"
"1143","You need to talk to . We have residents there to notify people. We need to get him on board. OK, we have decided on the Agile Class, and I am gonna get it scheduled based on everybody's calenders. John wanted us to bring a couple of the Denver people in. Talked to Matt yesterday about trying to make sure it all works with their calenders, as well. We are going do a one day class. It will probably be late April, early May would be my guess.","NULL"
"876","All right. Tuesday is not great. Wednesday is better. I can do Tuesday, and split it. I can do...well. Why don't we do 1:30? I've got to run, so that's the most important thing. Just kidding. That's why he thinks, schedule a 12 o'clock meeting ruins our whole day. We can do this, 1:30...we're going to an hour and a half tomorrow,or do we need to do it in the morning?","NULL"
"435","Hi. Who do we have on the call?","NULL"
"115","Yeah. Exactly.","NULL"
"740","workflow, with everything underneath it. You click on Poles and then you've got your links to all the things you can do on the poles.","NULL"
"716","There may be some little nuances to how the code works. Susan and I can do the actual education .","NULL"
"370","As a trainer, I want to create a new course or event, so that site visitors can see it.","F"
"1165","As a site visitor, I want to email news items to the editor, so that they can be considered for publication.","F"
"939","As a moderator, I want to accept the average of all estimates, so that we can move on to the next item when we agree.","F"
"628","As a site visitor, I want to see a list of all upcoming Events, so that I can decide if I want to attend any.","F"
"223","As a site visitor, I want to see new content when I come to the site, so that I come back more often.","F"
"838","As a Data Analyst, I want to compare different versions of some datapackage locally, so that that I can see schema changes clearly and adjust my analytics code to the desired schema version.","F"
"955","I guess they can get a quick update on email that they just sent regarding the received equipment from . I've updated the ones that still have WMS as the bin. Those either came in while I was on the 17th, or immediately after, so I've corrected those last few.","NULL"
"1047","If you get familiar with XAML, you could split the screen, and put two controls side-by-side. It's going to reduce our real estate on the screen and stuff, but you could split it, split the two columns and put each control in there, and see if we can get them side-by-side might actually be useful for testing, and comparison, and such.","NULL"
"592","All right. I'm going to try to come up with JRM stories. Joel, I think, maybe the assignment stories. Managing project, I'll send those to Jasmine. Corey's going to create the mock up for the logon page.","NULL"
"723","As a participant, I want to have a small thumbnail photo displayed near where my cards are played, so that the game is more personal because I see who I'm estimating with.","F"
"283","As a site visitor, I want to have articles that interest me and are easy to get to, so that I come to the site for my agile news and learning.","F"
"284","You go to the map, on that map, you show whatever you want and from there, you can do what you want. There still has to be a way to filter down to something. I'm not real sure how to group that together in the sense of, say if I have something like a list of contracts.","NULL"
"24","As an Agency user, I want to accurately see who created a submission, so that I'm not confused about who last updated a submission.","F"
"797","As a camp administrator, I want to be able to modify a group's information, so that I can keep the groups up to date.","F"
"1148","As a camp worker, I would be able to submit a completion report for the tasks which was assigned to me.","F"
"303","That could be done by someone else other than you.","NULL"
"343","As an agency user, I want to be confident that the data coming from SAM is complete.","A"
"1004","As a user, I want to contact the administrators, so that I can give feedback or ask for help.","F"
"956","As a site visitor, I want to post comments about articles, so that others can read them.","F"
"1203","As a team member, I want to have a schedule of more coworking slots, so that I can work in tandem with the rest of the team on a more regular basis.","F"
