"id","req_specification","class"
"410","Better sooner rather than later.","NULL"
"209",".","NULL"
"148","As an Inspection Staff Supervisor, I want to Assign Inspections, so that I can make sure the appropriate Inspector receives the work.","F"
"374","As a site editor, I want to update any course or event, so that I can fix things the original author hasn't.","F"
"771","As an Admin, I want to see key metrics about usage such as users, API usage, downloads, so that that I know how things are going.","F"
"321","As a publisher, I want to be able to check that every time I update my data it is still good, so that I can catch errors early and store reliable data.","F"
"500","That's outside.","NULL"
"813","As a participant, I want to change my estimate as long as the draw has not been completed, so that I can change my mind.","F"
"62","I think we're on that section. I want them to be trained.","NULL"
"615","As a moderator, I want to start a round by entering an item in a single multi-line text field, so that we can estimate it.","F"
"542","Fast Path. Bold. Bold.","NULL"
"681","As an admin, I want to have all data encrypted, so that important information will not be stolen during a server breach or an attack.","A"
"875","As a FABS user, I want to download the uploaded FABS file, so that I can get the uploaded file.","F"
"655","We looked at...map control. The demo bug, the map control. CS , CS file. Those two we looked at. That's where he said our focus is going to be. Yet for some reason that graph design scared me death. why we didn't look below it, the demo file. I have no idea. I discovered that five minutes after meeting with John.","NULL"
"845","You probably...","NULL"
"188","That makes it a little...","NULL"
"83","As a Researcher, I want to get a Data Package into STATA in seconds, so that I can start using the data for doing analysis and visualizations.","A"
"131","As a Data Analyst, I want to update previously downloaded data package, so that that I can work with the most recent data.","F"
"168","I want to make sure that we've got things covered and then I would say, maybe, start trying to prioritize a bit, the things that we want to be able to accomplish. Talk about the approach as far as checking in, maybe trying to get Jasmine up to speed a little bit on what Mahesh can do, cross-training and...The hardest part right now is resources on the back-end with Baski and Brian.","NULL"
"490","As a camp administrator, I want to be able to modify tasks/events I scheduled in case there is a change, so that I can always keep the schedule up to date.","F"
"254",". The outside vendor they use. Industrial Movers?","NULL"
"926","OK, thanks. We'll talk to you guys later.","NULL"
"195","As a staff member, I want to denote an application with a Final Action status. So that I can finish it.","F"
"422","As a site member who has read a teaser on the front page, I want to read the entire article so that I can finish articles that appeal to me.","F"
"1051","I like Jim's rules, that mindset of, if we had CLLI six, we could map it to an exchange that way. That was incredibly beneficial. It's just it's not fully working.","NULL"
"492","As a Zoning Staff member, I want to Process the Requests for Zoning Information, so that I can capture my response to the request in the system and also send a communication from the system to the Applicant.","F"
"50","As a ResearcherGovernment Publisher, I want to map lines in my dataset using geographic data in my dataset, so that my dataset is more engaging for non-technical users.","F"
"750","As a Staff member, I want to Perform a Staff Review, so that I can validate compliance of an application with the Zoning Ordinance and impact approval/denial of the application accordingly.","F"
"925","Oh yeah, I forgot about that. We can't really start it until eight o'clock anyway, based on our stop timeline event, which isn't until seven. Grady, you might want to take half the day off tomorrow, since you're going to be working half the night.","NULL"
"51",", right?","NULL"
"735","As a team member, I want to know when meetings are, so that I can plan accordingly.","F"
"672","This one is supposed to be the one. You do a general change. It doesn't know what day you're referring to. You have to go back in and change the frame.","NULL"
"26","customers.","NULL"
"977","The reason that we made the map that's on the epic is because there was a lot of pieces involved in just the map. There was drawing bounding area. There was adding search criteria. There was searching for different types of assets.","NULL"
"946","I think as far as the iteration to start with, if we can get a website up, .","NULL"
"173","The Dashboard is done, as far as I'm concerned.","NULL"
"1170","As a Consumer, I want to download a DataPackage's data one coherent SQLite database, so that that I can get it easily in one form.","A"
"831","Agreed.","NULL"
"183","As an admin, I want to be able to have a dashboard that shows usage stats and locations, so that I can identify the neighbourhoods with the largest number of drop-offs and to try getting more facilities involved.","F"
"999","As a Developer, I want to get a Data Package into C++ in seconds, so that I can start using the data in doing analysis and visualizations.","A"
"904","","NULL"
"501","As a Broker user, I want to Upload and Validate the error message to have accurate text.","F"
"907","As a site member, I want to search for profiles based on a few fields, so that I can find others I might want to connect with.","F"
"1053","Well, apparently he did it maybe instead of...I thought it was supposed to be the night before last at midnight, but apparently that didn't happen, and maybe it happened last night at midnight, because we did see some that came in early this morning that were adds and that's as far as we got to look.","NULL"
"643","I don't know what it takes, if it's just on the screen, or if you have to do other stuff.","NULL"
"137","If you wanted to see My Conversations instead of that map all you have to do, instead of running your own search and doing that every time you're going to search...","NULL"
"88","Back when I lived here, that would never happen.","NULL"
"42","As a site visitor, I want to do a full-text search of the FAQs, so that I can find an answer quickly.","F"
"1062","As a camp administrator, I want to be able to create, modify rules that campers and camp workers has to follow.","F"
"1011","As a Developer, I want an EPrints integration, so that I can integrate data-packaged data with pipelines that use EPrints.","F"
"78","Have you decided ?","NULL"
"248","And on the spreadsheet if they've color coded it then they've already touched it. It's always possible.","NULL"
"165","As a moderator, I want to see all items we try to estimate this session, so that I can answer questions about the current story such as 'does this include ___'.","F"
"953","Yeah, as long as everybody uses this, maybe not different ways .","NULL"
"754","As a data user, I want to access two additional fields from the FPDS data pull.","F"
"1214","Ken, are you OK with that? DJ.","NULL"
"451","No, we were creating, depending on which way we were doing it. If we create a service, they would pull it whenever they wanted. If it was an FTP, then we would send it to them or put it on the FTP site, daily or however often it was run.","NULL"
"125","As a Staff member, I need to be notified when Geospatial attributes change, so that I can ensure that I am reviewing the permit/application to the most current data and appropriate standards.","F"
"1123","As an admin, I want to view a dashboard that monitors all the sites' statuses, so that I can have a sense of what people are doing on our sites and know the service status.","F"
"383","Because it probably won't be on this morning's call, but I'm about to start working on the work orders. I don't have blanket project information that I can tell or estimates for this stuff, so I'm sure that's going to get in the way. I'm not quite sure how they're going to want to handle that. I need to dig into this a little more so I can more appropriately formulate a question for them.","NULL"
"302","As a user researcher, I want to make sure the correct NSF people are invited to user interviews, so that they can observe the interviews and make recommendations accordingly.","A"
"889","He's been there. He's seen it.","NULL"
"182","Yep.","NULL"
"708","I agree.","NULL"
"424","As a team member, I want to understand what the MVP should look like, so that I can begin understanding workflow needs as they pertain to any CMS decision.","A"
"712","If you've got the tab functionality other than the Conversation.","NULL"
"782","As a Publisher, I want to version my Data Package and keep multiple versions around including older versions, so that that I do not break consumer systems when I change my datapackage.","F"
"48","That's why I'm saying like the contracts or whatever it is. It's almost like I don't want it to be a different approach. We're still filtering it down to, if you just want a map or not, the map is there. A lot of the times, I guess when it is...","NULL"
"991","As a superuser, I want to update the recycling center information, so that I can provide the latest information about the recycling center.","F"
"1007","As a Publisher, I want to see real examples of published packages so that I can understand how useful and simple the datapackage format and the registry is.","F"
"546","I think when you...","NULL"
"611","As an NSF employee, I want to know how brand guidelines are developed and maintained, so that I can incorporate them throughout the project.","A"
"834","As a Consumer, I want to view a Datapackage at a particular version online, so that that I can present/discuss the particular data timeslice of interest with other people.","F"
"1215","From what I've seen, I've only seen the location code and address. I don't remember anything else from that spreadsheet.","NULL"
"46","As a Development Staff member, I want to Issue a Development-related Permit, so that I can grant the request to the Applicant to begin work","F"
"483","As a user, I want to add a video to my article.","F"
"1105","So, testing it is what's going to take a minute, right? Because it's the...","NULL"
"21","Yeah. That's good.","NULL"
"581","It's difficult when you're working on several different things and now you spend an hour actually programming this thing, two hours on troubleshooting issues, and spending an hour on an emergency release that you have to get out. With all of that, there's a lot of context switching going on.","NULL"
"229","All right, that's what we're doing. Not all the rest of the stuff the way words it. I've told you that. I don't word it like they do. I word it so I know what I'm doing.","NULL"
"789","As a moderator, I want to add an item to the list of items to be estimated, so that so that we can be flexible and accommodate situations where we think of a new story while playing.","F"
"1195","What I was actually thinking of was home page, maybe Conversation home page. I don't know if that's worth doing or not but, like I said, I don't want to have duplicate areas of that.","NULL"
"676","As an Agency user, I want all historical Financial Assistance data loaded for FABS go-live.","A"
"6","Who is this, Joy?","NULL"
"139","Actually a lot of people opened up today, that's good.","NULL"
"1015","Three devices, phone, tablet...","NULL"
"975","As a Staff member, I want to Send a Formal Response to Applicant, so that I can satisfy communication and records responsibilities.","F"
"97","My question was, on the spreadsheet, all the items status say complete. Is that complete at LCAM?","NULL"
"859","Yeah.","NULL"
"394","What code has Baski gone through with you?","NULL"
"86","Mugshots burgers are...","NULL"
"475","I can do that.","NULL"
"65","You don't want to box anybody in a corner, either. That doesn't do any good for Jasmine, to say, 'OK, she's the UX person now.' Not that that's a bad thing, but you would probably want to be a little bit more well rounded than that, versus looking at Miranda and going, 'You're more data or business logic .","NULL"
"154","As a Researcher, I want to be able to save new visualizations, so that I can share them with others or include them in the Data Package.","F"
"471","That was quick. Usually people take longer to dial in.","NULL"
"1041","Can you add notes to these parts?","NULL"
"620","As a Developer, I want to customize an existing wizard for my specific type of data, so that I can give my users a great user experience.","F"
"176","As a Consumer, I want to search data packages, so that that I can find the ones I want.","F"
"273","If we mess up at some point, it will help us track back to what happened, where did it go wrong, and things like that. Make a quick note on here about why I'm checking this in.","NULL"
"560","Yeah, that's...","NULL"
"480","I'm perfectly fine with that. I just don't want to force someone to go get another tool now. If that's where their direction is, then that's perfectly fine with me. If it makes the most sense for us.","NULL"
"1133","Right. This gets rid of that because it's the same viewing area, so you would be able to see your conversations on the grid, and a map, and a calendar. If you have My Conversations selected, then you can do that with those conversations. Or, if you have Search selected, and you add search criteria, you get the same kind of list, map, and calendar options.","NULL"
"725","As a content designer, I want to demonstrate the value of user-centered content design to ensure it's an integral part of our recommendations.","A"
"815","As a UI designer, I want to move on to round 2 of the Help page edits, so that I can get approvals from leadership.","F"
"872","OK, Grady's got generate report data.","NULL"
"911","As a moderator, I want to log in using my account name and password, so that I can start using the application.","A"
"530","As a Developer , I want to be able to log better, so that I can troubleshoot issues with particular submissions and functions.","F"
"565","As a team member, I want to meet with DIS / cloud.gov, so that I can determine the requirements for the beta.nsf.gov ATO.","A"
"707","What's that?","NULL"
"255","As a moderator, I want to enter the agreed-upon estimate, so that we can move on to the next item when we agree.","F"
"221","Do you have any questions on the users? I know you all send some emails back and forth. Think you're good now?","NULL"
"329","That did bring me to another question. I can't find warehouses in the data at all, and I know that, Ken, we got feedback from you to look at the building type field that's there, and that was beneficial. We found the field locations, and may denote it as CS, which I assume is Central Stock. RDC Remote Distribution Center, and then I think an IDC is an Intermediate Distribution Center.","NULL"
"898","As an Applicant, I want to Satisfy Hearing Requirements, so that I can ensure all pre-hearing requirements are satisfied in time for the hearing.","F"
"1126","As a Consumer, I want to see how active the site is, so that I can decide if I should get involved.","F"
"861","Zillow you've got the buy, sell, rent, zestimate. You could literally almost come in and say, 'I'm an attacher.'","NULL"
"1096","As a Machine Learning expert, I would like to package ML datasets as data packages, so that I can easily import them into my ML platform, so that I can start using the data in doing analysis.","F"
"976","I think that it's probably a good idea to go ahead and make it 45 minutes. I think we can use the extra 15 minutes. I try to start small, see what we can get done, but it seems like...That's always my issues, too, when I was managing things, knocking things off.","NULL"
"536","As a DeveloperPublisher, I want a tool to create an embeddable data summary via iframe, so that I can embed data summaries across sites.","A"
"1122","As a Developer, I want D Files generation requests to be managed and cached, so that duplicate requests do not cause performance issues.","A"
"129","As a Staff member, I want to create each condo unit, so that I can associate it to the child parcel and address after the condominiums are recorded in the system.","F"
"185","As a Researcher, working with data, I want an Microsoft Power BI integration, so that I can import datasets without downloading them locally.","A"
"2","It's all got to integrate together at some point.","NULL"
"1091","OK.","NULL"
"357","It needs to start getting on integrations and . I need to show Karen what they did. Whether or not she's able to show up and put much into it and see.","NULL"
"437","As a Publisher, I want to preview a datapackage I have prepared, so that that I can check it works and share the results.","F"
"826","He's been here.","NULL"
"602","As a user, I want to access the raw agency published files from FABS via USAspending.","F"
"1109","As a site member, I want to fill out an application to become a Certified Scrum Practitioner, so that I can earn that designation.","F"
"203","No, sir. I'm good.","NULL"
"1154","I guess I can. We don't have to talk about that now, though.","NULL"
"356","I'm going to the poles site.","NULL"
"979","As a Researcher, I want results to be stored in a non-identifiable way, so that I can study the data to see things like whether estimates converged around the first opinion given by 'estimator A' for example.","A"
"434","As a camp administrator, I want to be able to keep my information in one place, so that the admins next year can improve on the previous years.","A"
"351","As a site visitor, I want to see a list of the most popular items on the site, so that I am most likely to read the most important or best content.","F"
"865","As a potential research participant, I want to learn about the research and leave my contact information.","F"
"848","As a trainer, I want to load an Excel file into the site, so that the course participants are added to the Scrum Alliance records.","F"
"96","Can we look at that?","NULL"
"691","As a camp administrator, I want to be able to modify the information of enrolled campers, so that I can keep the campers information up to date.","F"
"520","I do a control if...","NULL"
"645","As a site visitor, I want to see a trainer's rating, so that I choose a course from an appropriate trainer.","F"
"49","To me, and we talked about this a little bit before. Getting this thing Notify, the HTML5, and getting the JRM functionality in, is imperative. I think we'll be able to sell a lot more and get a lot more recurring revenue if we do that.","NULL"
"473","We can do it.","NULL"
"497","As an Applicant, I want to Request PreApplication Assistance, so that I can receive a response to a request for a meeting or information that is a result of the preapplication assistance.","F"
"787","As a CMS administrator, I want to have roles, so that I can assign them to my users.","F"
"1212","As an NSF employee, I want to join Github, so that I can participate in the issues as assigned.","F"
"344","As a Developer , I want to determine the best way to load historical FPDS data, so that I can load all FPDS data since 2007.","A"
"978","...specific on the ones that are critical. We ought to start with those. Larry and I can start, and you can time .","NULL"
"263","Well, I mean, development-wise. Baski has been stuck with the lion's share of everything else. We've been able to not move all these other things forward. That one, we will definitely try to guard against doing something like that. Yeah. We'll add that to the list, context switch. All right. What do you all want to talk about?","NULL"
"144","As an employee from the HR department, I want to have access to the full information of all employees working for this business.","A"
"425","As a Publisher, I want to sign up for a given pricing plan, so that that I am entitled to what it allows.","F"
"57","As a parent, I want to be able to share any photos the camp has taken of my child.","F"
"623","As a Consumer, I want to know full details of how the data package schema has changed, so that that I can adjust my scripts to handle it.","F"
"996","Right, and so that's what, again, doesn't make any sense and you might want to look at your remedy tickets because it seems like the virtual server for LCAM in Fort Wayne, you just got a remedy ticket on it?","NULL"
"40","OK, HTML file .","NULL"
"608","What did he say?","NULL"
"893","As a site editor, I want to set start publishing dates, old article date, and stop publishing dates for articles, so that articles appear only during appropriate periods.","F"
"613","That's it. That won't take long. Probably about, I'll say one hour. It's not going to be that hard, really, once I get the stored procedure done.","NULL"
"807","Dang it. I thought it starts with a five. No, it's 0, 5.","NULL"
"180","I guess for this exercise today, these are the epics and we can start trying to put some high-level estimates on them. At the end of the day, we really want to know how long this whole project, to get this whole thing turned over is going to take, the high levels and then we can work out which ones we want to try and do first and scope out that work.","NULL"
"1057","The change here is to put estimate on here. So, the story is...Why does it say ?","NULL"
"1175","As a team member, I want to determine a design direction for the beta social page, so that we can implement a beta site quickly without established brand guidelines.","A"
"830","As a Publisher, I want to store my data quickly and easily online.","A"
"390","As a user researcher, I want to begin drafting a research plan, so that I can begin recruiting participants.","A"
"11","No, you're talking warehouse. Warehouse cycle count is different from the field.","NULL"
"179","As a user, I want to view user documentation for the website, so that I know how to use the web app.","F"
"1129","As a team member, I want to understand how time off overlaps with plans around the user research.","A"
"944","We can't search for a conversation that has an attachment on it that belongs to this company because we're trying to do something generic. It's an easy query but we do something .","NULL"
"444","As a site editor, I want to be able to indicate whether an article is publicly available or for members only, so that visitors are incentivized to become members.","F"
"252","Can we change the date of the iterations since we're clear on that. Nobody .","NULL"
"936","As a broker team member, I want to derive FundingAgencyCode, so that the data quality and completeness improves.","F"
"459","I don't think we had anything else for you all this morning. Do you all have anything for us that we need to discuss?","NULL"
"802","As the site editor, I want to include a teaser with each article, so that site visitors can decide if they want to read the rest.","F"
"656","As a FABS user, I want additional helpful info in the submission dashboard, so that I can better manage submissions and IG requests.","F"
"993","When we mention maintenance, it also includes correcting their data?","NULL"
"673","As an Agency user, I want the header information box to show updated date AND time, so that I know when it was updated.","F"
"486","You missed a good lunch, I'll tell you.","NULL"
"409","Open invitation, there.","NULL"
"537","As a UI designer, I want to begin user testing, so that I can validate stakeholder UI improvement requests.","F"
"91","As a trainer, I want to list my upcoming classes in my profile and include a link to a detailed page about each, so that prospective attendees can find my courses.","F"
"1131","As a camp administrator, I want to be able to see all my camp groups and the events scheduled for each camp group, so that I can notify counselor of what their group will be doing for the day.","F"
"900","As a developer, I want to have the site comply with the W3C accessibility guidelines where possible, so that people with accessibility issues can use the application.","A"
"462","As a Developer, I want to use data package as a node lib in my project, so that that I can depend on it using my normal dependency framework.","A"
"756","As a Developer , I want my domain models to be indexed properly, so that I can get validation results back in a reasonable amount of time.","A"
"954","See if I stuff up.","NULL"
"1054","Dopak records.","NULL"
"1063","1.20 might need to be moved up some depending on what option they take on the fast path. That's the one having to get it checked in. I guess we owe him that with a clean release so we may go with 20 a little bit earlier.","NULL"
"464","But what we can do, given this current situation, we could have a pre-iteration type thing. Where this is a design iteration, or a design two iterations, but it's relatively usable, I mean it's usable stuff that they're doing, in lieu of...","NULL"
"217","Yep. I started on something else already.","NULL"
"855","As a broker team member, I want to make some updates to the SQL codes for clarity.","F"
"627","All right, I'll do that then, before I try and schedule something. It's 9:21. I'm bringing up what we have. Do we still have testing the CTDI? Did they send something else yesterday?","NULL"
"1145","As a user, I want to be able to get the hours of each recycling facility, so that I can arrange drop-offs on my off days or during after-work hours.","F"
"642","As a moderator, I want to see dates and times in my local timezone, so that I don't have to do timezone conversion myself.","A"
"1178","As an Agency user, I want FABS deployed into production, so I can submit my Financial Assistance data.","A"
"678","We don't. We've got to get off this call. My only concern is, Grady's on vacation next week and we're supposed to be doing this next Sunday, which, by the way, you and I need to get together and give them some kind of a, 'Yeah, you're going to be able to start work on Tuesday at name and date.'","NULL"
