"id","req_specification","class"
"3471","A docking station and it uploads a buttload of data at one time. I told him that I have a meeting set up to talk to you guys about this, but that the offline scanners is definitely way more complex than wireless scanners.","NULL"
"314","And others have have also this, this option to, to select or comment on.","F"
"2142","Do you know which report she was running?","NULL"
"2391","Pulling it in  , it's like you said. This doesn't have anything to do with the CLLIs, but, you'd think there was something that we could match it up with.","NULL"
"1128","Where the grid is right now.","NULL"
"4773","No.","NULL"
"1532","As a potential research participant, I want to learn about the research and leave my contact information.","F"
"2416","That would be of help. Thank you.","NULL"
"3408","My question was, on the spreadsheet, all the items status say complete. Is that complete at LCAM?","NULL"
"1621","See if I stuff up.","NULL"
"4948","Yes, if you had his list, say the primary fields are the Afinium locations, of whatever they call it, ship to, and then the address, city, state, zip code, and I liked Brian's first suggestion if you just go by the city, state, zip code and then maybe list them all side by side, and then the ones that match versus the ones that didn't, we could possibly get somebody to help manually do some of those to at least get started.","NULL"
"3593","Barcode from porch...","NULL"
"2603","I did want to bring up, while we're here...I keep looking up there for the time since it's not up. We do have some issues that probably are going to require a release to be fixed, so I don't know who has time to look at those issues  .","NULL"
"3735","It's an FHA loan so they have to do an appraisal too. When the appraisal comes back  .","NULL"
"1552","As a parent, I want to be able to see and edit my enrolled children to the camp year, so that I can know who I already enrolled to camp, who is still pending admission etc.","F"
"3721","I went to Logan's.","NULL"
"4712","surely not.","NULL"
"730","A banker sold it finally. That was when we had four.","NULL"
"2052","Did you put everyone through  ?","NULL"
"3834","I want to do that. That's ultimately, you have to have that but I don't want it to actually be  . I want to go see a pole on a map. I don't want to say, 'Search, poles, .' I want the map to be part of the application.","NULL"
"4642","Everyone's covered all the stuff I was thinking. But I do plan on coming up with something else, and just thinking over and seeing if there's something else I can add. But I think Brian, Jasmine, and Karen covered exactly what I was thinking.","NULL"
"3669","I think I might have one that sounds really good.  .","NULL"
"2523","OK all right back to work. I'll get Karen these.","NULL"
"3152","I don't know. I'm not familiar with this section of code.","NULL"
"393","But, but nice to know that it should have this flag.","F"
"4703","defined.","NULL"
"972","Thanks.","NULL"
"3067",".","NULL"
"863","As a participant, I want to scroll back through the stories and estimates from prior rounds, so that I can use this information when I estimate the item of the current round.","F"
"3446","Yeah.","NULL"
"202","So they are just all on the top level and its like a pool of project managers and the top level and out of this pool, those, the entire structure or hierarchy of the business.","A"
"1200","As a trainer, I want to read information of relevance only to trainers, so that the Scrum Alliance can share information with me easily.","F"
"1207","As a Publisher, I would like an integration with Open Refine, so that I can output cleaned Data Packages.","A"
"1753","As a user, I want to have a great UI and UX from the sites, so that I have a pleasant experience when navigating through them.","A"
"2507","I agree.","NULL"
"755","Back when I lived here, that would never happen.","NULL"
"3156","three, I think?","NULL"
"1072","As a Consumer, I want to be notified of changes to a package I care about, so that that I can check out what has changed and take action.","F"
"3656","Then you can slowly move one function over at a time.","NULL"
"682","As a site member, I want to mark my email address as private even if the rest of my profile is not, so that no one can contact me.","F"
"49","No, actually there, there isn't, I mean, super admin.","NULL"
"3096","Put the CPR in.","NULL"
"4515","I want them to feel comfortable to estimate, than me estimating for them. That's so wrong.","NULL"
"2400","So, if that's OK with you guys, I'll just...we'll figure out what looks good based on the data that we've got and email that to you guys. You can either say, 'Yeah I like that,' or 'No, I don't like that, go back, dummy and go try it again,' and we'll try it again.","NULL"
"423","It's a little early, but I manage.","NULL"
"211","Certainly depends on, on which exact client we're talking about.","NULL"
"338","It's like the manager then will be like a first filter that filters out.","F"
"3210","We estimated that, that one was three? How did we estimate that at three? Wait, this was on 45. That may not be three, because he also did not put any of the estimates on there. He did estimate that at three. Why is it three? What else has to happen? Because these are our estimates.","NULL"
"1709","Yeah. That'll be the easy one.","NULL"
"4337","Hi, who joined?","NULL"
"3886",".","NULL"
"4857","Good morning. It's Kim.","NULL"
"2606","Give them to Brian. He doesn't have a lot of work.","NULL"
"3739","Congratulations. You're earlier than  late.","NULL"
"4305","What was the question? I couldn't hear it.","NULL"
"3975","It would be right here.","NULL"
"4392","OK.","NULL"
"2871","Software side, Michael said he's got some kinks he's got to work on the entire map server stuff. Do some research for Windows 10, see if all hope is lost. We're fixing an issue that's not even compatible on this version, so that's very frustrating.","NULL"
"69","I mean, do you have the overall idea of the, of the project, right?","NULL"
"1539","OK, Grady's got generate report data.","NULL"
"1319","You didn't do that last night?","NULL"
"498","So the manager can move around the elements as he wants so he can sort of create this own sorting.","F"
"1882","From what I've seen, I've only seen the location code and address. I don't remember anything else from that spreadsheet.","NULL"
"4574","It's a technology that's useful to John and his team, but it's not useful to us as a development team, because it buys us nothing knowing that, for the things that we have to actually do. That's what I'm concerned about.","NULL"
"1061","What code has Baski gone through with you?","NULL"
"3762","At the end of the day, it is the same, unless we were going to branch the code base, they're all working on the same code base, and they all need to be checked in and ready to go.","NULL"
"4928","Can we get the low-hanging fruit right now? There's obviously going to be some of that stuff matches perfectly, right? Everything matches on address perfectly.","NULL"
"3508","It's still there. How does it work? I'm sorry, I've just forgot?","NULL"
"3631","Can they do the buy of DC3?","NULL"
"3850","I think Darryl, your question, though, really is, 'Do you want all of the stories or epics defined today?' We're not necessarily going to implement them all. We don't have to design them all right now but do we need to make sure all the functions are up here?","NULL"
"1794","Bye.","NULL"
"2573","I'm inside updated  inventory search.","NULL"
"4153",". I'm going to use the same thing we had on the other page. I need to remove .","NULL"
"2640","Well, that's what I was trying to give them. It's like, I'm not ignoring these. I've got them on the list. Some of them I've got on the list because we still need to research them, because I don't know if they're an issue or not, or it's just something that they did wrong, then I need to tell them here's the correct way to do that.","NULL"
"2169","Well, Susan's on her way to the large. Do we need to catch her?","NULL"
"1742","As a site admin, I want to approve each help wanted ad before it gets to the site, so that we're sure of the quality of jobs being listed.","F"
"3529","You did that on purpose.","NULL"
"1090","That's what's next thing on deck. It's just a matter of trying to wrap things up. Getting better about scope creep, so we can get onto these. Get these things up, , is the best thing our team can do.","NULL"
"1429","As a developer, I want to access an API from the website, so that I can integrate it and implement certain features in my own iOS application.","A"
"4491","Yeah.","NULL"
"1543","All right. Tuesday is not great. Wednesday is better. I can do Tuesday, and split it. I can do...well. Why don't we do 1:30? I've got to run, so that's the most important thing. Just kidding. That's why he thinks, schedule a 12 o'clock meeting ruins our whole day. We can do this, 1:30...we're going to an hour and a half tomorrow,or do we need to do it in the morning?","NULL"
"474","Exactly.","NULL"
"786","Yes.","NULL"
"4555","Well, I mean, development-wise. Baski has been stuck with the lion's share of everything else. We've been able to not move all these other things forward. That one, we will definitely try to guard against doing something like that. Yeah. We'll add that to the list, context switch. All right. What do you all want to talk about?","NULL"
"1816","As a site administrator, I want to set the listing fee per Other Course or Event, so that we have flexibility on what to charge in the future.","F"
"2232","We're probably going to have another emergency release tonight around, I'd say, 7:00 or 8:00. How many days passed?","NULL"
"2900","We haven't heard anything since you checked.","NULL"
"2962","Can we search by create date?","NULL"
"939","That's .","NULL"
"1208","As a Technical Staff member, I want to update the GIS Property Management, so that I can successfully update the transactional Parcel Pin to reference the GIS layer where the Split or Merged Parcel Pin exists.","F"
"4187","All right. I'm going to try to come up with JRM stories. Joel, I think, maybe the assignment stories. Managing project, I'll send those to Jasmine. Corey's going to create the mock up for the logon page.","NULL"
"2329","There was one thing you mentioned earlier on, TFS 2013, and so that  pops up in my head. The simple solution  in 2012, Frontier we're on 2013, are we going to...?","NULL"
"2644","I was going to say like a million  73 years old.","NULL"
"3641","For example, our Alden laptops are an example of that. I could bring it in there. I had access to the public Internet from their network in the warehouse. It would get me to the public Internet, but I couldn't get to LCAM itself until I ran the VPN client, like we do here.","NULL"
"4869","Off the top of my head, if you could narrow it down. Is it network traffic related to the Web servers going to the client, or traffic going back to the database?","NULL"
"425","It's always.","NULL"
"1777","As an admin, I want to be able to add or remove recycling facilities' information, so that users get the most recent information.","F"
"2645","Even worse, really high. See if anybody notices. I might do that, now that you said that  . Whenever I get to the 90s, instead of it being issue number 90 it will be like 92.  Or something.","NULL"
"1580","As a Staff member, I want to Capture a Hearing Decision, so that I can enforce the system.","F"
"1000","No.","NULL"
"4430","OK. Well, my initial meaning for that, time on the schedule today, there was no way you can be able to do that. Get Baskio branch for us tomorrow. That's where we'll start playing. We'll have...","NULL"
"2262","1.20 is the one that's going out at the end of the month.","NULL"
"1678","As a Developer, I want an EPrints integration, so that I can integrate data-packaged data with pipelines that use EPrints.","F"
"636","Okay.","NULL"
"4760","Because he's modified it now, because you couldn't yesterday.","NULL"
"2670","They've replaced them with the new FTR one. I don't know if that's it. It's happened before, that they hire somebody new, they don't have the  receive  .","NULL"
"4103","Yeah. That's fine. I was just saying, as we start this thing...","NULL"
"3417","This isn't an LCAM status. This is the status over in the other system they pull this information from.","NULL"
"2048","They can do that. I responded to Jimmy's email, I think just a few minutes ago. The problem there is that she's looking at  to see what's available. The specific item that she gave an example on is not available in LCAM because it's already sourced for other shipments.","NULL"
"576","I think they have to be hard coded in different languages actually.","A"
"3785","Mobile  but the HTML version of it, because it's going to be incomplete. I just thought in order to be able to release, the functionality that we want to release without someone thinking that this is a new version  .","NULL"
"4566","Someone's done that.","NULL"
"1195","As an Inspection Staff member, I want to Create an Inspection, so that I can schedule and assign the inspection.","F"
"2600","'Brian's not doing anything!'","NULL"
"2389","I just wanted to clarify.","NULL"
"4136","Give them two fingers if it's successful, and one finger if it's not.","NULL"
"4283","We need to give them the schema to ETR catalog extension after there's commitment, and so they take...you give us your data and you put in this format and then roll.","F"
"2817","Why? Are you restoring the database backup there, Brian, once you've done your stuff?","NULL"
"3136","I know, but what are your tasks  ? Do you want me to make one, and you can go off and research this?","NULL"
"2853","Correct.  .","NULL"
"2270","I think that'll be very helpful to run on  ...we'll just still  higher, for that one, and then...","NULL"
"2225","It's going to be our team, Jules' team, and then a couple guys from Denver. So we can open that up. We'll figure out how to do it.","NULL"
"45","I mean, we need some, some, uh, sort of, um, possibility to manage this entire tool.","F"
"2579","Just as long as there's  have to see  , we can give them an update on that this morning. They need to look at those 60 that are left, because they can't  FTR serial numbers.  .","F"
"4602","We as a group have caused a lot of our need to do context switching, because we oftentimes aren't done when we say we're going to be done. For whatever reason that is, and then we end up in a bind because we can't wait until we're done with something before we say we can...We have to keep things in the queue, in the schedule. Maybe next time, be thinking about that.","NULL"
"4999","Sure, I can run the scripts. Are they scripts that I need to create, or scripts that you're creating and you just need me to launch?","NULL"
"3407","Nice.","NULL"
"356","That's all, there shouldn't be any, um, post-processing of these ideas.","NULL"
"2147","It'll take me a minute. If you could give me the date so I can open it up, that's fine.  .","NULL"
"4231","But the problem was Frontier's not going to do it for whatever reason. Eversource was forced to do it for them. They don't have the capacity to keep doing, click here, click here, click here, click here. Eversource would ideally want Frontier to do their own surveys.","NULL"
"800","As a UI designer, I want to report to the Agencies about user testing, so that they are aware of their contributions to making Broker a better UX.","F"
"355","So let's somehow include in the next survey.","NULL"
"1197","As a Developer , I want to be able to log better, so that I can troubleshoot issues with particular submissions and functions.","F"
"4990",". Kim, what do you think the issues are, taking it down? We asked for techs to be available on Saturdays, and they say they do not schedule work on Saturdays. Unless Jim or Larry or our team's going to be in there on Saturday, I don't see...","NULL"
"3099",". Then reverse retire this one.","NULL"
"1635","we should change it to 2.0Male Participant: What's being worked on then?","NULL"
"1663","Right, and so that's what, again, doesn't make any sense and you might want to look at your remedy tickets because it seems like the virtual server for LCAM in Fort Wayne, you just got a remedy ticket on it?","NULL"
"2034",".","NULL"
"3462","I can try.","NULL"
"4494","...from meeting they called me about how it's done. I said, 'The meeting was only 20 minutes. I should have been in the meeting.' 'Why?' 'I wasted one hour explaining to three different people, all in the same meeting. I was not in the meeting.' This would have saved time, everybody's time. That's number one.","NULL"
"1870","As a team member, I want to have a schedule of more coworking slots, so that I can work in tandem with the rest of the team on a more regular basis.","F"
"1842","As a team member, I want to determine a design direction for the beta social page, so that we can implement a beta site quickly without established brand guidelines.","A"
"5017","It wouldn't be treated like take the old one out and replace it with the new one?","NULL"
"2073","I think somebody had made a request. I don't know exactly what it was, but it was something like BMA will just put a status on the order other than approve, and I think  or waiting on  was what they were talking about.","NULL"
"282","I think I already mentioned something about the engagement in the project description, which I've sent you, but I think we shouldn't go too much in depth with engagement at this point, because it's way out of scope for this first phase.","NULL"
"3883",".","NULL"
"4042","Let's estimate that from both sides, from whatever Baski needs to do, whatever Mahesh is going to...","NULL"
"2571","Well, my board's up.","NULL"
"3204","This one is supposed to be the one. You do a general change. It doesn't know what day you're referring to. You have to go back in and change the frame.","NULL"
"2478","That would be good to do.","NULL"
"765","Yeah.","NULL"
"302","Exactly.","NULL"
"3371","We can ask Smiley, 'OK, for the north, south, east, west, get the list of all the  belonging...'","NULL"
"3266","records   .","NULL"
"1900","Nothing from me.","NULL"
"3946","Yeah, you're not always going to get them on the home page with the conversations but if you go back to...","NULL"
"783","As a Consumer, I want to see some example data packages quickly, so that I get a sense of what is on this site and if it is useful to look further.","A"
"473","But on the other side, who wants to fill out the questionnaire, which takes roughly 30 minutes?","NULL"
"3159","Once you look at it, if it's  you change them. That's that one.","NULL"
"395","I mean, yeah.","NULL"
"4909","We're left with the same situation.","NULL"
"2131","...that can be brought up before releases, and even without releases. Is there a reprocess feature overnight to take something  ?","NULL"
"4819","There's never a dull moment.","NULL"
"2500","But, I guess  . Unless they hire somebody else. It doesn't need to be Susan.","NULL"
"2153","Don't want it to get lost.","NULL"
"2609","That's a problem, because they're editing it, and they're changing values, and then we're going, 'Nope!' And putting them right back.","F"
"2315","Eight.","NULL"
"2950","Oh, OK.","NULL"
"452","Let's say, I don't know, we have to think about this really detailed afterwards.","NULL"
"4242","Hey  . Hello.","NULL"
"4406","We can pull up the code, and it'll load. It was loaded by the interface. Then it started to quit. No maps.","NULL"
"557","Yep.","NULL"
"38","So I think we should, it's really important that we also offer such a service and we already discussed this, the board that this should probably something that can be used as a software, as a service where we have customers, they would just sign up to our application, pay a fee.","F"
"895","As a user, I want to be able to enter my zip code and get a list of nearby recycling facilities, so that I can determine which ones I should consider.","F"
"2835","Hey Brian.","NULL"
"4994","I think to DJ's point, by stopping on Friday afternoon, it allows us to get about half of the work that we have to do done Friday evening instead of eight hours or nine hours of work, total, that we have to do...If we don't bring it down on Friday night, and we can't bring it down until Saturday, you're not going to be back up Monday morning, because it takes us longer. The hours are on there.","NULL"
"1272","As a user researcher, I want to set up a website recruitment test, so that I can see if we can recruit users in real time from the website.","A"
"2092","Who all do you want? Or should I just send it to you two, and you all can send it to whoever?","NULL"
"216","I mean, are there specifics we, we need to discuss or that they're unclear or.","NULL"
"1352","Then you would just exclude the other one that has the map point stuff in it? That's what he said.","NULL"
"4716","If  well we also got to take it in, this is just a troll. We've created troll and now we've got to go find the user interface aspect of it. With map control view is referenced and what this...","NULL"
"2223","I just saw the number of people.","NULL"
"2070",", I don't have any experts on. Are they having to...If they approve  item to go  stock, or  , they approve it all, would there be a reason they couldn't approve ? We had that problem with   departmental request...","NULL"
"3252","Part of Bartender.","NULL"
"901","I know we said, 'Home page, basically that's where you're going to .' I think when we talked about that, how will that tie this together?","NULL"
"2231","What's the real story?","NULL"
"2242","I can't read the  . Whole transfer stuff...as far as I know we are on track for delivering at the end of the month, their go by date. Right now is April 4th. I do have some questioning on reports. They didn't give me four reports that they want. There's not a whole lot of detail in there. They said they need this before we go live.","NULL"
"540","I think that's, that's a good, a good way.","NULL"
"1490","As a recruiter, I want to be able to extend an ad for another 30 days by visiting the site and updating the posting, so that my ad remains active.","F"
"1760","As a user, I want to be able to view a map display of the special waste drop off sites around my area.","F"
"3357","DD column.","NULL"
"3495","If you wanted to do a cycle count that was entirely on the web side of things it's basically like what you're talking about doing a bay audit where you just take the raw data from somewhere, dump it into LCAM, look at it up there, make your adjustments, and then push it through that way.","NULL"
"88","Yeah.","NULL"
"4455","Yes.","NULL"
"1804","As a Practitioner, I want to include additional details about me in my profile page, so that I can showcase my experience.","F"
"3781","I thought it wasn't. I thought we were doing it as one, so if we had this contract management stuff that was using the HTML5, it could sit on top of whatever we've got now.","NULL"
"1468","I just sent it a few minutes ago. Let me see. I see...","NULL"
"4401","I put that for about five minutes . Why can't we just copy?","NULL"
"2367","That doesn't make sense. I'm not questioning you but...","NULL"
"3292","We can't change the end date. The start date doesn't really matter.","NULL"
"4124","Yeah. That's what we said. We're going to do it and within two weeks. Of course, we haven't let him answer the question yet of his estimate price. We're assuming that we will be able to.","NULL"
"2641","I dare you one day to just kind of add a fourth digit to it.","NULL"
"2997","Well, it's however you want to do it. They would like it with  order, so yeah, you can do it as just another column on the report, as long as  would be duplicated. And that's kind of how it sounds like they want it, as opposed to having it as a header child grid, because then they can look at everything.","A"
"2456","Thank you. Bye.","NULL"
"3473","A cycle count is where they go out and look and see what spare equipment they have in these spare cabinets, and LCAM says one thing, and what's actually in the field could be different so it has to be reconciled to what's there and what LCAM has. I don't often Kevin, do you know how often you do cycle counts?","NULL"
"1918","Yeah. Well, that's life.","NULL"
"2864",".","NULL"
"1825","I've got much better ideas after this conversation.","NULL"
"667","Yes, they have to be Recording.","NULL"
"2446","Sorry.","NULL"
"3687","It was very productive. I haven't worked on anything to actually use this yet, so it's good to know.","NULL"
"236","Um, yeah, I noted some types of questions here in preparation for this awesome meeting.","NULL"
"4006","has a create date, it has a timer, it has a status, it has  ...","NULL"
"4894","I'm pretty sure, but I'll have to look at that spreadsheet again to...","NULL"
"519","On an iPad, I think, yes.","F"
"1179","That all lends itself to this Notify being conversation-centric. Is that your question? To continue it that way?","NULL"
"3072","On this screen for reverse retire, this what we want.","NULL"
"2688","Can you see if Daryl is available?","NULL"
"3925","Yeah.","NULL"
"746","As a ResearcherDeveloper, would like the ability import/export from MS-SQL, so that I can use Data Packages in workflows that involve MS-SQL.","F"
"715","That's why I'm saying like the contracts or whatever it is. It's almost like I don't want it to be a different approach. We're still filtering it down to, if you just want a map or not, the map is there. A lot of the times, I guess when it is...","NULL"
"1997","That's  this scanner.","NULL"
"3113","Right now, none of these are required. Even if he made this the same screen for plugs...I didn't try and save all four. We could try and save, but it's probably the same thing. They probably require...Note was there, it was status and note, that was all that was showing up.","NULL"
"1945","So it's just getting the top one out of multiple matching...","NULL"
