"id","req_specification","class"
"3889","Is the name going to be that conversation  ? When someone logs on, here's my work and I can go from there and do my thing, I guess.","NULL"
"4319","Yeah.","NULL"
"1710","As a user, I want to be able to receive tempting rewards, so that I have a reason to use the website.","F"
"2993","No, it's here.  .","NULL"
"2981","Yeah, the other task would...To procedure results set.","NULL"
"4193","What are you saying, 'Fast pass,' or...?","NULL"
"2517","Back when I lived here, that would never happen.","NULL"
"3646","OK. I think that gives us enough to go back with a proposal to Kevin, which actually that proposal will probably wind up coming from Brett because when money's involved it's supposed to go through Brett unless it's part of a release, and what we're proposing would not be part of a...I mean we would have a release for it, but the DC3 part of it...","NULL"
"4640","I'll add all these to the list, as soon as whatever jerk has this thing locked...","NULL"
"4438","Whenever you get a chance to do that one.","NULL"
"1337","As a recyclingfacility, I want to be able to communicate directly with the site admin and convey any issues or concerns I have, so that they fix them.","F"
"972","Thanks.","NULL"
"1913","Yeah, as long as the tester gets updated like the week after or two weeks after so that it's available for when we need to do tests on the interface, because he's also off that week that you're off. That's why I'm like, stuff's got to be done. It's got to be right because you all are off, which is allowed. Just got to be done.","NULL"
"556","I think in the beginning somewhere you were talking about languages two questions, one to the business side, as in what languages are there is there a default language or how, how do we handle this?","NULL"
"4699","I know you talked about  .","NULL"
"4850","All right it's time to call them.","NULL"
"3599","OK.","NULL"
"3409","No.","NULL"
"2851","So you're saying that you've received new equipment  by looking at the wires? By wired information? But you haven't seen any of that evidence in LCAM, is that right?","A"
"3308","Provided those printers work since they've been moved.","NULL"
"1811","As a broker team member, I want to ensure the Broker resources, validations, and P&P pages are updated appropriately for the launch of FABS and DAIMS v1.1.","F"
"2303","to add, is there anything you want to ask or talk about  or suggest? I know right now we're still making  so the process changes and trying to hold on  process changes and also that we've touched a lot of issues  . I had you all feeling good on the HTML file as far as this iteration   .","NULL"
"4356","I had to ask her . I think so.","NULL"
"2635","No.","NULL"
"3508","It's still there. How does it work? I'm sorry, I've just forgot?","NULL"
"4875","Pardon?","NULL"
"4899","That was from CTDI what they got from Afinium? We're talking the same thing, right?","NULL"
"3550","Like are you preventing anything?","NULL"
"2145","It was on an email but I can't...","NULL"
"4812","As far as I'm concerned you can deploy to test whenever you're ready and we can get back to using...","NULL"
"2965","There's start and end date. You start  .","NULL"
"2431","That did bring me to another question. I can't find warehouses in the data at all, and I know that, Ken, we got feedback from you to look at the building type field that's there, and that was beneficial. We found the field locations, and may denote it as CS, which I assume is Central Stock. RDC Remote Distribution Center, and then I think an IDC is an Intermediate Distribution Center.","NULL"
"744","It still doesn't help us because it's still going to...","NULL"
"4888","That they didn't have CLLIs because initially they were thinking that the ship to codes, or the to location codes were CLLIs. But, no we haven't tried to do the Fuzzy Logic Lookup.","NULL"
"471","And also from a user experience part, and I think the limiting of the questions would not be a good, a good thing because what if you have, for example, 12 questions, so you have to create two different surveys.","NULL"
"2584","I'm still working on that. I've got to update  out, and couldn't touch TFS. I'll update LCAM.","NULL"
"898","As a trainer, I want to copy one of my courses or events, so that I can create a new one.","F"
"3081","retirement   .","NULL"
"1423","As a Developer , I want my domain models to be indexed properly, so that I can get validation results back in a reasonable amount of time.","A"
"1932","Yeah, hopefully.","NULL"
"3109","There a danger in doing that?","NULL"
"1196","As a moderator, I want to view a transcript of a game, so that I can see the stories and estimates.","F"
"2049","I think she's doing the right process, but she's not looking in LCAM to see why it's telling her that, that equipment isn't available when she looks on the shelf. At least I think that's what that screenshot was of.","NULL"
"4680","Then you would just exclude the other one that has the map point stuff in it? That's what he said.","NULL"
"4277",".","NULL"
"4022","Let's think about, right now, what our resources are. Baski's fairly limited for how long? I know you've been working with Mahesh, but you've got a relatively full plate for...","NULL"
"426","What about you?","NULL"
"3092","Would it be a  , either case?","NULL"
"817","As a camp administrator, I want to be able to warn a camp worker who I think did his/her job inappropriate.","F"
"1846","{pause}","NULL"
"2334","I'm talking Visual Studio. We need to  .","NULL"
"1683","As a publisher, I want to package reproducible steps to get a certain data state, so my methodology is transparent and can be rerun by others.","F"
"211","Certainly depends on, on which exact client we're talking about.","NULL"
"4133","You have the app for mobile.","NULL"
"1369","As long as it's not scheduled over the weekend, I don't care.","NULL"
"2164","Hopefully the WebX I'll set up for Wednesday will help.","NULL"
"4841","He has it.","NULL"
"2537","Why do you disagree with that?","NULL"
"11","Cool.","NULL"
"2666","Hi, who just joined?","NULL"
"3061",". What do you think,   ?","NULL"
"3338","Those 22, 247, then you go...","NULL"
"1453","That's perfect. I know my issue has been recognized.","NULL"
"1021","As a Developer , I want to determine how agencies will generate and validate D Files from FABS and FPDS data.","F"
"2813","pseudo code.","NULL"
"2283","Yeah, some new members. I think we need a refresher course.","NULL"
"5001","Yes, that's something I can do.","NULL"
"3103","It doesn't show a plug, it messes with your hardwire.","NULL"
"2075","He already covered the split, over here, and stuff we just talked about  if they can't change that source, I don't know what we're doing wrong.","NULL"
"3183","Both wrong  .","NULL"
"3589","That was what Smiley was trying to bring up to them even with wireless scanners someone's got to be wherever to handle this.","NULL"
"2409","I've got a call in to  . I guess I can call again. Everybody's busy who's on call. So Ken, if we didn't have a ship-to via on some of these, I think you're going to be...I don't even know what we would ship to those pseudos.","NULL"
"2092","Who all do you want? Or should I just send it to you two, and you all can send it to whoever?","NULL"
"2363","Use that company plant to first map to the CLLI six of the  key data? Oh, so you did do that.","NULL"
"3757","You can, but...","NULL"
"4531","Part of it, yeah.","NULL"
"1790","As an admin, I want to view a dashboard that monitors all the sites' statuses, so that I can have a sense of what people are doing on our sites and know the service status.","F"
"4633",".","NULL"
"3818","If there's something simple enough that it's a testable thing, it's just not used in production as long as it's testable...","NULL"
"4479","I'm pretty sure that was domestic violence.","NULL"
"2313","Who's next?","NULL"
"3149",". This is the one I showed you.","NULL"
"2031","You mean...","NULL"
"4788","No. I forgot to. I'm sorry.","NULL"
"1696","I know, it's hard.","NULL"
"5007","I know, and I did not expect the window to close that quickly. I should be getting used to it, I should be used to it, but I keep thinking something's going to change. But don't worry about it.","NULL"
"4395","It's the community, one of the guys. Actually those are my signals test.","NULL"
"1679","Good.","NULL"
"2664","Do we have anything?","NULL"
"2753","No, now we're going to try...We didn't quite die. Now we're going to try...","NULL"
"4069","We're attacking it from the opposite side. We're attacking it from the top down instead of the bottom up. Now I've got a placeholder for blah, and I need it to do blah really, really well, but I don't know what blah looks like yet.","NULL"
"1837","As a Consumer, I want to download a DataPackage's data one coherent SQLite database, so that that I can get it easily in one form.","A"
"3215","I wouldn't change it.","NULL"
"1382","As a camp administrator, I want to keep track of the usage of internal camp facilities, so that I don't create conflicting schedules for the different camp groups.","F"
"907","It's managing assets and then actions. I think there's still going to be two.","NULL"
"3619","Of what I know before actually diving into it that's what it feels like.","NULL"
"2730","But second, yes, there is a discrepancy. We were going to keep that manual anyway, correct? I think even Mike agreed.","NULL"
"4576","Or, 'Hey, we're doing a total rewrite of our application. We need you to automatically know HTML5 and JavaScript, and CSS, and all that stuff. Go write that stuff.'","NULL"
"3016","Change the  , pull it  .","NULL"
"3458","to interview, unless you think he just wants to hear back from you.","NULL"
"2679","Susan, I sent you an email and got you  call.","NULL"
"2872","That's pretty much it. I will talk to Michael a little bit later to see...he's researching a program to replace IIS.  It's really fun. As soon as he lets me know...I'm just really curious if it's going to work on your computer or not.","NULL"
"433","Uh, I wouldn't say yeah.","NULL"
"4234","Ideally that would be great. I don't know that that's a necessarily a requirement right now. That's what I'm getting from them.","NULL"
"2829","Hi,  .","NULL"
"635","I get the message for really bad network quality.","NULL"
"3394","Oh, yeah.","NULL"
"2902","Actually,  . So, this report?","NULL"
"378","I mean, now I really liked that here with the swipe question, I, I wrote this down and also to comment the ability of questions.","NULL"
"4961","It'll be me, or Adam, or Grady. One of us will be working on that.","NULL"
"3395","Two. That sounds reasonable to me. I was thinking one or two at least, it depends on how much testing you have to do.","NULL"
"3584","It's a push tab.","NULL"
"2844","That way somebody can go in there and prioritize whether or not  to that direct location or somewhere else.","NULL"
"1993","Not much. How are you?","NULL"
"1267","As a Developer, I want an Elasticsearch integration, so that I can integrate data-packaged data with pipelines that use Elasticsearch.","F"
"2893","He must have a desk phone and a cell phone.","NULL"
"2823","Thanks, bye.","NULL"
"4235","Anybody can leave.","NULL"
"2597","And Brian doesn't have anything?  He's afraid to try and break his stuff apart into tasks. I don't think he has any tasks out there, so they wouldn't show up on the board. He's being a bad boy  .","NULL"
"521","And then there is like a neat dashboard or something that he has on his iPad, which is like some starting screen, or I don't know.","F"
"3015",".","NULL"
"1584","That's it for me, too.","NULL"
"2743","Bye.","NULL"
"1906","Of course.","NULL"
"4830","Yeah.","NULL"
"880","As a Researcher, I want to get my Excel spreadsheet into a Data Package, so that I can benefit from better tooling and standardization.","F"
"2342","It's a lot of emails I've gone through. I've gone through more in the last two weeks than ever in a two week time span. OK. Did you all have anything specific you wanted to talk about?","NULL"
"1424","Even worse, really high. See if anybody notices. I might do that, now that you said that . Whenever I get to the 90s, instead of it being issue number 90 it will be like 92. Or something.","NULL"
"3663","Done what?","NULL"
"2610","That's a problem, because they're editing it, and they're changing values, and then we're going, 'Nope!' And putting them right back.","A"
"2354","I've got it open, here. That was one of my two things, so I'll jump to that one. Yeah, Brian...Let's see, where are we? The company plant couldn't find a CLLI code.","F"
"4363","Also, we had talked briefly about what kind of functionality it would need. Michael said disregard the boundary thing. We will care about how our company,we will care about anything except placing access on the map , so we're running differently.","NULL"
"1360","As an Applicant, I want to Check the Status of a transaction, so that I can understand where the provisioning of my service is in the process, such as information related to service levels, fees, plan review, permit, or inspection results.","F"
"3982","Yeah, I like that.","NULL"
"4745","I didn't make you a bug. Do you want me to move one of these back?","NULL"
"1367","Those are the kind of issues that scare the crap out of me. I know they're trying to use it.","NULL"
"2006","I don't even know if anybody else is going to join.","NULL"
"743","As a parent, I want to see which counselors are assigned to my kids, so that I can have peace of mind.","F"
"3826","I think it's under Home page.","NULL"
"1606","As a moderator, I want to accept the average of all estimates, so that we can move on to the next item when we agree.","F"
"4797","Those should be scripted then?","NULL"
"3967","they go directly to the landing spot or whatever.","NULL"
"2895","That's OK.","NULL"
"1286","As a parent, I want to be able to message my child's counselors, so that I can voice my concerns or check on my child's progress.","F"
"4405","We shouldn't run that.","NULL"
"2501","Like a project manager?","NULL"
"2889","OK.","NULL"
"1692","As a Staff member, I want to Manage Bonds, so that I can track and manage bonds throughout the lifecycle of the project until release.","F"
"4904","Like the one example I sent, Marion, Maine, I just picked it because that's where I live, but coincidentally the street address was the same. I know we have all sorts of versions out there so that wasn't meant to act like, 'Oh, this is easy to do.'","NULL"
"3728","Mugshots burgers are...","NULL"
"2060","You click that, and you can say split it off, and you can...","NULL"
"985","As a developer, I want an DSpace integration, so that I can integrate data-packaged data with pipelines that use Dspace.","A"
"1255","Would have been real blood.","NULL"
"875","As a ResearcherGovernment Publisher, I want to add reference data on inflation to my spending dataset, so that the spending lines in my dataset is more understandable.","F"
"213","Yeah.","NULL"
"1346","As a site editor, I want to be able to designate whether or not an ever makes the home page, so that the best content is featured most prominently.","A"
"2330","Everything would be on the same.","NULL"
"4609","That's right. Once you have that streamlined, then I give you everything and say, '  , come back in two weeks  .'","NULL"
"156","How do you have any ideas on how we could actually bring the survey to the employees on a most simple way?","NULL"
"1","Let's do it.","NULL"
"481","But here it's just together a claims like the manager really wants to fill the polls of his team in a specific topic.","NULL"
"3359","These are network trends equipment. These are more like smart jacks, or like shells that are out on the customer prem. I understand it's because this is what's happening. They only have the people there in the customer prem and they removed the equipment.","NULL"
"775","As a site member, I want to fill out an application to become a Certified Scrum Trainer, so that I can teach CSM and CSPO courses and certify others.","F"
"1916","Of course.","NULL"
"3759","We've got two hours, so...","NULL"
"651","Yeah.","NULL"
"4829","The one they want to load is CLLIs in LCAM?","NULL"
"2133","Yeah, I'm here. Reprocessing from the SCC page?","NULL"
"1758","OK.","NULL"
"4469","Yeah. Right now, Baski asked over the last year or so, back when he was doing Friday classes, for ideas. These don't necessarily have to be done by Baski. If somebody else's got something, an interest that they're willing to, has some expertise in these things and want to give a class on it...","NULL"
"4096","2.0Female Participant:  Oh, you want to change the release?","NULL"
"349","No, but I think we sh we wouldn't have to go that far.","NULL"
"1770","That really doesn't mean anything. It used to put a file on the FTP server, but now if you go back to...","NULL"
"1711","Then the second side of the coin is we have code, it's spread out across a lot of different modules, or locations for the location in TFS and what they're working on.","NULL"
"4744",", right? We had this discussion.","NULL"
"4259","All right, I'll do that then, before I try and schedule something. It's 9:21. I'm bringing up what we have. Do we still have testing the CTDI? Did they send something else yesterday?","NULL"
"3815","It started today, really. That's what we said. Now that could be tomorrow, or the next day, but...The iteration, first iteration starts today.","NULL"
"2235","There will be nothing to worry about right now.","NULL"
"467","But normally the questionnaire is already grouped by, by topic, isn't it?","NULL"
"3166","No, second character.","NULL"
"3528","Now. Request web post data. Don't do that to me, David.","NULL"
"856","As a site visitor, I want to view lists on the site of all Certified Scrum Masters, Practitioners, Trainers, and Certified Scrum Product Owners.","F"
"2270","I think that'll be very helpful to run on  ...we'll just still  higher, for that one, and then...","NULL"
"3013","has to say.","NULL"
"802","I realize we didn't do the actual disconnect.","NULL"
"1532","As a potential research participant, I want to learn about the research and leave my contact information.","F"
"2545","That probably needs to happen soon, because he was pretty adamant about it.","NULL"
"511","Because it has to be viewable on different devices.","F"
"1539","OK, Grady's got generate report data.","NULL"
"608","Yeah, I think we have to keep it simple here as well for this project phase one and just go with three languages, German, English, and French and French, and just make sure that at the launch day, these languages are implemented completely.","F"
"4461","The 19th is a staff meeting.","NULL"
"924","If you could ever get two hours.","NULL"
"260","Yeah.","NULL"
"1256","As a Researcher, I want to get a Data Package into LibreOffice/OpenOffice in seconds, so that I can start using the data for doing analysis and visualizations.","A"
"1073","We'll go ahead and get started. If calls, he'd probably call me through the other terminal.","NULL"
"953","As a user researcher, I want to test the user research plan, so that I make sure the in-person interviews are effective and capturing the right information.","F"
"2516","","NULL"
"1301","As a camp administrator, I want to be able to assign different positions to the staff members, so that it is possible to organize activities in terms of responsibilities.","F"
"726","Yes, that's right.","NULL"
"239","And there's the question.","NULL"
"2473","Jasmine threw it all out to TFS i think, from the  . It's terrible.","NULL"
"1717","As a Staff member, I want to Manage Affidavits, so that I can ensure compliance with the requirements prior to the hearing.","F"
"4176","The problem is, TFS...","NULL"
"2557","You can put a link to our  .","NULL"
"3505","We could modify DC3 to maybe smooth out that process a little bit to where it's not as complicated, or streamline it. You can go either way. You're basically either...you've got to simplify the process in DC3 to only work at the frame ID level and strip out a lot of the...","NULL"
"2681","I've got it, DJ. We don't have anything else, so wait for the other caller to go over it now.","NULL"
"3828",".","NULL"
"3462","I can try.","NULL"
"1459","As a site visitor, I want to view a section of the website that teaches me the basics of what Scrum is, so that I can learn that quickly.","F"
"489","I don't know how much sense this makes, but I think it, it should be possible from a technical aspect.","NULL"
"650","Yeah.","NULL"
"3489","When you all did the warehouse...","NULL"
"1079","Not on the journal change. Estimate is, but isn't. So, that's what this change is, which it only took us 45 minutes to get there.","NULL"
"1706","As a web recruiter manager, I want to confirm the recruiter is set up and working properly, so that I can deploy it on more pages.","A"
"1931","When do you realistically think it might be something that you can release to us for testing? Like, next Wednesday ish or going to be later? If it's later, then it's later.","NULL"
"259","Would be nice.","NULL"
"1653","As a camp administrator, I want to be able to notify parents all at once, so that they can be notified of any upcoming events.","F"
"4441","Baski.","NULL"
"2973","Yeah. So, just here it needs to be.","NULL"
"3847","You have it broken down a little bit more inside there.","NULL"
"202","So they are just all on the top level and its like a pool of project managers and the top level and out of this pool, those, the entire structure or hierarchy of the business.","A"
"2658","I don't have any, Grady.","NULL"
"323","That's for sure a big problem.","NULL"
"2988","You're good?","NULL"
"4095","Yeah, if that could be done in the two weeks, then they could all be in 1.20.","NULL"
"423","It's a little early, but I manage.","NULL"
"4256","Kaylow, actually, he called to tell me that he needs to not be on the call.  I was like, 'Good, I don't need to figure how to conference.' You think before I even have a kick-off meeting that I need to get with Daryl to get clarity on what project we're doing?","NULL"
"2252","The whole point of this sustainment team-creating is to try to limit the distractions and do our schedule part. What we said out of this...we had that meeting. Joel and Karen ran it, talked to the customer and asked questions back and forth. What we really want is Jesse and Jasmine running that meeting.","NULL"
"2135","Yeah. I finished a script recently, was finishing up early this morning, to take all those and get them back to where they'll go through workflow again, reprocess so I can execute that procedure.","NULL"
"3176","The Data Garage?","NULL"
"138","This could be quite interesting.","NULL"
"2074","We'll take it back to them  look at the next one  more.","NULL"
"2707","Their proposal was to send it out as one part number and then we would send another message, have it coming back in as a different part number. Still, the code doesn't change the part number when it comes in, it  that VIN and moves that VIN where it needs to be. It doesn't change the base equipment on that, that VIN.","F"
"2338","I don't think it's a to-do yet, because I don't think we're at a point to do it. I think we're going to have to figure out how we're going to do it, because we have at least three right now. We have 2010, 2012 and 2013. I think it needs some discussion around strategy to do it first, before it becomes a to-do, and then once we do that then it could be something to do, someone actually doing it.","NULL"
"3848","You could use the technique like a bounding technique to kill off the things that are going to take three years to do and say, 'I don't want to spend more than 50 points on this,' or, 'I don't want to spend more than 20 points on that.' Whatever design you come up with, ultimately has to fall within those constraints.","NULL"
"293","So this will be a big benefit for the manager in the end, because then he gets ideas and already has them sort of pre-filtered by their importance or, you know, um, on Reddit, they have a similar system when you post something Reddit, people can opt for download it so that the most relevant topics on Reddit in our cases will be ideas they're on the top.","F"
"2728","Jim. Right.","NULL"
"337","And then he can include this in the followup survey, like Mark mentioned, and in this follow-up survey, the people then get to vote.","F"
"525","Maybe because you, you need also a good input device, like a keyboard or something, because if you create new employees or new questions, you need to type a bit of text,","F"
"287","They should not just be there in click to questions they should of bringing in their own ideas, which in turns can then be seen by other users.","F"
"2137","Yeah, that would be helpful.","NULL"
"406","And for all the questions we can have all the types, but all in all, I would say for the, um, usability or visibility of the results, it would be good to, to group the question types together.","F"
"1895","You did. Last week. We tested some of it.","NULL"
"2942","will take the longest, say, one hour. Half hour, rather.","NULL"
"899","As a Researcher, I want to get a Data Package into Excel in seconds, so that I can start using the data for doing analysis and visualizations.","A"
"3198","Probably nothing because, like I said, Kate  these and confused the heck out of me. I tried to go back and clean them up.","NULL"
"179","And as soon as this happened, he sort of maybe gets a email that says Hey, welcome to the, to this, uh, project.","A"
"1413","before follow it again, hours of testing .","NULL"
"2344","I haven't gotten back to that one yet. I do remember reading it...Stop it!","NULL"
"3075","Start with a plug. Start with a plug and try a frame.","NULL"
"189","Well, with the user accounts that is actually I think more ideal because then we can actually like pinpoint to specific users and it's not an email floating around somewhere.","NULL"
