"id","req_specification","class"
"3823","Right. What we want to do is on a big level, make sure that we captured everything here, and then see if we can figure out a general full-scope, figure out what we want to do first. Then that will end up being the first iteration, and at the end of this iteration we'll see what Mahesh has  . We have our Agile classes to know what's good.","NULL"
"965","...a canned query. I can't remember what the title was called, of the report. I'd have to double check it. She was getting some random results and others were getting good results query, sensitive to multi, people trying to use it at the same time. The point is that current results were impaired.","NULL"
"362","The comment box in your, this is question specific, right.","NULL"
"3023","The other thing that they're doing is change multiple frame ID's and put a  in them, so this is the one...Search assets and then just pick a frame...","F"
"176","I mean, actually I really like what Mark said.","NULL"
"1498","Agreed.","NULL"
"209","Yeah.","NULL"
"1312","As a site visitor, I want to see a trainer's rating, so that I choose a course from an appropriate trainer.","F"
"3726","Oh, yeah. I'm so full. It's horrible. It was delicious but  .","NULL"
"2234","That's exactly...close one, because we did not do one on Monday. We did one on Sunday, didn't do it on Monday. We did one Sunday with every business position.","NULL"
"3432","Are we thinking three months to two?","NULL"
"3242","that one. I was trying to make sure I wasn't   . This is the one that's really...","NULL"
"2176","Not all of them.","NULL"
"3446","Yeah.","NULL"
"3009","There are three that are related. There's this one, there's this one, and there's this one, and they're all related. Right now, if I go to...","NULL"
"1899","Nothing from me.","NULL"
"3575","I'm sure they could find some along the way, but once again there's like a Kevin Smiley question. To me I think they just wanted to have login in to LCAM and click the cycle count function button on there and then a have a cordless, wireless scanner be able to talk to LCAM just let them do the function directly into LCAM.","NULL"
"3696","My family is from Ireland.  .","NULL"
"2499","OK.","NULL"
"941","Long-term goals.","NULL"
"2792","Late Friday afternoon.","NULL"
"4930","There might be 10,000 location codes in there. You might end up with a thousand matches, but at least that's a thousand that you would have that we don't have to look at again. That would be low-hanging fruit to me.","NULL"
"311","I don't know, the espresso machine motivates me the most at work so I can submit this and then others should see this.","NULL"
"3580","It just...","NULL"
"1503","But it could have chose hardwire and plug, right?","NULL"
"3295","I would say four is when we get past Frontier.","NULL"
"1053","We're actually not going to get the data until maybe early on the 3rd. There's really no reason to take down the database on the 1st...","NULL"
"3700","Where did you grow up at?","NULL"
"902","We estimated that, that one was three? How did we estimate that at three? Wait, this was on 45. That may not be three, because he also did not put any of the estimates on there. He did estimate that at three. Why is it three? What else has to happen? Because these are our estimates.","NULL"
"739","As a research participant, I want to make sure that the appearance of the prototype does not distract from the workflow, so that I can complete the user interview.","A"
"2703","We seem to have one that's still bringing back in...","NULL"
"2245","Yes, we did.","NULL"
"3142",".","NULL"
"3577","Right. Kevin, he talked to me about it as well.","NULL"
"2095","Larry, Karen's concern with the ship via CLLIs, and then the CLLI code that  , we need them. We're working on reviewing that in-house first, OK?","NULL"
"3966","Then you could just take them there. They go directly to the conversation.","NULL"
"368","Okay.","NULL"
"160","So they're just having an account such that, uh, the managers can send them, uh, uh, emails, you know what I mean?","F"
"4723","OK. It's up there. I don't know what it's going on here.","NULL"
"1220","If I see a bunch sixes or sevens or something or a bunch of tens and somebody uses a seven, then it's like, 'Why is it?' and then try to address what the concern is. So like Patrick in , what would make it better than a seven?","NULL"
"51","So like the project manager is the admin of his own business?","F"
"2483","Who do you need to sit down with?","NULL"
"4108","That's been built and is ready to go, it just hasn't been released to production yet. I've got to look at the permitting thing on the conduit.","NULL"
"2142","Do you know which report she was running?","NULL"
"104","Um, so I wonder, I wonder if, if it makes sense that, that a project manager should be able to also see and maybe even be able to add it surveys from managers below him, or should he just exclusively, um, be able to manage his own service?","F"
"613","I mean, yeah.","NULL"
"742","Yeah.","NULL"
"2469","I need to also be working on the changing of the icons for the notify  .","NULL"
"1549","My God.","NULL"
"2933","Yeah.","NULL"
"2117","Going to be a big one, but...","NULL"
"1831","As a Developer, I want a jQuery plugin for Core Data Packages, so that I can use it to apply to form control that uses a core dataset for autocompletion.","F"
"2560","It shouldn't fit. Adding a link to the home page is not a big deal. It's going to change everything to make  .","NULL"
"676","As a site admin, I want to delete any course or event, so that I can remove things that will no longer occur.","F"
"4512","That's so unfair to them. Because I cannot expect them to estimate anything until they fully understand the context.","NULL"
"4118","The login.","NULL"
"159","So they have an account, but they never, uh, they never, they don't have access with this account to the, to our tool.","F"
"2182","Feel great things.","NULL"
"1135","As an Applicant, I want to Pay Fee, so that I can satisfy outstanding charge associated with the service requested or received from the County.","F"
"758","As a trainer, I want to list my upcoming classes in my profile and include a link to a detailed page about each, so that prospective attendees can find my courses.","F"
"2695","To tackle the first one, first. You're saying that Mike suggested to use existing interfaces, is not appropriate or what...","NULL"
"3162","Of course it's not.","NULL"
"4107","All that's been built.","NULL"
"3263","Right now you cannot retire inventory  equipment. You have to move it to in service and then retire it. This one I remember, because I asked him about this 166. I sent him a bazillion emails on it. I remember, when I finally understood it. It makes perfect sense...","NULL"
"4205","When I do it 500 times. That's what it is.","NULL"
"2856","He'll pull it out wired, and we'll see how he does this. Check with the original PO to make sure they're all received, which normally isn't...We'll check on it.","NULL"
"791","They've got the scanner. They can have their cycle count up and scan the stuff in. That stuff sounds more like DC3, which I did have that thought when I was talking to him about it. I don't know why I didn't invite you to this meeting. My bad.","NULL"
"2352","No, I'm good.","NULL"
"1112","Please enter the conference pin number.","NULL"
"1968","That's not good.","NULL"
"754","This is a journal update. This is similar to frames. It's a frame update but it's a journal change.","NULL"
"3006","page break","NULL"
"218","I mean, we just talked about those now more or less, but I mean, and, and also now about the communication, so just let me briefly get, um, pinpoint this down.","NULL"
"79","Yeah.","NULL"
"2749","Have you done any testing with CTDI yet, right? Are you all ready to test with CTDI? He's trying. He's calling again. I'm going to try this another way, Brian.","NULL"
"347","As in, if you have simple possibilities, then the processing is also simple.","NULL"
"1603","As a broker team member, I want to derive FundingAgencyCode, so that the data quality and completeness improves.","F"
"3964","workflow, with everything underneath it. You click on Poles and then you've got your links to all the things you can do on the poles.","NULL"
"4925","Yeah.","NULL"
"4857","Good morning. It's Kim.","NULL"
"4059","I don't want to end up doing all these great pieces and then  .","NULL"
"125","Would that be a fully customizable tag or predefined texts?","F"
"4250","Alright, thank you.","NULL"
"2173","It's Kaitlin.","NULL"
"4105","we should change it to 2.0Male Participant:  What's being worked on then?","NULL"
"2798","It did! It worked.","NULL"
"3690","Well, that part I do know. The code I don't. TFS I know.","NULL"
"4039","It seems like year-end. I would like to have an iteration. It might not be what I envision in the sense of  page but that I can logon with the same credentials and I can see a list of conversations...","NULL"
"1646","As a Researcher, I want results to be stored in a non-identifiable way, so that I can study the data to see things like whether estimates converged around the first opinion given by 'estimator A' for example.","A"
"4185","This is more, if you want to go and look at all of the epics.","NULL"
"4818","What I have that we need to talk to them about today. I'm going to ask them what they found out from monitoring the ports because I want to know.  Then the CTDI...","NULL"
"1431","You sure ?","NULL"
"3941","Maybe, for me, I might feel better if the epic was the conversations for the home page. Maybe just say an assets page.  and when I open the next asset, and the next asset, so I don't have to open up these things...","NULL"
"57","Yeah.","NULL"
"4271","That's not bad.","NULL"
"4161","In this two weeks? OK.","NULL"
"4766","Yeah.","NULL"
"2748","We'll go ahead and get started. If  calls, he'd probably call me through the other terminal.","NULL"
"3697","I grew up in... DuChock.","NULL"
"3400","We run it against our test. See what happens. Send him the results say, 'Do they look good?' We've run against their test, be absolutely sure. Have them look at it there, and then we can run against production.","NULL"
"3673","Task or anything like that?","NULL"
"5012","Oh, OK.","NULL"
"4102","As 1.20, because I have bug fixes in there.","NULL"
"2510","No.","NULL"
"2454","No.","NULL"
"203","Okay.","NULL"
"76","I mean, this is, as you said, a, a tool for, for survey management or like creation and organization and reporting.","F"
"2196","Mm-hm. Look at the paper. It's super cool.","NULL"
"3860","Mahesh.","NULL"
"2231","What's the real story?","NULL"
"2598","And very silly.","NULL"
"2238","Apparently, we're going to be converting those assets at some time on Saturday, April the 2nd over Verizon. As far as where the rest of the release is, Drake's trying to not have email up, and get his work done for the release and quit working on emergency releases. He's trying to keep it down so that he can get caught up. Everybody else, I guess, is on track. Nobody said they were stuck.","NULL"
"3300","I was just saying four because if you said three is going to put us, clash us right with the, when we're dealing with the frontier, we're at the beginning of April.","NULL"
"3660","Yeah, give me the latest version.","NULL"
"633","Can","NULL"
"3058",".","NULL"
"3280","Stuff.","NULL"
"1486","As a camp administrator, I want to create an avenue so parents can submit feedback and general concerns, so that I can keep improving the services I provide.","F"
"1395","As a Publisher, I want to publish a data package where its resource data is stored on my servers but the registry caches a copy of that data, so that that if my data is lost or gets broken I still have a copy people can use.","F"
"2257","checking everything she did   .","NULL"
"3548","I have a couple of questions. When they're doing this cycle count can the equipment be moving behind the scenes?","NULL"
"1543","All right. Tuesday is not great. Wednesday is better. I can do Tuesday, and split it. I can do...well. Why don't we do 1:30? I've got to run, so that's the most important thing. Just kidding. That's why he thinks, schedule a 12 o'clock meeting ruins our whole day. We can do this, 1:30...we're going to an hour and a half tomorrow,or do we need to do it in the morning?","NULL"
"2094","OK. All good.","NULL"
"4686","It really looks so easy. I guess I just go over my own thing. I need to  . Not the coating itself, but you know.","NULL"
"2030","So, that's the only update we have for you guys. Do you all have anything you want to talk about?","NULL"
"2548","I'll have the discussion with him and then  . Ultimately it's, we can decide whether or not we want to do that. It's a landing page for something that people that are interested in knowing what it is will be going to.","NULL"
"4605","Because during the last four iterations of testing, now I'm starting to plan out the next release.","NULL"
"2195","Seriously?","NULL"
"1967","For instance, yesterday, we found that on some assets, there's no status. The status field is blank.","NULL"
"2161","Yes. I haven't replied to it, and it's old, and I probably moved it. I know last week you and Ken were going to get together about what the roles would need to be for the month's scanning  . That determines what screens they can see. Still send me that email and I'll look at it and see if I can  it.","NULL"
"1972","It will have the sequence number in it for the Verizon data so that it can be tied back to the Infinium or whatever that sequence number was related to. As far as the code, the code doesn't look at that legacy ID for anything.","NULL"
"2058","Normally, what we've done in the past is, we would be able to split that order so you would be able to push through and process  available. Create  a different order for the one that was not in stock. You would put in for that order's status.","F"
"4513","For that particular project, you guys...","NULL"
"3429","Otherwise we would be social people.","NULL"
"3403","She's like a contractor. She took seven weeks off. She does this every year though, she takes off big blocks of time. She just doesn't work.","NULL"
"355","So let's somehow include in the next survey.","NULL"
"2321","addressing all the concerns we have   .","NULL"
"2579","Just as long as there's  have to see  , we can give them an update on that this morning. They need to look at those 60 that are left, because they can't  FTR serial numbers.  .","F"
"3730","You've got a deposit?","NULL"
"507","That what I'm worried about is how, how we are going to represent the state of the overview, as in where, when, how do we define how the report looks, where each widget is placed?","NULL"
"710","As an admin, I want to view user error logs, so that I can fix or review any issues that are being faced by users of the system.","F"
"891","Fast Path.","NULL"
"388","Yeah.","NULL"
"2379","Which is going to be more difficult, and probably impossible to do in this case, because you could probably clean them up  extract 4, but then when we get the next extract, then there's going to be more stuff in there, potentially, that we haven't even considered. It would be nice if we had more broader swath.","NULL"
"4089","The user story, 'You can login with a tablet, you can login with a phone, and you can login with your PC'?","NULL"
"4529","But there are several occasions where there are no development people involved in these decisions where dates and stuff come out of. I'm working on that one. Anything else? I've got that captured here. If we don't want to add anything else, then we can pick one of these to discuss. See if we can move along before we get to talk about the projects and what you're doing.","NULL"
"3635","They did.","NULL"
"2690","Yes.","NULL"
"3925","Yeah.","NULL"
"4201","That's just what they called it. They wanted a fast path to...","NULL"
"1856","As an agency user, I want the FABS validation rules to accept zero and blank for non-loan records.","F"
"4202","It's a bulk edit.","NULL"
"4042","Let's estimate that from both sides, from whatever Baski needs to do, whatever Mahesh is going to...","NULL"
"2160","I'm scanning transactions, email of March 11. It's not  . Reply  , so there's  question from Nicole and Peggy. They're working on .  getting critical. You need me to forward that email again? You know what I'm talking about?","NULL"
"242","And then, uh, one can take the, the question that is depicted like a card and can just swipe it to the area wherever you want.","F"
"4671","Page. I cannot believe I just made a connection between the stuff I did several months ago and then now  . Page. The last name sound familiar, I don't know if it sounds familiar, but I've never met her, I'm kidding.","NULL"
"644","And if yes, in which form it should come across.","NULL"
"3188","How can I narrow it down to this? I have to go trough 834 records.","NULL"
"2062","...orders are right...","NULL"
"4372","We'll see what issues we encounter.","NULL"
"2826","Jim's on.","NULL"
"3374","It's in the database.","NULL"
"1651","","NULL"
"561","So we say this project supports English and German and from French.","F"
"781","But that would only apply to hardwire.","NULL"
"1982","Please enter your conference...","NULL"
"2315","Eight.","NULL"
"766","As a trainer, I want to be assured that no one can submit the same answers multiple time and skew my results, so that my ratings are accurate.","A"
"4064","We need to try our best to come up with a list of doable work/stories for this iteration, and then maybe between us meeting together a few times, some of us in the next two weeks while that's being worked, try to start coming up with a good backlog of stuff so that we're not sitting here each time trying to come up with  what we need to do.","NULL"
"624","So I show it, just clarify some, some more things that might be unclear for you, because from my side, I'm quite happy with our outcome of this meeting.","NULL"
"3529","You did that on purpose.","NULL"
"2886","Hello","NULL"
"4494","...from meeting they called me about how it's done. I said, 'The meeting was only 20 minutes. I should have been in the meeting.' 'Why?' 'I wasted one hour explaining to three different people, all in the same meeting. I was not in the meeting.' This would have saved time, everybody's time. That's number one.","NULL"
"1274","As a user researcher, I want to have the WIG prototype, so that I can finalize the second task script.","A"
"3279","Do some stuff?  Is that what you want your task to say? Do this. Do this.","NULL"
"2158","We're getting a lot of calls from the techs, and I've been trying to email. It was 3/11. I am sorry, folks.","NULL"
"3527","You in production?","NULL"
"1964","OK.","NULL"
"284","Yeah.","NULL"
"3027","So, what they do today, the reason they want this, is they go in and they select plugs and hardwire combined, and they retire them. When they retire them, they go over to  , and when they go to  , they have to have an estimate on them.","A"
"3362","I thought he said something about that they don't want you to touch it if it's related to CO, the component.","NULL"
"3976","It would be where the grid is right now.","NULL"
"3856","You still prioritize the highest priority ones up to epic one and say, 'You've got 50 points on this and whatever you've got has got to fit into that block. Otherwise it falls down and you've got to do it somewhere else.' That's what I recommend. We don't know exactly what this looks like but you've still got to rack and stack it.","NULL"
"2214","Can you add the PUD and the sub power on the northwest engine of that database? I honestly keep forgetting to do it.","NULL"
"915","And on the spreadsheet if they've color coded it then they've already touched it. It's always possible.","NULL"
"3382","This isn't maintenance stuff.","NULL"
"3093","You're going to have it up there for either case.","NULL"
"58","Um, yeah, exactly.","NULL"
"940","If we mess up at some point, it will help us track back to what happened, where did it go wrong, and things like that. Make a quick note on here about why I'm checking this in.","NULL"
"4150",".","NULL"
"1275","What did he say?","NULL"
"645","I think PDF is fine for now because otherwise our customers would really be interested in data science of this particular specific surveys, which I highly doubt actually.","F"
"1235","If we get rid of the context switch, that problem goes away.","NULL"
"4357","It was their baby . I'll look at the basic. Oh, man but he said that he was smart. I only try to look one of the clients, which was already against it. Then, come up some tasks. We're having a little point to give what comes up. At this point, I want to have this.","NULL"
"1173","As a site visitor, I want to read current news on the home page, so that I stay current on agile news.","F"
"3017","That's one of them. Then, the other thing is, if you do this and you do print update...So, when you do this...No, it's not print update, is it? Try and update...","NULL"
"3193","Remove frame  edits.  .","NULL"
"532","I like this idea a lot.","NULL"
"2222","Well I think the question is are the people...","NULL"
"3717","You missed a good lunch, I'll tell you.","NULL"
"1263","As a Visitor, I want to sign up via github or google, so that that I don't have to enter lots of information and remember my password for yet another website.","A"
"2713","But you have to find it.","NULL"
"3170","I don't just want  though, I want both. I don't think I'm going to get those. First 1,000 are apparently all we use. What can I  ?","NULL"
"3950","That's right.","NULL"
"2723","You can write, if you want to. Have Kim or Edward or someone write that query to do it, that's possible. Otherwise, like I said we create another service  or just sent it through with ITP.","NULL"
"4885","The other thing that I had on my list was the CTDI interface and the ship to email that came out this morning. I don't know what our options are at this point and we don't have time to make code changes, so I don't think putting the ship to codes in as CLLIs is a viable solution.","A"
"1771","OK, so that's the validation problem, and then the other problem is connectivity. That's, again, why a laptop deals with that one.","NULL"
"4364","Michael said that?","NULL"
"4817","That's fine, whenever it works for you. If it's one day next week that's fine, because I'll continue to test against conversion until after we get the latest one then we'll drop conversion and go back to using test.","NULL"
"2314",".","NULL"
"4041","Or if it can pull up what's assigned to me.","NULL"
"4426","Is there any good stuff on the Telerik website that you guys have offered?","NULL"
"878","As an NSF member of the team, I want to have a place where I can access all the related reports and documentation, so that I can refer to it easily now and in the future.","F"
"275","Okay.","NULL"
"2832","Do you know  ?","NULL"
"3595","Then we'll have side shift.","NULL"
"227","I mean, we could probably just stick to our, to our typical survey model where we have scale questions with, with disliking scale and we have open tax questions and we have multiple and single choice questions, right.","F"
"2727","On the second one, I think we talked about, you wouldn't want an audited adjustment anyway, right?","NULL"
"1108","As a Plan Review Staff member, I want to successfully Conduct a Plan Review Meeting with the Applicant and record the outcome, so that I can listen to it again.","F"
"2184","OK, Anybody else have any updates?","NULL"
"2706","We might need an expert. We're a little confused.","NULL"
"4484","Jenny's joining the police force?","NULL"
"2673","So far we've received about 203 Received Equipment and 60 of them fell out with Did Not  at this point.","NULL"
"381","If the manager allows, so this is also configurable?","NULL"
"4934","right now. I'm trying to do the Verizon thing.","NULL"
"2969","That was cable putting it in there.  we tell them what we want.","NULL"
"4415","We do have the Mobile Collect project which has lots of demo examples. It's a different platform, but it should be universal. You need more examples than that. That's not really my only experience with demo at this point, is the Mobile Collect.","NULL"
"3487","That's what I'm thinking, and maybe is that what you're thinking, too?","NULL"
"1031",".","NULL"
"3292","We can't change the end date. The start date doesn't really matter.","NULL"
"3753","Baski can...What's the situation?","NULL"
"1657","I withdraw the question.","NULL"
"733","the Notify stuff. At any rate, we have limited...We have deadlines for things, but we have Mahesh here. I really want to know from Baski what direction should we take as far as the next two weeks?","NULL"
"4174","I'm going to try to come up with JRM stories.","NULL"
"3378","We can take those  . Get the ones out of here based on those indecipherable 08:50] . Those are the ones we...","NULL"
"4224","Best of both worlds is, Baski can do that within Notify, not a Windows app. Did you ever look at that, Baski?","NULL"
"3357","DD column.","NULL"
"3855","At the high-level epic, I would still think that you can say, 'You've got 50 points this iteration to do whatever you think can be done.' If you need to break it out into epic one-stage one, epic two-stage two, that's still fine.","NULL"
"687","We were just looking at that before we got on the call with you guys, so I should be able to give you an update tomorrow once we finish looking at it.","NULL"
"4348","Apparently not.","NULL"
"3460","I basically write what I would put in the story of the email back to him, so that it makes sense to me. Then if he signs off on it, that's what goes in the story. If he comes back and says, 'Oh, but what about this?' Then I update and send it back to him.","NULL"
"2698","Wasn't that a two part thing? One with...","NULL"
"2947","Yeah, he's like our build manager or whatever.","NULL"
"306","So the questions evolve around motivation.","A"
