"id","req_specification","class"
"1072","As a Consumer, I want to be notified of changes to a package I care about, so that that I can check out what has changed and take action.","F"
"4919","I do believe...","NULL"
"951","You go to the map, on that map, you show whatever you want and from there, you can do what you want. There still has to be a way to filter down to something. I'm not real sure how to group that together in the sense of, say if I have something like a list of contracts.","NULL"
"3366","Yeah, that's the same thing. The north, south, east, west would be...It's just a list of all 50 something COs that they don't have in their common language names.","NULL"
"1971","If you look at the legacy ID field, he's had a pattern that he's used. He's actually out of the office today otherwise he could elaborate on that. It doesn't matter to us. We don't use that legacy ID field for anything.","NULL"
"4709","Some  .","NULL"
"1698","As a superuser, I want to view users' stats, so that I can view in real-time how many users have visited my recycling center information and their recyclable waste.","F"
"3229","I don't know.","NULL"
"2715","The other one,  would it be something we could do? Just run a query and let them pick it up? Isn't that all you're doing?","NULL"
"385","Only question three out of five should be commended.","NULL"
"2580","Patrick, if you launch the  .","NULL"
"1067","As a County Staff Member, I want to create a custom query/report outside of the common querying/reporting functionality, so that I can fulfill a request.","F"
"1804","As a Practitioner, I want to include additional details about me in my profile page, so that I can showcase my experience.","F"
"1439","Development hours, which aren't full days. That's at least got a task on there...","NULL"
"2587","In theory,   this afternoon...","NULL"
"3566","Total, OK.","NULL"
"2901","Not since my reply to that, no.","NULL"
"3254","Says 23 of them.","NULL"
"1393","As a tester, I want to ensure that FABS is deriving fields properly through a robust test file plus a follow up check.","A"
"3178","Industrial Movers. I-N-D dash something.","NULL"
"3266","records   .","NULL"
"4485","Can we have a  for the attitude?","NULL"
"4848","It's in Arabic too, by the way.","NULL"
"849","Yep.","NULL"
"503","I mean, if, if you, if we cook cleanly keep the different clearly keep the different elements and report apart from each other, sort of have different objects of classes.","NULL"
"1175","Go ahead and finish what you're saying.","NULL"
"3945","I think the navigation bar, that's always up there. On the level lines the tiles are going to move off the screen when you're on another page because they're not roving, so you have the bar up there so you can click it or  so you click it or  and get the tiles.","NULL"
"2491","My note is, can we notify? We can probably add to the notify solution. We haven't had the solution upgraded since  the project  .","NULL"
"1230","It'll compile well. That's really all we need. It compiles. Adam. So you know how this one's...So you need to...","NULL"
"4524","...that happens.","NULL"
"2848","Brian, I've got here, I think he deciphered these Verizon three warehouses, but I'll double check and  arrange to send something. I know they went back and forth a few times. It would be the  as far as what they're taking in to the setting, so I'll get back with you on that.","NULL"
"222","Um, yeah.","NULL"
"4432","Does JR collect?","NULL"
"2097","Yeah, I've done that. We're working on where that might be confusing. And the other item, I don't know if we've had it out there before, but the  group, and, well, both groups, I don't know if it's on anything, but CLLI code with the wild card...That's a big request.","F"
"1591","Hi, who's on the call?","NULL"
"317","But I don't really see how this should be working, right.","NULL"
"2482","We don't want to make this a configuration nightmare for developers to go in.","NULL"
"3065","for the day. Hardwire screen has  this is not need to have a frame if it's plugged  these guys, possibly   . Crap. This is a different one.","NULL"
"1561","As a FABS user, I want to see correct status labels on the Submission Dashboard, so that I can quickly see my submission history.","A"
"3878","I'm not 100 percent  with what we've got.","NULL"
"1715","As an agency user, I want a landing page to navigate to either FABS or DABS pages, so that I can access both sides of the site.","F"
"1836","As a participant, I want to be shown all estimates at the same time after all estimators have given their estimate, so that I can be sure estimates are independent and not influenced by other estimates given in the same draw.","F"
"2254","So they might schedule a 10, 15 minute question and answer session where they will write down...so we won't have to sit there keeping notes, managing it all, making sure it all gets done, making sure the tickets get resolved -- that'll be the sustainment team responsibility -- we'll just be there answering questions. So they'll ask the questions, write down the answers, update the tickets, and then we just...obviously at first they're going to have a lot of questions to us about how things work. So that will be our responsibility right now, just to answer those questions.","NULL"
"2260","No.","NULL"
"3248","It's three and three.","NULL"
"3569","Oh, yeah, because you're going to have to do the exact same thing with the wireless scanners. The thing that people don't realize about wireless scanners is it's basically you have to make a whole new app to run inside of them. It's a Windows mobile device just like that conduit thing unless you...","NULL"
"4953","Let me get with Mike. I'll have him send what he has. If he doesn't then I'll have to get with Afinium's whole team to see if we can get what they have.","NULL"
"4617","We had these quarterly or annual reviews, employee reviews. One of the good things that they have on those reviews is, 'The personal goals that you would hope to accomplish for yourself over the next year.'","NULL"
"140","But I get your point on that.","NULL"
"319","I I'm, I'm not technical enough to see if this is even yeah, if this makes sense.","NULL"
"4208","Have you decided  ?","NULL"
"4501","When you bring the new people, I think we need to a process to do all this new stuff. Because we're starting a new project. They need to have, 'Oh, my God. I'm learning something new. I'm doing something.' We cannot just throw in some new person and say, 'Go ahead and make a change.' They feel so uncomfortable, because it's not the right way to start. I think we need to take a right path.","NULL"
"3423","They did the work, but they didn't do anything in LCAM, is what you're saying.","NULL"
"2652","OK, be nice to Jim.","NULL"
"4478","I'll be here.","NULL"
"4284","","NULL"
"4610","Project managers, they will help with that. We can get a ScrumMaster.","NULL"
"4657","Yeah, it's all Brian. I sent that email out this morning. I don't know if you looked at it yet. You know that issue where I said it was weird on those ZFR's? There were two audit trail records that flipped it back. It's also doing it when they manually edit stuff on the edit assets screen.","NULL"
"865","That's right. Once you have that streamlined, then I give you everything and say, ' , come back in two weeks .'","NULL"
"2127","...on the list.","NULL"
"4515","I want them to feel comfortable to estimate, than me estimating for them. That's so wrong.","NULL"
"4344","OK, he's on a CTDI call which...Apparently, he wanted me to talk to you guys about...it may be a table field model, and then its DISTOCD, it's in regard to warehousing  warehouses. Brian, he's saying that we either need a copy of that data or if there's a place in LCAM to store it. I'll send that to you via email, but apparently, he just wanted me to bring that up.","A"
"2709","No. Basically it would  no change, the way they're saying to do it now. So like I said, it's either change that interface, or create a new interface.","NULL"
"270","So like the answers, Hey, that's what you answered to use submit this.","NULL"
"298","Um, I think just for the technical side, it should, of course be possible, but I'm not sure about budget or time scope.","NULL"
"647","You know, you know?","NULL"
"3317","Hello.","NULL"
"3947","Search.","NULL"
"2637","I believe that.","NULL"
"1976","Thanks everybody. We'll talk to you guys later.","NULL"
"2531","Only the view training schedule is going to be available, but it's not showing up there.","NULL"
"163","I will just get an email?","F"
"5005","Thanks. For now, we'll just assume that schedule is good enough. If something comes up and changes that, then you all just let us know, and we'll go from there. Anything else we need to talk about? I know it's been a long call, but we have a lot going on.","NULL"
"1818","Susan, I sent you an email and got you call.","NULL"
"4999","Sure, I can run the scripts. Are they scripts that I need to create, or scripts that you're creating and you just need me to launch?","NULL"
"364","So the comment will be on this question specifically.","NULL"
"3471","A docking station and it uploads a buttload of data at one time. I told him that I have a meeting set up to talk to you guys about this, but that the offline scanners is definitely way more complex than wireless scanners.","NULL"
"2392","Those three digits, let me send out another file, but, those three digits that have  from the very top, if you look at 225WC, the does WC stand for wire center? Or not?","NULL"
"4660","Yes.","NULL"
"360","Or, or explain why you don't like it.","NULL"
"350","I mean, we could just make it so that these ideas are submitted in raw text and then, or displayed and in the report to the manager.","F"
"3185","I knew it started with IND.","NULL"
"1090","That's what's next thing on deck. It's just a matter of trying to wrap things up. Getting better about scope creep, so we can get onto these. Get these things up, , is the best thing our team can do.","NULL"
"892","As a user, I want more information about how many rows will be published prior to deciding whether to publish.","F"
"4811","Right. Whenever we deploy the test then I'll do that.","NULL"
"1148","As a Developer , I want to provide FABS groups that function under the FREC paradigm.","F"
"1949","See you guys.","NULL"
"3867","The tile changes within the display window, so if you click on, 'My Conversations,' it would be all the conversations that you're a part of, kind of like running a SafeSearch.","NULL"
"3839","Can you add notes to these parts?","NULL"
"4314","Anything special we have to do on backing up or just follow my gut with the interface?","NULL"
"480","Like otherwise, if someone really wants to create the, in that survey, even use our other services, we have flooded with a lot of them on our home page to create a really full flex drownded survey.","NULL"
"4506","It sounds like he was also saying, making sure that you have the subject matter expert when you have a meeting.","NULL"
"407","What do you think about this?","NULL"
"636","Okay.","NULL"
"1385","As an owner, I want to remove a user as an owner, so that they are just a member and no longer have full control.","F"
"5","I mean, you have already seen the email probably about, um, the, this tool we are planning to create, right?","NULL"
"2394","No, it was out in California. 9WC was the company code.","NULL"
"2505","But we're not doing the  .","NULL"
"4387","Don't worry, so I think we've","NULL"
"1078","As an admin, I want to be able to communicate directly with facilities, so that I can keep them updated about features we have on our website.","F"
"4789","Did you run on the SEC stuff last night, when you did the deploy?","NULL"
"3007","If you want to make it...I don't care.","NULL"
"288","And maybe, I don't know, you know, where.","NULL"
"871","As a Researcher, I want a tool that can generate basic statistics about a dataset, so that I can get a quick preview of the data.","F"
"3547","Do their reconciliation.","NULL"
"88","Yeah.","NULL"
"143","Right.","NULL"
"1377","As a site member, I want to download the latest training material and methodology PDFs, so that I have them.","F"
"1891","Have you deployed it?","NULL"
"1000","No.","NULL"
"4045","OK, is one story.","NULL"
"4072","the MapPoint, get rid of MapPoint...","NULL"
"442","Okay.","NULL"
"1298","As a publisher, I want to embed a preview button on my site, so that users can preview the data and be encouraged that this is the correct data for them.","F"
"2362","OK. No. Let me just back up then. That's good enough to get me started to help. I know that it's critical, seeing what we missed. In my explanation, I'd say, is there any way to take that company plant, that you said we figured was buried in that, through those CLLI codes?","NULL"
"4016","That's a good example of user story that reminds me again of SafeSearch.","NULL"
"2455","All right. Thanks, everybody. We'll talk to you guys later.","NULL"
"4452","Did she give you that template data or anything?","NULL"
"2513","Login page and home screen.","NULL"
"546","So we have two elements with which for sure need to be responsive, which is the reporting and survey mask.","F"
"3124","We estimated at three days. Part of that being because even though we don't have to change Dopak for this we have to test Dopak to make sure it didn't break. This change would write a Dopak record. It shouldn't affect Dopak records. Look at you.","NULL"
"581","I don't know what you mean by that.","NULL"
"1056","As a recruiter, I want to post a help wanted ad, so that I can attract candidates.","F"
"794","It's a lot of emails I've gone through. I've gone through more in the last two weeks than ever in a two week time span. OK. Did you all have anything specific you wanted to talk about?","NULL"
"999","As a Publisher, I want to tag datapackage to create a snapshot of data on the registry server, so that that consumers can refer to it.","F"
"4856","Violet.","NULL"
"3339","And if they're not...","NULL"
"2213","April fourth or  .","NULL"
"2169","Well, Susan's on her way to the large. Do we need to catch her?","NULL"
"3216","We used to.","NULL"
"3781","I thought it wasn't. I thought we were doing it as one, so if we had this contract management stuff that was using the HTML5, it could sit on top of whatever we've got now.","NULL"
"401","So I'm not sure here how we should actually display the results of these different questions.","NULL"
"3537","Process?","NULL"
"3343","Don't they know by the ones that are...oh, because they don't know about what's in the north, south, east, west? OK, I got you.","NULL"
"1878","Yeah, actually...","NULL"
"551","Yeah, so that's","NULL"
"2239","There's no way you could  . 30,000 locations have fallen out right now.","NULL"
"626","I don't know, because for now what we were talking about is that is all online in a widget or somewhere, but maybe, maybe you, he also has to report to someone else and would require it to as a file.","F"
"4705","I'm sorry. I'm getting familiar with the code as well.","NULL"
"3938","Some of this lays out right here, but I guess maybe the epics might be, and I don't know if home page is the right word but at some point I want to manage my conversations. At some point I want to be able to manage my poles. At some point I want to be able to look at my conduit.","NULL"
"721","As a site visitor, I want to do a full-text search of article body, title, and author name, so that I can find what I want.","F"
"3197","What's that do? Frame  .","NULL"
"3088",".","NULL"
"505","It depends on, on how we entirely approach the thing.","NULL"
"1262","That is weird.","NULL"
"2279","Does anybody else need...I know Susan,  and Jesse are the...","NULL"
"540","I think that's, that's a good, a good way.","NULL"
"3164","Don't  .","NULL"
"286","You know, like I would really like it if you have something like they have on Reddit or somewhere like where you could maybe also as a, you somehow have to involve the users into the survey.","F"
"3734","Oh, yeah, it's tough.","NULL"
"4456","Anything else? All right.","NULL"
"440","Yeah, yeah.","NULL"
"4578","'Then, you can try it out, and then I can help you with it, and then maybe next week I'll give you just a small thing that you can do by yourself.' Then, so on and so forth. That's a huge concern of mine.","NULL"
"69","I mean, do you have the overall idea of the, of the project, right?","NULL"
"4678","That would have the red map, only it would be in the license key, and all that?","NULL"
"2909","Can we  finalized spreadsheet of users so we can go ahead and import them?","NULL"
"3256","Yeah, the data's there it just doesn't have a barcode on it.","NULL"
"2800","How's your stuff coming, Patrick?","NULL"
"234","I think you're both muted, but maybe, maybe, so maybe Mark, can you hear me now?","NULL"
"2978","So the grid is.","NULL"
"3054","That's why I'm trying to...","NULL"
"2785","That's encouraging. Grady, you're done with all of your stories, right?","NULL"
"648","Yeah, makes sense.","NULL"
"1345","We don't. We've got to get off this call. My only concern is, Grady's on vacation next week and we're supposed to be doing this next Sunday, which, by the way, you and I need to get together and give them some kind of a, 'Yeah, you're going to be able to start work on Tuesday at name and date.'","NULL"
"1538","As an author, I want to be able to indent / outdent content.","F"
"3252","Part of Bartender.","NULL"
"2599","He's usually my good one. The one that puts the tasks out there   .","NULL"
"4048","Yeah, work together, right.","NULL"
"4286","Yeah.","NULL"
"4960","OK. I couldn't remember.","NULL"
"4846","It's somewhere in this  box.","NULL"
"372","I think we accidentally here hit another idea, which I didn't want to, to point at, but I think I would just track this down because I really liked the comment ability of questions, but it still doesn't really solve the problem, which I initially mentioned in as in to include the user.","NULL"
"4134","and then he can mock up something.","NULL"
"1310","I don't know what it takes, if it's just on the screen, or if you have to do other stuff.","NULL"
"2850","We can't make them send...","NULL"
"35","Cool.","NULL"
"3842","Stories.","NULL"
"1266","As a content editor, I want to be able to easily find content, so that I can edit it.","F"
"2691","Correct? OK. The first one...I took notes, plus I double-checked the CTDI. We were under the impression, for those MRs, the finance issues and whatever the MR, that those could be worked through the existing code of send and receive. I was a little confused why that would be outside the scope.","NULL"
"2561","It's planned to be in there.","NULL"
"990","As a Publisher, I want to create a data package in the UI so that it is available and published.","F"
"2961","Allowing them to search by receive dates. I think receive date is already displaying on the screen. We just don't allow them to search by it. I'm not sure if you need to bring it up. Because I don't know if anybody  or not.","F"
"122","How, how do you mean text?","NULL"
"2643","frame.","NULL"
"3377","OK, so we could take those  .","NULL"
"2699","Yeah, part or a serial number. VIN number.","NULL"
"123","I don't really understand this.","NULL"
"3986","The functionality is there.","NULL"
"646","I think they just want to have nice widgets, which they can include in their internal meetings or yeah.","F"
"533","I mean, yeah, yeah.","NULL"
"4734","Oh, OK. Then, you're done?","NULL"
"4227","Yeah. That would be the best of both worlds in there.","NULL"
"1417","As a Staff member, I want to Perform a Staff Review, so that I can validate compliance of an application with the Zoning Ordinance and impact approval/denial of the application accordingly.","F"
"996","That did bring me to another question. I can't find warehouses in the data at all, and I know that, Ken, we got feedback from you to look at the building type field that's there, and that was beneficial. We found the field locations, and may denote it as CS, which I assume is Central Stock. RDC Remote Distribution Center, and then I think an IDC is an Intermediate Distribution Center.","NULL"
"3393","I wouldn't say we're in two points.","NULL"
"1251","He didn't want the help files available from the home page. Or from the login page, rather. Until you've logged in.","NULL"
"1587","Do you know which report she was running?","NULL"
"150","I think that's already quite a good input.","NULL"
"713","As a Development Staff member, I want to Issue a Development-related Permit, so that I can grant the request to the Applicant to begin work","F"
"1693","As a VisualDesigner, I want to demonstrate the value of visual design to the NSF project team, so that visual design is an integral part of a redesign.","A"
"4055","Then, once we have that, then you can start with testing the website, 'I want to be able to register,' and that's all for a different path and it's so easy to get  .","NULL"
"4221","I mean, Baski's right. If it needs to be, if we need to provide dropdowns and things, that's very helpful.","NULL"
"1488","As a ResearcherPublisher, I want to understand the ways in which my data is invalid, so that I can know how to fix it.","F"
"1237","As a user, I want to add donation centers as favorites on my profile, so that I can view them later.","F"
"2046","Interesting.","NULL"
"869","As a Consumer, I want to download the data package in one file, so that that I don't have to download descriptor and each resource by hand.","F"
"184","I think that's what you just said.","NULL"
"4726","I'll see how much I've found today, and hope we'll give us a...","NULL"
"3908","Yes, exactly.","NULL"
"3456","No. Sit down.","NULL"
"1365","","NULL"
"968","That's right. I guess the first question is, is this really chargeable work because they pay for maintenance. Smiley's under the impression that...","NULL"
"686","Just to say, 'This is what we're doing,' and then build from there, unless you...","NULL"
"3493","The thought of having Kevin Smiley's thought with the wireless is that they can take a laptop over to their storage cabinet and scan, and it'll talk to...or if they have a desktop, it can talk wirelessly.","NULL"
"4590","Then, it gets to the point where everyone's busy, and we're just researching, not getting to feel like we're helping at all. That's hard. It's important to feel like you're doing something beneficial for the company.","NULL"
"549","If we could nail this for phase one, actually, yeah.","A"
"2725","Because we're not just pulling a query...","NULL"
"90","Should I, uh?","NULL"
"3892","Right. But what I'm saying is that if when you login you're on the Search screen, instead of My Conversations you're on the Search screen, there's just a map there. Then you can add your search criteria from there. That's where you go to every time you login.","NULL"
"3720","Yeah.","NULL"
"1344","As a Publisher, I want to publish a dataset, so that I can view just the dataset with a few people.","F"
"2349","One of Larry's group  was wondering...I don't know, I hope it's in an email about, I think Susan or somebody explained you could  location groups, or there wasn't an opportunity to do global ones. We need to get those clusters back in, or started.","NULL"
"493","I like this idea, yeah.","NULL"
"2931","Took you about five days, max.","NULL"
"199","So every other user and team leader belongs to a project manager.","A"
"3353","A silly question.","NULL"
"254","Right.","NULL"
"2022","There's two other items on there that I'm still looking into, and we'll get back to you guys as soon as we can. Regarding the  that seems to be occurring, and the part number. The batches and the part number.","NULL"
"1466","Yeah.","NULL"
"2012","I don't want that.","NULL"
"450","So it's not really getting messy.","NULL"
"3989","Yeah, we've done it forever.","NULL"
"2088",", that would be best. It doesn't matter when   .","NULL"
"3770","they're separated TFS, judging by the same, what your asset is.","NULL"
"927","It will help us out.","NULL"
"4838","Fuzzy Logic stuff.","NULL"
"4865","Which TCP port, for which service?","NULL"
"2864",".","NULL"
"977","I'm doing it . It should be...","NULL"
"3796","Yeah. Then the other thing we talked about a little bit and this is along the lines of what Darryl was thinking...","NULL"
"2232","We're probably going to have another emergency release tonight around, I'd say, 7:00 or 8:00. How many days passed?","NULL"
"190","So I think, I think, but what Mark was trying to say is that the, the, the simplicity of simply getting an email for the employee, that should be fine because, uh, if, if the project manager or the team leader simply specifies which users to tag in this, um, in this survey and say, or she's simply addressed by their email, that is fine.","F"
"4736","Something else like what?","NULL"
"3538","Yes.","NULL"
"3997","What we need then, is, we need specific things with dashboard, sharing functionality, and managing projects.","NULL"
"1227","Yeah, that's...","NULL"
"3578","Go back to that first screen. The problem there is at that point you're back to the problem of just a dumb scanner clicking barcodes. If you programmed the scanner just right you could set it up to where they just blindly scanned the  . They wouldn't be able to adjust any quantities so if they had 50 of something on the same shelf they'd have to scan the barcode 50 times.","NULL"
"4263","We're going to be closing up good tonight.","NULL"
"3297","When's he supposed to come through?","NULL"
"558","I think it would make sense to have a default language for approach check.","F"
"926","As a user, I want to be able to anonymously view public information, so that I know about recycling centers near me before creating an account.","F"
"1304","Only a dozen of six words. You're going to ask your ,so that port work with the tile service. Michael, is starting today, what he did. If there is a little background, I can compile.","NULL"
