"id","req_specification","class"
"2300","I don't know that you're not here now since I'm not always there.","NULL"
"4696","space there. Figure out where that's defined at.","NULL"
"1219","As a site member, I want to view the profiles of other members, so that I can find others I might want to connect with.","F"
"485","Yeah, yeah.","NULL"
"2413","I saw the reference to it, and I'm not seeing any foreign key constraints to another table from the ice locations table, but I haven't looked...","NULL"
"4090","Yes.","NULL"
"205","Nah, I wouldn't, I wouldn't do this at the initial, at this point of phase one of our project, because I think we should keep it simple.","NULL"
"3545","I don't even think it's reading it.","NULL"
"3428","OK, so that's more complicated.","NULL"
"1098","As a Broker user, I want to have updated error codes that accurately reflect the logic and provide enough information, so that I can fix my submission.","A"
"1433","No.","NULL"
"4098","She's saying you can include it in 1.20 without...We're not releasing any of this to the public in 2.0Female Participant:  Right.","NULL"
"4170","Yeah, we'll get that story and Karen can create a story. I'm sure Jasmine can help create stories.","NULL"
"1413","before follow it again, hours of testing .","NULL"
"2374","So, I'm scared to do anything on these, because I don't want there to be bad accounting data on there, but I also don't want them to fall out, either. Could I maybe take the most popular exchange code out of the...? That's kind of almost a quirky,  thing to do, and I feel like exactly like what Susan motioned to do, like I'm kind of throwing a dart.","NULL"
"2188","Yeah, it is...I always hear them on calls .","NULL"
"868","When you all did the warehouse...","NULL"
"2121","Then for the IBT group that we were trying to target, most critical thing, what's coming up and biggest holdback is SCC scan error correction screen. First request,  , go to the active logs  . We're finding everything. Narrow those certain criteria. With project-related, OK.","NULL"
"2715","The other one,  would it be something we could do? Just run a query and let them pick it up? Isn't that all you're doing?","NULL"
"2029","I'll be calling him.","NULL"
"534","Let me know what this,","NULL"
"1934","I can knock out a good chunk of it today. There will be a good first look there. I'd hope you'd have something functional Wednesday, even if it's still rough.","NULL"
"1713","Why?","NULL"
"2247","The Dashboard is done, as far as I'm concerned.","NULL"
"4666","Sorting out?","NULL"
"2920","","NULL"
"4682","One of the actual things we could talk about is creating a new view. Basky said we needed to create a new...Call it whatever you want to but we'd call it the Telerik control view, or whatever. That's probably fine, more program.","NULL"
"2801","It's coming along. I got the second page, there. I'm getting all the old icons put on there, and after that is multi head, so, it's coming. It's got  , I think.","NULL"
"560","We really have to think about this actually, because my wish needs that it's, that the language can be, or the available language to the project have to be set when we, as a super admin, create the project for a customer, right?","F"
"4686","It really looks so easy. I guess I just go over my own thing. I need to  . Not the coating itself, but you know.","NULL"
"1673","Fast Path and...We need to make sure we can fit some user storage in there to keep Mahesh going. What's happening right now? You've got your user environment set up in your...? How are these designs that Corey's given being implemented right now?","NULL"
"1897","What else will we  ?","NULL"
"1937","The only thing I got is the CTDI stuff.","NULL"
"608","Yeah, I think we have to keep it simple here as well for this project phase one and just go with three languages, German, English, and French and French, and just make sure that at the launch day, these languages are implemented completely.","F"
"2741","OK, thanks. We'll talk to you guys later.","NULL"
"197","And this again would be like a hierarchy that we will have to store and to represent somewhere.","A"
"1547","I've already got the data in place?","NULL"
"4399","I'm still very functional now and I know you can't right click it .","NULL"
"1446","We decided Baski was going to see if that was possible .","NULL"
"3885","Or like Zillow, you start by putting in an address. You come here and pick the context of, 'Buy,' 'Rent,' 'Sell,' or, their estimating thing. Then you put in your address and click Search and it takes you to that area.","NULL"
"2361","Asset accounting was the OAC and the...","NULL"
"4183","We'll use TFS as the actual user stories, just for organizing it's fine.","NULL"
"3447","We still have the list of clause. We can go mark them all as being complete. If that's the only thing that's on the clause.","NULL"
"3441","Yeah.","NULL"
"4094","If we keep it all together, we keep Baski's stories that we're working on, the other five stories that we're working on in this iteration...","NULL"
"4140","OK, so Corey's got to mock that up. What about that conversation on the page that you've been working on?","NULL"
"4087","Phone, tablet, tablet, right.","NULL"
"152","I mean, there, there will also of course be this, the role of the employee or of the servery filler him or herself, right.","F"
"4581","The question is, 'What should those steps be?' We can start brainstorming ideas. I think Brian just threw out a few. Let's start thinking of what those steps need to be, capture those, and then get them documented.","NULL"
"291","Um, yeah, I'm not sure we somehow have to include that the ideas of, of the survey fillers and then these ideas can sort of be displayed to all the other people that are part of the survey.","A"
"4252","Bye-bye.","NULL"
"4125","I'll make sure that you know exactly what to do. How about that? That way when you guys want, you can test this new functionality. No confusion.","NULL"
"4189","The hash key's working on that? Baski's going to...Baski or Brian, or both.","NULL"
"4224","Best of both worlds is, Baski can do that within Notify, not a Windows app. Did you ever look at that, Baski?","NULL"
"2069","Once you approve the order. You have to, after you handle each of your detail line items, however you're going to handle, then you approve the whole order, and that's what  .","NULL"
"3073","So I can search assets that are retired and reverse retire some.","NULL"
"1486","As a camp administrator, I want to create an avenue so parents can submit feedback and general concerns, so that I can keep improving the services I provide.","F"
"77","Um, yeah, I think, I think I got, I got most of the parts, so let's, let's start.","NULL"
"4843","He has it.","NULL"
"4228","We decided Baski was going to see if that was possible  .","NULL"
"1891","Have you deployed it?","NULL"
"1357","As a site administrator, I want to create an Other Course or Event that is not charged a listing fee, so that the Scrum Alliance doesn't charge itself for Scrum Gatherings that it puts on.","F"
"3582","Do you tab or enter key?","NULL"
"4362","Let's look at the program first and then the code. Then it'll make more sense to me. I'll see if I can just...","NULL"
"1052","I just saw the number of people.","NULL"
"2940","It's not a repair PO.  we not  POs.  .","NULL"
"817","As a camp administrator, I want to be able to warn a camp worker who I think did his/her job inappropriate.","F"
"2685","Do we need to be here?","NULL"
"323","That's for sure a big problem.","NULL"
"3845","Because there's two things there. There's searching mappable assets and there's searching just assets that have absolutely nothing ever to do with the map. That Search Asset needs to be broken out into two different things.","NULL"
"2956","Three. I'm thinking optimistically.","NULL"
"1741","Hi. Who just joined?","NULL"
"588","So once the Spanish has been done.","NULL"
"2875","It was an expensive trip.","NULL"
"3814","Starting in April?","NULL"
"2105","I didn't get to read anything, but that would be one of the few reasons.","A"
"301","Let's say more like a general feedback box.","NULL"
"28","So did you receive that, uh, initial project document to which I've sent you?","NULL"
"1873",".","NULL"
"4638","Knowing that you can get up and go somewhere is good to be told to a new hire. Not you guys, because you guys know that. Your first day walking in, I didn't know what to do.","NULL"
"4271","That's not bad.","NULL"
"551","Yeah, so that's","NULL"
"3234","for frame to be a valid general   .","NULL"
"3522","With WiFi or something?","NULL"
"1962","I do not.","NULL"
"2584","I'm still working on that. I've got to update  out, and couldn't touch TFS. I'll update LCAM.","NULL"
"2906","","NULL"
"1700","You bothered me like three times? Bothered me?","NULL"
"2963","You can search by all kinds of stuff, so search...","NULL"
"1337","As a recyclingfacility, I want to be able to communicate directly with the site admin and convey any issues or concerns I have, so that they fix them.","F"
"1023","I'm going to the poles site.","NULL"
"3929","Or just know by...","NULL"
"1088","As a user, I want to be able to view the safe disposal events currently being organised around my area.","F"
"2350","Anything else that we need to talk about?","NULL"
"3542","Yes.","NULL"
"4828","Code.","NULL"
"2586","Kevin and Drake's got modify the retail notifications that handle non-sterilized equipment, and to modify received equipment that handle non-sterilized equipment.","F"
"2118","Suckers.","NULL"
"1631","As a team member, I want to understand how work moves between UX/content > visual design > front end dev for a sprint cycle.","A"
"3571","That's the other half of why you deal with laptops out in the field, because you can validate against the catalog while you're standing in front of the thing as opposed to I've gathered a pile of barcodes. Now let's try to do something with it, right?","NULL"
"2701","Yeah, that's...","NULL"
"1308","Can we have a for the attitude?","NULL"
"542","This should also be specifically responsive so that all the costumers can fill out the surveys wherever they are.","F"
"414","And now if you propose that they are not, they are not, uh, connected, but they are grouped into their types.","NULL"
"1253","I'm here. I am desperately trying to get the board to show up.","NULL"
"4196","Fast Path.","NULL"
"1094","As a UI designer, I want to move on to round 2 of DABS or FABS landing page edits, so that I can get approvals from leadership.","F"
"1104","As a Publisher, I want to preview a datapackage I have prepared, so that that I can check it works and share the results.","F"
"2896","Did you  on my ticket?","NULL"
"1078","As an admin, I want to be able to communicate directly with facilities, so that I can keep them updated about features we have on our website.","F"
"4899","That was from CTDI what they got from Afinium? We're talking the same thing, right?","NULL"
"2473","Jasmine threw it all out to TFS i think, from the  . It's terrible.","NULL"
"2707","Their proposal was to send it out as one part number and then we would send another message, have it coming back in as a different part number. Still, the code doesn't change the part number when it comes in, it  that VIN and moves that VIN where it needs to be. It doesn't change the base equipment on that, that VIN.","F"
"2639","That's perfect. I know my issue has been recognized.","NULL"
"3016","Change the  , pull it  .","NULL"
"1507","As a Staff member, I want to Send or Post Citations and Fines, so that I can successfully send the Notice Of Violation document to the property owner and log information about the action.","F"
"2999","database....","NULL"
"2719","The whole thing?","NULL"
"1288","I've got to see. Mike was thinking that those would be treated as two separate records. I hear what you're saying. We have a whole record leaving and a whole record coming in. To me, it would be changing the VIN.","NULL"
"3790","We can determine at will whether or not the users are in  versus  .","NULL"
"2282","and I would like a refresher, since it's been a few months since she showed us how to do it.","NULL"
"959","As a ResearcherPublisher, I want an integration with Zenodo, so that when I store my dataset in GitHub, I dont have to retype descriptive information about my dataset.","A"
"4217","His preference is what?","NULL"
"2384","Like Ken said, in net we already clean them up, so yeah, we'll eventually have to map them to Infinium.","NULL"
"3489","When you all did the warehouse...","NULL"
"3805","It should be easy enough to keep them separate. If there's a story that goes in that says, 'You may be able to login,' obviously, someone's not going to...Something a little more is needed on the side conversations which is,  .","NULL"
"4931","That could be done by someone else other than you.","NULL"
"818","database....","NULL"
"2318","throw some numbers.","NULL"
"2245","Yes, we did.","NULL"
"593","Yeah.","NULL"
"658","Trust me.","NULL"
"1628","As a site visitor, I want to be able to read some of your articles, so that I can learn without first joining the site.","F"
"1396","No. I'm on .","NULL"
"1611","We can't search for a conversation that has an attachment on it that belongs to this company because we're trying to do something generic. It's an easy query but we do something .","NULL"
"5005","Thanks. For now, we'll just assume that schedule is good enough. If something comes up and changes that, then you all just let us know, and we'll go from there. Anything else we need to talk about? I know it's been a long call, but we have a lot going on.","NULL"
"1380","As a user, I want to upload my week's schedule, so that I can get recommendations for recycling centers that best fit my availability.","F"
"614","I mean, that's also, that's quite important for you and your team.","NULL"
"2857","You'll let us know what Ron says?","NULL"
"2202","It's super awesome. I didn't buy it. I made Notre Dame buy it. I was like...","NULL"
"4604","But, if our iterations were much more structured, our releases I should say were much more structured, say, 'I know exactly. I've got eight iterations in a release. I've got four iterations of testing tacked onto the end of that, and it becomes a repetitive thing that happens exactly the same every single time, the layout becomes a lot easier.'","NULL"
"4003","What we need is a way to have a dashboard that takes certain tools that are on the dashboard, and they are received from a certain way of passing in data, so that it doesn't have to be a new dashboard built every time.  was talking about doing a data source for it.","NULL"
"2822","All right.","NULL"
"3728","Mugshots burgers are...","NULL"
"508","Yeah. I would have that I would have to, to also dive in and, and make an estimation for,","NULL"
"4204","Enter Corey.","NULL"
"2099",".","NULL"
"133","Yeah.","NULL"
"1869","As a RepositoryManagerResearcher, I want an app that acts as a match-making service for packaging data, so that owners are paired with data packagers.","F"
"2905","Everybody's enemy  sequel.","NULL"
"481","But here it's just together a claims like the manager really wants to fill the polls of his team in a specific topic.","NULL"
"1648","As a site visitor, I want to have an advanced search option that lets me fill in a form of search criteria, so that I can quickly find what I am looking for.","F"
"4820","Are you sure you want to know?","NULL"
"1958","Kevin.","NULL"
"613","I mean, yeah.","NULL"
"3675","Anything you're working on we're going to mark it as development. I'm going to assign this to you. That's basically it. Make sure it's got your name on it. Make sure you got activity and development. You've got an estimate, any time that you've actually put on it, and a remaining. It should add up. You would normally put some description in here, what you're actually doing. This is pretty self explanatory.","NULL"
"368","Okay.","NULL"
"3691","Cool. Then we both kind of make it.","NULL"
"2845","If that's OK with you guys  , so I need to send that out to the group, so it's going to be shipped unknown all together...","NULL"
"79","Yeah.","NULL"
"1267","As a Developer, I want an Elasticsearch integration, so that I can integrate data-packaged data with pipelines that use Elasticsearch.","F"
"892","As a user, I want more information about how many rows will be published prior to deciding whether to publish.","F"
"4221","I mean, Baski's right. If it needs to be, if we need to provide dropdowns and things, that's very helpful.","NULL"
"1851","Do I need it? I think I do. I haven't checked in the merge yet, but when I did I saw everything from 105 to 109 went back to the trunk which I presume has not been run in our dev and test environments yet.","NULL"
"4679","Mm-hmm.","NULL"
"3713","Oh, did she?","NULL"
"4520","It's not you, you are not involved with the meeting. It is a management level the meeting is taking place where they want to change the mapping cards and map. It's outside development level. It's not...","NULL"
"3779","I think so.","NULL"
"1426","As a Staff member, I want to Track the Draft Proffers, so that I can preserve the history of draft proffer statements submitted by the Applicant.","F"
"1538","As an author, I want to be able to indent / outdent content.","F"
"664","Okay, all right.","NULL"
"2524",".","NULL"
"2435","Go ahead, I'm sorry.","NULL"
"2163","Get a high level  . Going to pick up a new Verizon 3  Larry, we've got to get that request for approval smoothed out, and get this scanning process correct the errors  down a little bit.","NULL"
"4886","The other thing that I had on my list was the CTDI interface and the ship to email that came out this morning. I don't know what our options are at this point and we don't have time to make code changes, so I don't think putting the ship to codes in as CLLIs is a viable solution.","F"
"837","Estimate for those?","NULL"
"2146","I don't want to  , anyway.","NULL"
"2760","OK.","NULL"
"1895","You did. Last week. We tested some of it.","NULL"
"2208","If we get a meeting  .","NULL"
"1302","No.","NULL"
"2826","Jim's on.","NULL"
"885","As a Publisher, I want to be able to preview the views of the current data package using cli prior to publishing, so that that I can refine the json declarations of datapackage view section to achieve a great looking result.","F"
"458","Sorry, scale question.","NULL"
"1306","He gets it from Afinium. He's already been set up with Afinium for a while.","NULL"
"1470","As a developer, I want to have the subdomain beta.nsf.gov be set up, so that I can deploy a beta site to it.","A"
"1210","As a CST, I want to pay an annual fee, so that my CST status is active.","F"
"483","So these should be quick, quick and reoccurring service.","NULL"
"4958","Who does the clean up?","NULL"
"3615","So those are valid estimates I can give them?","NULL"
"4601","Whether that's adding factors to our estimates based on what we've historically done or making sure that we have the requirements upfront so we know what's going to be done, and controlling scope creep.","NULL"
"3889","Is the name going to be that conversation  ? When someone logs on, here's my work and I can go from there and do my thing, I guess.","NULL"
"2928","Been busy with the other context, Frontier.","NULL"
"1929","That's all you've got. Yeah. Grady and Drake and Patrick.","NULL"
"6","Yeah.","NULL"
"3915","OK, well then maybe some of these things need to be moved over to the Conversations.","NULL"
"2280",".","NULL"
"3280","Stuff.","NULL"
"3895","Where does the epic for the map come in? Is that a subset of...?","NULL"
"4166",".","NULL"
"4034","Yeah.","NULL"
"4438","Whenever you get a chance to do that one.","NULL"
"4296","I can do it, whenever. I'm ready. I just have to know what to do about to him.","NULL"
"4320","Will you pull it down from there and restore it when you get ready to start?","NULL"
"3142",".","NULL"
"1435","As an Agency user, I want to be able to include a large number of flexfields without performance impact.","F"
"2010","Larry  .","NULL"
"3891","That all lends itself to this Notify being conversation-centric. Is that your question? To continue it that way?","NULL"
"2974","So it's adding a column on it.","NULL"
"3086","Search.","NULL"
"2112","Yeah. As long as it's a valid substitute, you should be able to edit that line item and change the SE, or you can split it, put in a substitute for that particular asset. It has to be in our table for substitutes.","A"
"4863","Kim when you say they're using ports which port is it? Is it connections for the database server, or are they connections for the client Web browser?","NULL"
"2082","That may be an excellent idea.","NULL"
"4891","What do you mean by 'address'?","NULL"
"4247","In that case, if you want to just hang out, I'll just tell him that you're not available for the call today.","NULL"
"3048","Whatever they...","NULL"
"2729","We want  .","NULL"
"2447","No, go ahead. You were cutting out, I couldn't hear.","NULL"
"1620","Yeah, as long as everybody uses this, maybe not different ways .","NULL"
"3111","I would prefer it to be consistent if we can make it consistent. It makes it easier, whether they use it or not, as long as it does work if they do choose to use it. It isn't required if they don't choose to use  it. If I try to save this now, it's going to tell me something, estimate is required or something.","NULL"
"864","As a moderator, I want to have the 'estimate' field filled in automatically if all estimators show the same card, so that I can accept it more quickly.","F"
"1714","If you get familiar with XAML, you could split the screen, and put two controls side-by-side. It's going to reduce our real estate on the screen and stuff, but you could split it, split the two columns and put each control in there, and see if we can get them side-by-side might actually be useful for testing, and comparison, and such.","NULL"
"249","Yeah.","NULL"
"779","As an Agency user, I want FPDS data to be up-to-date daily.","A"
"11","Cool.","NULL"
"1579","As a superuser, I want to reply to user questions, so that I can answer any questions about my recycling center.","F"
"2415","Let me ask somebody over at the Verizon land the question. That way, you don't have to waste your time if I can get some information.","NULL"
"2678","Anybody else have anything?","NULL"
"2156","One last thing.","NULL"
"4301","Of course.","NULL"
"198","I mean, just to keep it as simple as possible, I would just say a project manager is always top level.","A"
"122","How, how do you mean text?","NULL"
"97","So I don't know how have you got, see, but I think it's quite important that we specify how many abstraction levels of roles we want.","A"
"4668","This is my first point. Big things, so you're going to have to try to bear with me on some things.","NULL"
"4586","That might be OK. That's good but it's not great. Branching out is a good thing, focusing on everything a little bit of everything is ideal.","NULL"
"3825","Have we decided for searching or asset arrangement under something?","NULL"
"1657","I withdraw the question.","NULL"
"701","As a Staff member, I want to Manage Ordinances, so that I can maintain accurate ordinance information in the System.","F"
"2514","I'm bleeding, bro.","NULL"
"2396","That's a good question. Ken, we need to get with Sarah, I think,  she's got to go into Infinium anyway, and fixed assets, so we should be able to get those exchanges.","NULL"
"2953","I don't know what it takes, if it's just on the screen, or if you have to do other stuff.","NULL"
"2227","I've asked  for these flashback construction engineering. I told them engineering is done, and, construction, I told them we're not planning on doing anything this quarter.","NULL"
"1632","I try to be.","NULL"
"3379","Exclude those.","NULL"
"2084","This situation, we can do this.","NULL"
"2868","We do have a meeting with John about it. Really nothing, just get over there and...","NULL"
"855","That makes it a little...","NULL"
"4892","Cities, states, zip.","NULL"
"3982","Yeah, I like that.","NULL"
"4112","What's in there right now, what's going to be changed?","NULL"
"2452","Sure. Is there anything else?","NULL"
"648","Yeah, makes sense.","NULL"
"1393","As a tester, I want to ensure that FABS is deriving fields properly through a robust test file plus a follow up check.","A"
"2074","We'll take it back to them  look at the next one  more.","NULL"
"82","So maybe let's start with the, with the user roles.","F"
"4684","On this page, remove the user control stop, and add the reference, or just drop in the Telerik control. We're going to input the same items here.","NULL"
"4528","I don't know if that one's as good an example. I think, we had the right people on that.","NULL"
"3212","Yeah, but this is general change. One of them was general change and one of them was that change the frame.","NULL"
"3364","Oh, I just want to say I could probably go in and get a copy of all the COs that Bill had and by the common language game.","NULL"
"2901","Not since my reply to that, no.","NULL"
"4689","Is that how they spell tolerate? Is it right?","NULL"
"782","Yeah. Exactly.","NULL"
"536","And if we have time or resources afterwards, in another phase, we can also expand on this.","NULL"
"1232","As a team member, I want to meet with DIS / cloud.gov, so that I can determine the requirements for the beta.nsf.gov ATO.","A"
"778","As a site admin, I want to edit and delete help wanted ads, so that I can correct small problems or make sure each ad complies with site guidelines.","F"
"4690","I think so.","NULL"
"3186","that's hard wire but what's one six?","NULL"
"4238","I think Daryl needs to prioritize it first because it sounds like we already have two projects going on concurrently. We need to focus.","NULL"
"3162","Of course it's not.","NULL"
"1329","...your desktop. Internet Explorer...","NULL"
