"id","req_specification","class"
"3857","Say, 'I'm going to give you 50 points on this epic. I'm going to give you 20 on this one. I'm going to give you 70 on that one.' That would at least let you progress through the first part of this and move on to more of the detailed design. You may end up with a detailed design and go, 'Yeah, I could probably do a little bit more,' or, a little bit less, it could go either way.","NULL"
"4787","You didn't do that last night?","NULL"
"3199","So it'll really remove estimate in it?","NULL"
"4327","Call you.","NULL"
"1109","As a site administrator, I want to understand how other similar organizations are handling content, so that I can make informed decisions about what appears to work well and what doesn't.","A"
"2989","Yeah. That'll be the easy one.","NULL"
"1354","As a Researcher, I want to get a Data Package into R in seconds, so that I can start using the data for doing analysis and visualizations.","A"
"2479","Jasmine...","NULL"
"1316","Yeah.","NULL"
"1671","As a user, I want to contact the administrators, so that I can give feedback or ask for help.","F"
"21","Uh, this information didn't reach me, but, uh, that's fine with me.","NULL"
"1204","As a UI designer, I want to begin user testing, so that I can validate stakeholder UI improvement requests.","F"
"4222","That may make it much, much better for them.","NULL"
"3564","Five days.","NULL"
"2105","I didn't get to read anything, but that would be one of the few reasons.","A"
"1016","I grew up in... DuChock.","NULL"
"465","We will have to include really complicated the algorithms, maybe even NLP or something, which should be way out of scope.","NULL"
"3803","However, that's not an iteration that's actually ever delivered. It gets put into the actual Notify iterations. Is that what you're saying?","NULL"
"568","Yeah.","NULL"
"238","Like everybody knows them, uh, of course single and multiple choice questions, and maybe we can also add something like swipe questions so that you can have maybe a left-hand side, the right-hand side and a button bottom side.","F"
"4467","...in here now. We should just figure out when we want to start implementing that.","NULL"
"3267","Yeah, he made them 357. She made them all 357.","NULL"
"2496","It needs to start getting on integrations and  . I need to show Karen what they did. Whether or not she's able to show up and put much into it and see.","NULL"
"612","Okay.","NULL"
"2405","It was quite a while ago, and to be honest, it could have been you that said it or somebody else. Neither here nor there. That's the next barrier I'm coming across, is I need to know whether or not the G team's ship-to code is indeed a valid ship-to code for those locations that are in the extract. If they are, I'll need those addresses. I really just don't know where to find them, if they are in the extract or not.","F"
"1820","She's too busy to push the button to answer the phone. Patrick had to do it. He was closest to the phone.","NULL"
"1670","If it's going to be database also, I'd take a and set a task for that.","NULL"
"4471","He can walk through the whole thing, so that everybody knows what it does. It doesn't have to be me, anybody can learn something new. I think it's beneficial to everybody. It's just a class.","NULL"
"1118","No, we were creating, depending on which way we were doing it. If we create a service, they would pull it whenever they wanted. If it was an FTP, then we would send it to them or put it on the FTP site, daily or however often it was run.","NULL"
"2870","Much bigger issues regarding Windows 10, the hardware aspects of this. What kind of hardware we'll keep it on, Support, or  for support, all that logistics part of it.","NULL"
"3116","Then, if that's the case...","NULL"
"4229","The first implementation of this would be the print people entering the survey stuff, because that's where  came up with. Those are their engineers. Eversource engineers and Frontier engineers. Frontier is the ones that were complaining, like, 'No, heck, I'm not using Notify, because it sucks.'","NULL"
"261","Just to finish my thing, sorry.","NULL"
"2008","It is. Just looking at it's like...","NULL"
"2183","Great things they were better than that.","NULL"
"1521","As a participant, I want to see who gave what estimates during the current round, so that I know this when were discussing the estimates.","F"
"2069","Once you approve the order. You have to, after you handle each of your detail line items, however you're going to handle, then you approve the whole order, and that's what  .","NULL"
"2262","1.20 is the one that's going out at the end of the month.","NULL"
"2918","Barry is sending four people to Conyers, Georgia to inventory a warehouse full of test equipment.","NULL"
"3056","It's like you've got to get past this one, to get past that one, to get this one.","NULL"
"2712","I've got to see. Mike was thinking that those would be treated as two separate records. I hear what you're saying. We have a whole record leaving and a whole record coming in. To me, it would be changing the VIN.","NULL"
"667","Yes, they have to be Recording.","NULL"
"4067","I know, it's hard.","NULL"
"2253","The tickets come in to Jesse, if he can't figure it out, if it's a coding thing, something that needs to be looked at in the code, questions that he has, or things that need to be configured. Then he would go to the sustainment team, and then they're able to look into the code, probably make some database changes. At first they're going to have a lot of questions, so we will be subject matter experts that they'll go to.","NULL"
"1176","Yeah.","NULL"
"4690","I think so.","NULL"
"3654","If you get familiar with XAML, you could split the screen, and put two controls side-by-side. It's going to reduce our real estate on the screen and stuff, but you could split it, split the two columns and put each control in there, and see if we can get them side-by-side might actually be useful for testing, and comparison, and such.","NULL"
"4403","... route.","NULL"
"4008","It has mappable features. A lot of the things that you do already, whether we come up with that generic thing that speeds up open conversations. That's an epic, probably, as far as...","NULL"
"672","As an NSF employee, I want to see how the user recruitment form looks and behaves on a sample page, so that I can understand the impact the recruitment will have on the NSF page.","A"
"2547","Yep.","NULL"
"126","Uh, I didn't get to think about this, but probably predefined would be easy to manage.","F"
"829","If I hit submit here, it's going to give me a bunch of crap.","NULL"
"2797","Sure. Like the last interface worked.","NULL"
"1381","As a Staff member, I want to Process the Appeals, so that I can track the outcome and record the impact on the relevant records.","F"
"937","Yeah, and I don't even touch that partly, so there's still that whole falling out there. I'm trying to get at least to the point where they're functional business wise so I need to get the work orders in there. I think ship orders escaped my...I was looking at the publish package for this version, and I noticed that I was publishing ship orders before and I'm not even importing those now.","NULL"
"824","As a site editor, I want to have a prominent area on the home page where I can put special announcements not necessarily news or articles, so that I can give them additional exposure.","F"
"3211","I don't know. It's, if you're changing the frame it can't be general.","NULL"
"4691","Basically going here, we'll replace, I think kind of shortcut method, but we are going to go in here and replace a lot of the records. Mad control, we are going to create the new Telerik control. I'm going to find a new model. Chill a little bit.","NULL"
"38","So I think we should, it's really important that we also offer such a service and we already discussed this, the board that this should probably something that can be used as a software, as a service where we have customers, they would just sign up to our application, pay a fee.","F"
"3196","for hardware  for flow, even though   hardwire on the same transaction.","NULL"
"841","The easier thing to do is have Data Collector. The previous screen do something similar in Data Collector and then do a web service call. I don't know what that XML file is, if that's anything.","NULL"
"49","No, actually there, there isn't, I mean, super admin.","NULL"
"3206","Yep. I put this stuff in here and he still didn't run the  right, but you can't really blame him because I've done diddly-squat, too.","NULL"
"3223","It's basically this frame is not a general,  general  . In other words, if you go in and say the only thing you want to do is change the frame and you went to this screen  general change. That's what  when you're changing the frame. You're just changing the frame.","NULL"
"606","But I think here it I'm with Chris because if I want to use the tool in my native language, I expect that the tool is, or yeah.","NULL"
"162","But just so that I understand you right, so that as a user, I don't really have to, um, log in or anything?","F"
"765","Yeah.","NULL"
"1745","As an Applicant, I want to Complete Building Development Project, so that I can receive any posted bond and/or obtain occupancy.","F"
"439","My friends it's the only rough, but otherwise probably same as me.","NULL"
"4406","We can pull up the code, and it'll load. It was loaded by the interface. Then it started to quit. No maps.","NULL"
"2044","Like  , I don't have email in front of me, but basically you've got a high level...Susan's team, I guess when they go in there to do the approval. Pretty much the status is already set, so they're restricted, and can't redo something.","A"
"2015","Hi, it's DJ.","NULL"
"1329","...your desktop. Internet Explorer...","NULL"
"2742","Bye.","NULL"
"4297","I would think you would do that tomorrow, right before we back up the database?","NULL"
"4585","You don't want to box anybody in a corner, either. That doesn't do any good for Jasmine, to say, 'OK, she's the UX person now.' Not that that's a bad thing, but you would probably want to be a little bit more well rounded than that, versus looking at Miranda and going, 'You're more data or business logic  .","NULL"
"3863","UX stuff.","NULL"
"1726","Let's estimate that from both sides, from whatever Baski needs to do, whatever Mahesh is going to...","NULL"
"3473","A cycle count is where they go out and look and see what spare equipment they have in these spare cabinets, and LCAM says one thing, and what's actually in the field could be different so it has to be reconciled to what's there and what LCAM has. I don't often Kevin, do you know how often you do cycle counts?","NULL"
"4759","You can filter by the drop-downs on the grid.","NULL"
"2825","Hi. Who's on the call?","NULL"
"1623","As a site visitor, I want to post comments about articles, so that others can read them.","F"
"3421","It's probably called  . That's the other system probably where they are getting this information from. Where the tech goes in and says, 'I did the work.' Then nothing ever happens.","NULL"
"4198","F-A-S-T, space, P-A-T-H. That's just a name that Eversource uses for some reason.","NULL"
"2423","Yeah. Every G team ship code that we have, we would just map it to alpha.","NULL"
"3900","Here's an example of what I hope we can avoid. Today when you logon you've got your list of conversations. You can change that to say, 'My Conversations,' 'Conversations assigned to me,' use the same search and everything.","NULL"
"2168","Thanks, everybody. Hope you...","NULL"
"1391","It's not really a new one. It's just a concern. I think we need to have a look at this. They had a meeting about this MapPoint and I didn't know there was a meeting. Three different people came to me, 'I spent 20 minutes there asking, 'Where do you use MapPoint? What do you do with it?'' I said, 'What?' Three different people are asking me. They had actually they are at the meeting and...","NULL"
"94","Oh yeah.","NULL"
"3144","18,  .","NULL"
"2152","It is still open. You shouldn't...","NULL"
"1454","As a CMS administrator, I want to have roles, so that I can assign them to my users.","F"
"453","So maybe let's say a survey can maximum at the, at the maximum contain 10 questions.","A"
"4173","action. I can see the entities, I can see the contacts. I can sign in. Although there should be stories listed under there.","NULL"
"4295","You're planning on importing that, when?","NULL"
"4156","Then, once Corey gets that login mocked up, we'll see if we can get all that.","NULL"
"2395","Since the Infinium folks are going to have to deal with this, probably on the case-by-case basis as they encounter the new sub plants, I assume, could we put maybe a placeholder on these that we can't figure out and get them in that way? And then they could be dealt with on the case-by-case basis as they get encountered in LCAM? Is that a possibility?","NULL"
"1879","As an NSF employee, I want to join Github, so that I can participate in the issues as assigned.","F"
"2623","Only three minutes, it's not worth it  .","NULL"
"3802","For TFS, we can keep the Notify team, and then I can create...I've done this before, I have something called  , and then as those things are pushed into real iterations, I just move it over to that iteration, so we can keep all these stories in an HTML5 iteration.","NULL"
"1537","What about that?","NULL"
"3628","I can take all of this stuff to Darrell and to Brett and discuss what's considered maintenance, what could be...","NULL"
"2745","It was 60 degrees in July.","NULL"
"1450",".","NULL"
"3709","It seems to be available. All right, 10:00 to 11:30. Does that work? What time you normally do lunch?","NULL"
"2815","OK. We're going to have to hang up in a minute, but I do want to bring up...Who's doing the parts that aren't conversion for  ?","NULL"
"2946","Yeah. I've had  .  the screen.","NULL"
"810","I've got the same concerns. It seems like we , but not much is getting rubbed off.","NULL"
"415","Now as a manager, I would have to, to come and take the information from anywhere, right?","NULL"
"4290","We might want to just ask him about that, because that's weird. If he's a Verizon employee, then he would already be in Frontier's user tables. Do you think it's worth asking him? That's just weird.","NULL"
"2307","Writing? You're writing  .","NULL"
"2788","Yes.","NULL"
"562","Since then I may be a follow-up question if we don't know prior.","NULL"
"235","Perfect.","NULL"
"4333","Hey Violet, hey Kim.","NULL"
"2782","Couldn't find my two...Well, I got everything, the bulk of it done. I've got to make sure everything still works like it's supposed to.","NULL"
"1564","As a Publisher, I want to validate the data I am about to publish to the registry, so that that I publish good data and know that I am doing.","F"
"527","How do you mean?","NULL"
"500","From a UX perspective, this will bring a lot of benefits.","NULL"
"3956","Conduit and  . What do we think about that? We think about what we're going to do is right now you can go in there and say, 'You go to the Search screen. That gives you a list of everything you can possibly want to look at.' I can go to a checkbox and choose. Basically, this home page, there is a home page for each thing that we want to manage.","NULL"
"3904","Right. Maybe it's like you have your home page and you're doing it, or maybe you duplicate these for different things like for  and for conversations, and  .","NULL"
"2752","Hello. I thought you all died or something.","NULL"
"4326","Nice.","NULL"
"89","Uh, this, my mother [inaudible], um, she's finished in two minutes.","NULL"
"4475","You can cancel it.","NULL"
"1527","As a camp administrator, I want to be able to delete parents from the database, so that I can keep my pages free of unneeded clutter.","F"
"4151","Is that responsive design right now where it's...?","NULL"
"4622","I think that it is that you never bother me, always  . If you have a question, come back. Don't ask, don't even email me. Just walk in. I would love to help you, but you've got to make a step. Don't assume and sit there, just come. It's OK.","NULL"
"230","What looks fancy?","NULL"
"1492","Yeah.","NULL"
"3041","I'm thinking that scenario. That choose hardwire and plug. I'll put the estimate field up here, which, we want that now...","NULL"
"1165","I only drive like ten miles a day.","NULL"
"874","As a trainer, I want to turn a course into an event or an event into a course, so that I can correctly classify anything that was entered incorrectly.","F"
"2756","Probably, it won't.","NULL"
"279","Bring your others as well.","NULL"
"4273","OK, yeah, they said they were going to leave that alone anyway.","NULL"
"1867","These profile editor location groups, then you retire them. You give them back the ones that you didn't touch, so that they know they still need to go and manually look at those.","NULL"
"3059","Well...","NULL"
"872",". This is the one I showed you.","NULL"
"1060","As a user researcher, I want to have the finalized OLPA task script, so that I can begin testing with internal users.","A"
"4495","I can't type anything in here now, so I'm just going to write it down. Somebody's got it locked.","NULL"
"1412","As an owner, I want to make a user an owner, so that they have full control.","F"
"4779","It's exactly the same thing.","NULL"
"1277","As a VisualDesigner, I want to create a moodboard to aid with visual design concepts for the nsf.gov website, so that we can discuss different design concepts with stakeholders.","A"
"1350","Yeah, as long as the tester gets updated like the week after or two weeks after so that it's available for when we need to do tests on the interface, because he's also off that week that you're off. That's why I'm like, stuff's got to be done. It's got to be right because you all are off, which is allowed. Just got to be done.","NULL"
"405","I think maybe for the swipe questions, we can have some, some, uh, a bar graph that shows the sides they swiped to.","F"
"4774","You're probably good, because it was after he told me that he had done his stuff that I told  about it,  .","NULL"
"2677","We're working,  to see what would be a report that would be good for us to go through. We'll get that figured. Kim wanted to talk about those fallouts, try to do it as a group, so we're not having any conflicts. We can work definitely on that. I don't have anything else.","F"
"3576","Yeah, but part of the problem with that is they don't have WiFi at all of the locations so their wireless scanners would not work to connect to LCAM at those locations. There's a couple of issues that they're trying to solve.","NULL"
"2776","I'm good. I'm doing clean up on back-taxes I have, here. I'm good.","NULL"
"463","It's, it's his job to make sense out of this data.","NULL"
"370","I mean, I really liked the idea of making questions commendable like that.","NULL"
"2833","Hi. Who just joined?","NULL"
"116","I think it's really important that we come up with a neat design where let's say a project manager, he can feel there and he can also customize his, um, dashboard.","F"
"980","Gather up...","NULL"
"825","Please enter your conference...","NULL"
"4459","Did everybody have a chance to look at those dates for the Agile class? I want to make sure everybody's here when we do that.","NULL"
"1017","As a site member, I want to subscribe to an RSS feed of news, so that I remain sufficiently and easily informed.","F"
"3128","...transfer?","NULL"
"10","Okay, cool.","NULL"
"1399","No. It's the second part of that because I don't think we do. I want them to know it's not our problem.","NULL"
"1422","As a camp administrator, I want to be able to schedule tasks/activities for a specific camp group, so that I can track each groups daily/weekly and monthly activities.","F"
"1703","No, plugs. This only applies to plugs. If I went back and do a hardwire, then it'll have estimate through here.","NULL"
"4813","Deploy 1.1 test.","NULL"
"4684","On this page, remove the user control stop, and add the reference, or just drop in the Telerik control. We're going to input the same items here.","NULL"
"3593","Barcode from porch...","NULL"
"574","One is the interactive part, which should be translated for, for the users between them.","F"
"3782","No, I would be violently opposed to that.","NULL"
"4595","Thank you, Baski. I'll pair with Baski.","NULL"
"3655","That's a good idea, maybe that.","NULL"
"1777","As an admin, I want to be able to add or remove recycling facilities' information, so that users get the most recent information.","F"
"285","I should've mentioned this earlier, sorry, but maybe, maybe less about the, the actual functionality and more about the design will be really nice.","NULL"
"2869","What they made John the offers to give...heads up?","NULL"
"3853","We're at a little bit of a disadvantage and at the same time, at a little bit of an advantage here because usually, when you have a project, somebody's throwing money at it and they want a particular piece of functionality.","NULL"
"1718","I like Jim's rules, that mindset of, if we had CLLI six, we could map it to an exchange that way. That was incredibly beneficial. It's just it's not fully working.","NULL"
"2029","I'll be calling him.","NULL"
"4158","Stating today.","NULL"
"4551","Another point I want to add is context that I think goes with that. In implementing, I think, we have multiple work simultaneously scheduled, and they're all depending on one person, that one person is going to hold everybody.","NULL"
"1364",", bring that around.","NULL"
"1944","It was because the projects table had duplicates. It had multiple blanket projects in it. It was a conversion issue.","NULL"
"2154","It is  .","NULL"
"1236","As a Publisher, I want to know what do next after signing up, so that that I can get going quickly.","F"
"5014","Well, let me see if I know what you're talking about. I'm not at all sure. Have I found hardwire? That hardwire? Partially found. That's a hardwire, right?","NULL"
"4114","Right. But there are some other things that came up that I need to talk to you all about, which is in...Did I schedule that meeting yet? I don't know that I did yet. There are some other things that might need to be changed in the next two weeks. I don't know.","NULL"
"1136","It doesn't matter. I don't care. There's...","NULL"
"477","I really, yeah, I'm really sorry.","NULL"
"4425","See if I stuff up.","NULL"
"1778","Yes.","NULL"
"1058","I just wanted to clarify.","NULL"
"1361","As a FABS user, I want to have my validations run in a reasonable amount of time.","A"
"1390","As a participant, I want to have a small thumbnail photo displayed near where my cards are played, so that the game is more personal because I see who I'm estimating with.","F"
"2922","All right.","NULL"
"4028",".","NULL"
"3574","Are there enough floater owner laptops around to where if a tech needs to go out and say, 'Hey, I need to spend an afternoon doing these cycle counts,' he could get one?","NULL"
"1505","As a Data Analyst, I want to compare different versions of some datapackage locally, so that that I can see schema changes clearly and adjust my analytics code to the desired schema version.","F"
"4972","A couple of days?","NULL"
"2837","Kevin.","NULL"
"4323","You might want to put names to these, so I can know who's doing what.","NULL"
"3501","They can spell their name.","NULL"
"1091","As a team member, I want to understand what the MVP should look like, so that I can begin understanding workflow needs as they pertain to any CMS decision.","A"
"4700","Controls.","NULL"
"3545","I don't even think it's reading it.","NULL"
"4985","What she's saying will help us out, so...","NULL"
"2820","So, that's not this Sunday, but next Sunday.","NULL"
"2383","Yeah. Or do they not use the pseudos in Infinium?","NULL"
"1798","As a camp administrator, I want to be able to see all my camp groups and the events scheduled for each camp group, so that I can notify counselor of what their group will be doing for the day.","F"
"4621","That's what we want to try to do.","NULL"
"3972","Out of curiosity, where is it that I see the map?","NULL"
"2120","Yeah. Yes, sir.","NULL"
"780","As an NSF administrator, I want to shadow the CMS implementation, so that I can learn as the prototype is developed further.","A"
"1071","As a user, I want to be able to select different types of recyclable waste, so I have and get a list of facilities that accept each type and their opening hours, so that I can find an optimal route and schedule.","F"
"501","I think, I don't know if the programming part will be a lot more complicated.","NULL"
"2683","Are you asking if Drake is here? Yes, he's here.","NULL"
"565","Are there, can you translate them?","NULL"
"2108","Gather up...","NULL"
"3212","Yeah, but this is general change. One of them was general change and one of them was that change the frame.","NULL"
"1244","As a trainer, I want to update one of my existing courses or events, so that it reflects accurate information.","F"
"1239","Kim when you say...","NULL"
"2109","On the order approval screen they'd be trying to change to SE for a line item.","NULL"
"3668","I know what project this is.","NULL"
"4528","I don't know if that one's as good an example. I think, we had the right people on that.","NULL"
"3104","When it's retired in place you have these options, to change, and the location...","NULL"
"1673","Fast Path and...We need to make sure we can fit some user storage in there to keep Mahesh going. What's happening right now? You've got your user environment set up in your...? How are these designs that Corey's given being implemented right now?","NULL"
"4416","In a minute we can put mobile Collect, because really the only piece of that was of interest there to me was the small little convert file that switched it from map service to...","NULL"
"1375","I agree.","NULL"
