"id","req_specification","class"
"2580","Patrick, if you launch the  .","NULL"
"2248","Are you sure? Nobody  today.","NULL"
"1949","See you guys.","NULL"
"4933","I know.","NULL"
"2687","We had some questions. We're trying to understand...Let me just pull it up.","NULL"
"1187","I do a control if...","NULL"
"4010","Scroll down on your conversation home page, a generic search. What does that mean?","NULL"
"2111","Drake? Can you see how substitution works in LCAM?","NULL"
"1166","As a user, I want to have nice error pages when something goes wrong, so that I can trust the system and its developers.","A"
"965","...a canned query. I can't remember what the title was called, of the report. I'd have to double check it. She was getting some random results and others were getting good results query, sensitive to multi, people trying to use it at the same time. The point is that current results were impaired.","NULL"
"186","So from a technical point of view, Janik, it will be probably easiest that way, right?","NULL"
"43","So I think there will be something like managers and maybe something like, um, uh, super admin.","F"
"3366","Yeah, that's the same thing. The north, south, east, west would be...It's just a list of all 50 something COs that they don't have in their common language names.","NULL"
"4530","are level three, right?","NULL"
"1224","As a Web Developer, I want to be able to install multiple versions of the same datapackage separately, so that that all my projects could be developed independently and deployed locally.","F"
"2694","No, we were creating, depending on which way we were doing it. If we create a service, they would pull it whenever they wanted. If it was an FTP, then we would send it to them or put it on the FTP site, daily or however often it was run.","NULL"
"4620","That is the plan. That was  the plan for...I know you guys came in and we just can't get out from under LCAM, so, I don't have anybody to sit with you.","NULL"
"2597","And Brian doesn't have anything?  He's afraid to try and break his stuff apart into tasks. I don't think he has any tasks out there, so they wouldn't show up on the board. He's being a bad boy  .","NULL"
"1884","I'm here. I am desperately trying to get the board to show up.","NULL"
"750","As a Researcher, I want to get a Data Package into STATA in seconds, so that I can start using the data for doing analysis and visualizations.","A"
"2186","It's a lot...a little bit ago what you're doing with the Thursdays?  Did Kim even join?","NULL"
"4396","This right here.","NULL"
"3188","How can I narrow it down to this? I have to go trough 834 records.","NULL"
"1385","As an owner, I want to remove a user as an owner, so that they are just a member and no longer have full control.","F"
"4414","I've been brushing up on it. I'm an office manager like he said. I found some demos on implementing data maps in Telerik. Since I didn't have the branch code, I weren't able to plug it in and see if it worked","NULL"
"573","But now, well, I would give the admin the possibility to correct the translation at least, but just, just as we clear, we are now talking about two different things.","F"
"1592","Oh yeah, I forgot about that. We can't really start it until eight o'clock anyway, based on our stop timeline event, which isn't until seven. Grady, you might want to take half the day off tomorrow, since you're going to be working half the night.","NULL"
"1549","My God.","NULL"
"1160","We've got Fast Path.","NULL"
"4461","The 19th is a staff meeting.","NULL"
"2697","Either way, it'll be a change for us. It is not like we could just allow them to send it to the existing interface and it'll change the part with what they want.","NULL"
"4479","I'm pretty sure that was domestic violence.","NULL"
"1375","I agree.","NULL"
"3866","It's based on Corey's design.  all these tiles and then it also says,  to customize your tiles, edit your tiles on that system but editing on a home page is basically just this and then I think it says something like, 'Save these conversations in a grid.'","NULL"
"1722","As a Planning Staff member, I want to Generate Planning-related Reports, so that I can access, analyze and/or export the needed information in the format I requested.","F"
"1231","As a camp administrator, I want to be able to create groups and add campers to the groups, so that I can easily organize the campers.","F"
"482","That's also why to be called polls service something, you know?","NULL"
"644","And if yes, in which form it should come across.","NULL"
"1284","It could be. I don't know.","NULL"
"1460","As a company, I want to have a website that is easy to use, so that I can upload or delete stuff step by step.","A"
"496","That's that's a really good idea.","NULL"
"3810","This is like a temporary thing to  .","NULL"
"394","Yeah right, yeah, yeah.","NULL"
"3469","The guy in the field who's wanting this functionality is thinking more of an offline scanner where you sit it into a...","NULL"
"56","Okay.","NULL"
"4114","Right. But there are some other things that came up that I need to talk to you all about, which is in...Did I schedule that meeting yet? I don't know that I did yet. There are some other things that might need to be changed in the next two weeks. I don't know.","NULL"
"763","Can we look at that?","NULL"
"920","We not even know. You're just walking in, and finding out yesterday afternoon. You said, 'What's going on?' , 'We need some help from somebody.' Get all the people as soon as possible, so we can all work together and then go through like 10 different , and finally come to you for three minutes work.","NULL"
"1610","As a trainer, I want to see the upcoming courses are what I want visitors to notice, so that they register and there's a benefit to my membership.","F"
"4369","I'll go through and try to install the Tile service client for J.R.M, see if I can get that done. That will help me.","NULL"
"1480","As a participant, I want to change my estimate as long as the draw has not been completed, so that I can change my mind.","F"
"3723","Mine was free.","NULL"
"3547","Do their reconciliation.","NULL"
"2060","You click that, and you can say split it off, and you can...","NULL"
"566","Would that make sense?","NULL"
"1743","As a VisualDesigner, I want to concept different styles for the nsf.gov website, so that we can discuss different design concepts with stakeholders.","A"
"4436","What do you need the map for?","NULL"
"1016","I grew up in... DuChock.","NULL"
"3109","There a danger in doing that?","NULL"
"1472","Yeah. Today, for hardwire the screen has frame, but for plugs it does not.","NULL"
"4940","Oh.","NULL"
"4801","Do I need it? I think I do. I haven't checked in the merge yet, but when I did I saw everything from 105 to 109 went back to the trunk which I presume has not been run in our dev and test environments yet.","NULL"
"4786","We need to run database scripts this evening. I can run that script to update the project ID, to see if the columns are  .","NULL"
"3456","No. Sit down.","NULL"
"4800","I can't remember if I ran that section against dev or not, I'll double-check.","NULL"
"2765","No, I have Brian. Brian can you hear me?","NULL"
"1484","As a Consumer, I want to see how much the data has been downloaded, so that that I can choose most popular in the case when there are several alternatives for my use case.","F"
"1705","As a user, I want to be able to access the site and do all the other stuffs on all of my electronic devices.","A"
"4600","Side bar. Part of this, I'm going to talk with Michael about it. As far as the context switching, maybe we can talk about this in the next meeting, and continue onto this. Let's start thinking about this, but we, as a group, need to start doing a much better job at estimating.","NULL"
"2207","Well, get started on it. I'd say go ahead, but until we have the meeting happening.","NULL"
"676","As a site admin, I want to delete any course or event, so that I can remove things that will no longer occur.","F"
"3665","No.","NULL"
"166","So the manager will actually create this user and then the user is sort of in the system and will receive the emails on the email address which the managers specified.","F"
"3738","You can  .","NULL"
"2504","Whatever it needs.","NULL"
"3158","Sure.","NULL"
"922","As a moderator, I want to enter the agreed-upon estimate, so that we can move on to the next item when we agree.","F"
"41","It's like, um, an online application that has different user roles.","F"
"1015","As an agency user, I want to have all derived data elements derived properly.","F"
"2700","OK, but short of changing the part number, I thought the MR, the old part number would go out and the new one would come in.","NULL"
"5011","Did she give you that template data or anything?","NULL"
"515","Maybe you can grasp this a bit better Janik, but, or maybe also you Mark as a UX specialist,","NULL"
"1917","Mamma has spoken.","NULL"
"1141","As a UI designer, I want to track the issues that come up in Tech Thursday, so that I know what to test and what want s to be fixed.","F"
"2945","I was about to say, I'm sure she already had the SQL.","NULL"
"3134","That's this three-day story.","NULL"
"3328","Yes. It's two things. In the first file editor, they have this north, south, east and west location groups. If it's in one of those location groups, then you wouldn't do anything with it. If it's not in one of those location groups, then you would retire it.","NULL"
"1338","As a parent, I want to be able to track my child's activity and schedule at camp, so that I can have peace of mind.","F"
"4013","Hit, 'Filter results,' that's probably a good way to do it. Just, 'Filter results,' you don't need the 'search' in there.","NULL"
"1220","If I see a bunch sixes or sevens or something or a bunch of tens and somebody uses a seven, then it's like, 'Why is it?' and then try to address what the concern is. So like Patrick in , what would make it better than a seven?","NULL"
"2007",".","NULL"
"1350","Yeah, as long as the tester gets updated like the week after or two weeks after so that it's available for when we need to do tests on the interface, because he's also off that week that you're off. That's why I'm like, stuff's got to be done. It's got to be right because you all are off, which is allowed. Just got to be done.","NULL"
"3060","OK, well. Estimate.","NULL"
"1372","Knocking some stuff off the list. It is helpful. It is generally good, but not has been better or worse than the other. We've started knocking stuff off the list and maybe get more fuzzy .","NULL"
"3624","We were having this discussion about what's covered in maintenance.","NULL"
"3171","Well you know you've have  .","NULL"
"1055","As a camp administrator, I want to be able to delete campers from the database, so that I can keep my pages free of clutter.","F"
"299","Just, just to clarify this, this, if I understood this correctly, this is about users pitching new survey questions.","NULL"
"324","So maybe, yeah.","NULL"
"1889","I have to write this crap down because I have to have all my notes. Grady is done with all of his stuff.","NULL"
"1726","Let's estimate that from both sides, from whatever Baski needs to do, whatever Mahesh is going to...","NULL"
"3021","The other change is to allow them to make, let me see, what does it say? On here, they search for assets, and then they're going to change a whole group of hardwire and plugin records at the same time. Right now they can't do that, so that's the first change you're making. That's the story.","F"
"2457","DJ seems peppy.","NULL"
"501","I think, I don't know if the programming part will be a lot more complicated.","NULL"
"2106","Happy.","NULL"
"3002","For them.","NULL"
"1925","I'm just kidding. It's OK.","NULL"
"621","I mean, I think we are at the we're at a very good point.","NULL"
"2353","So, Jim, the last email that Brian sent in regards to those CLLIs that we can't match as an exchange? I know we're getting down to the wire. I don't think that Ken and I can weigh in on that, as to what he wants to do.","A"
"2632","Right! What is that phrase?","NULL"
"3147","Development hours, which aren't full days. That's at least got a task on there...","NULL"
"4062","There's nothing prohibiting that. Then, even having the dashboard underneath the epic conversation home page, where there's an epic conversation dashboard, there's nothing prohibiting that. Again, it allows it to roll it up to where the epic has acceptance criteria, because all of these are acceptance criteria on each of the epics.","NULL"
"2496","It needs to start getting on integrations and  . I need to show Karen what they did. Whether or not she's able to show up and put much into it and see.","NULL"
"1386","As a content editor, I want to be able to add videos from Brightcove.","F"
"2035","He's trying to slack off, guys.","NULL"
"3218","No.","NULL"
"237","So first, uh, I would, I thought about open text questions.","F"
"685","As a site member, I want to describe myself on my own page in a semi-structured way, so that others can learn about me.","F"
"154","I'm wondering, do you think it is necessary for users to even have like a in or something?","NULL"
"4001",".","NULL"
"1129","As a Developer, I want to use data package as a node lib in my project, so that that I can depend on it using my normal dependency framework.","A"
"4220","Windows app. My preference is an import-export inside Notify thing.","NULL"
"2991","sort   .","NULL"
"3491","And today they're not doing them in LCAM. They just go off and...They print off their inventory and then they checklist it as they're doing their cycle count.","NULL"
"4508","Same thing. I didn't know that there was a meeting. I had three people I talked to. From the meeting they called me and said, 'What is it? How it works?' I said...","NULL"
"1907","It'll compile well. That's really all we need. It compiles. Adam. So you know how this one's...So you need to...","NULL"
"379","So people can, if the manager allows command specific questions, which I really liked this skip some sort of inclusion,","F"
"4349","Sounds like it. Thanks everybody. We'll talk to you guys later.","NULL"
"4722","I don't know what's going on, still opening.","NULL"
"4986","Yeah.","NULL"
"3341","The realm.","NULL"
"448","We were, yeah, exactly what the reporting.","NULL"
"4212","They were good.","NULL"
"1379","If you've got the tab functionality other than the Conversation.","NULL"
"2938","hour.","NULL"
"2303","to add, is there anything you want to ask or talk about  or suggest? I know right now we're still making  so the process changes and trying to hold on  process changes and also that we've touched a lot of issues  . I had you all feeling good on the HTML file as far as this iteration   .","NULL"
"3088",".","NULL"
"867","As a Developer, I want to update the Broker validation rule table to account for the rule updates in DB-2213.","F"
"3523","Yes.","NULL"
"1609","As an Admin, I want to invite someone to join the platform, so that that they can start contributing or using data.","F"
"1665","As a ResearcherPublisher, I want to publish Data Packages to CKAN, so that my data is findable, and I can have a data API.","F"
"2642","1268  .","NULL"
"3563","I'd say both of those you could do that, and you could do that in five days. That's the happy path. I don't find anything else along the way.","NULL"
"3642","If they're outside the corporate network then they need the VPN client to run LCAM on the laptops.","NULL"
"3683","This will be the basics. Have the basic view of  created. We're going to unhook the current control. Put the new control in. Then we'll start actually replacing some of the implementation of whatever's happening on the map itself. If we need boundaries, or anything else.","NULL"
"3801","Right.","NULL"
"353","Okay.","NULL"
"4595","Thank you, Baski. I'll pair with Baski.","NULL"
"4603","I personally think, I'm going to say this until I'm blue in the face.","NULL"
"3605","Microsoft, they came up with...what is it called? Local DB. SQL Express is its own Window service that runs as an entirely separate Windows service. They have a version called Local DB which is a process. When your program connects to a local DB database it's not a Window service that's already running in the background, but it kicks off an even more stripped down version of SQL Server that runs as just a plain old process.","NULL"
"3130","I'll have to do that anyway.","NULL"
"720","As a camp administrator, I want to be able to set a reminders related to specific tasks that has to be done.","F"
"2818","I guess I can. We don't have to talk about that now, though.","NULL"
"4913","Yes, they weren't CLLI codes. They had sometimes a full name, sometimes part name, sometimes...Like, Marion had, 'Marion 222,' on it, because that's the street address, but then those is what we were trying to tie to at least some kind of Afinium company, and that's where we came to dead ends. They don't do that in their world.","NULL"
"2770","You have Brian.","NULL"
"3995","That's what's here?","NULL"
"4677","Any of the things that Basky's talked about so far. He mentioned creating a new view model for the map provider.","NULL"
"3395","Two. That sounds reasonable to me. I was thinking one or two at least, it depends on how much testing you have to do.","NULL"
"2464","A little bit.","NULL"
"2946","Yeah. I've had  .  the screen.","NULL"
"4486","Yeah, she just lost it.","NULL"
"2683","Are you asking if Drake is here? Yes, he's here.","NULL"
"1500","As a Developer, I want an SPSS integration, so that I can integrate data-packaged data with pipelines that use SPSS.","F"
"4481","What?","NULL"
"2614","Who's going to do the fixing and not do their one  stuff, is my question?","NULL"
"4203","It's a, 'Don't make me click here, here, here, here and here to enter the thing I do all the time.'","NULL"
"1153","You missed a good lunch, I'll tell you.","NULL"
"3047","Yes. What you're doing is, you're changing it so that when they select, regardless, you're going to have estimate show up here.","NULL"
"3185","I knew it started with IND.","NULL"
"195","So we would need, uh, maybe this part.","NULL"
"2673","So far we've received about 203 Received Equipment and 60 of them fell out with Did Not  at this point.","NULL"
"2886","Hello","NULL"
"4498","What is that?","NULL"
"2547","Yep.","NULL"
"2623","Only three minutes, it's not worth it  .","NULL"
"1424","Even worse, really high. See if anybody notices. I might do that, now that you said that . Whenever I get to the 90s, instead of it being issue number 90 it will be like 92. Or something.","NULL"
"4622","I think that it is that you never bother me, always  . If you have a question, come back. Don't ask, don't even email me. Just walk in. I would love to help you, but you've got to make a step. Don't assume and sit there, just come. It's OK.","NULL"
"4583","That's not really how...It was thought about, how they do it. One thing that we try to do, that I try to do, is give people the opportunity to forge the path that they're on. Some people are more, they want to do UX, or some people want to be full stack. Some people want to be more of the nuts and bolts.","NULL"
"1886","I'm sorry. Deal with it. I haven't even written down what day of the week it is yet.","NULL"
"4904","Like the one example I sent, Marion, Maine, I just picked it because that's where I live, but coincidentally the street address was the same. I know we have all sorts of versions out there so that wasn't meant to act like, 'Oh, this is easy to do.'","NULL"
"4517","...include the person that you're getting help from in the meeting. That one was a special case, but we have them more often than not, it seems like. Going to have some in a month.","NULL"
"3020","So, it shows up here, but it's not required, but that's what you're going to do, is either make it required or default it for the  records.","NULL"
"2704","We're just trying to make sure, before we accept the digital feed that.","NULL"
"4047",".","NULL"
"4385","Maybe there was not one for this interview.","NULL"
"1353","As a developer, I want to have created database indexes, so that the queries run as fast as possible.","A"
"4893","It did have the street?","NULL"
"2139","Grady wasn't able to finish for Friday night's release. They were trying to  . He'll run that after about six pm central time today. That should get anything that would have changed in the release and that's still sitting in the FCC screen. That should at least get rid of any of that.","NULL"
"1124","Who's going to do the fixing and not do their one stuff, is my question?","NULL"
"4499","That conversion to  .","NULL"
"545","I think this, this should definitely be responsive.","F"
"2345","Slacker.","NULL"
"756","As a Developer, I want to get a Data Package into Clojure in seconds, so that I can start using the data in doing analysis and visualizations.","A"
"1806","Both for DC3 and for LCAM.","NULL"
"3854","That money's worth some amount of points. At that point, we say, 'I'm going to give you X number of points because you've given me X number of dollars.' We don't have that same philosophy here but we still know, you still intrinsically know, 'I don't want to spend any more than this amount of time on this particular functionality.'","NULL"
"4903","Yes, some of their location codes they have made look similar to CLLIs. Some of them have underscores in them. Some of them have...","NULL"
"1755","As a Staff member, I want to Schedule a Meeting, so that I can bring the required parties together at a specific date/time to address an issue.","F"
"2226","OK, HTML file  .","NULL"
"480","Like otherwise, if someone really wants to create the, in that survey, even use our other services, we have flooded with a lot of them on our home page to create a really full flex drownded survey.","NULL"
"4972","A couple of days?","NULL"
"325","I don't know.","NULL"
"2873","OK, since...","NULL"
"3302","I know. I just want to say four weeks is better.","NULL"
"1342","We'll use TFS as the actual user stories, just for organizing it's fine.","NULL"
"3962","That would lend itself to being more like JRM where, say you're home, you login and you go to a home page that right now it's all linked but you've got a home page that has everything that you can do. You've got assets, billing, reference data...","NULL"
"2518","Would have been real blood.","NULL"
"4731","Oh, this one here needs to be  .","NULL"
"522","But certainly it makes sense.","NULL"
"4901","If you're leaving it on me I don't have any options right now. Somebody else can assist. I don't know.","NULL"
"3838","If I want to, say, use a list, it shows the grid. That all makes sense. Maybe that becomes just the list and the map is just insignificant in that. But all that stuff is similar to the way they have it but not like where you have to go tab, tab, tab, where you can see all that at one time and place. That's the difference. I don't know where is goes under the...","NULL"
"956","Baski can...What's the situation?","NULL"
"2235","There will be nothing to worry about right now.","NULL"
"1954","Hey, it's Cathy Jenkins.","NULL"
"193","Yeah.","NULL"
"3104","When it's retired in place you have these options, to change, and the location...","NULL"
"2475","I think so. I'm not 100 percent sure.","NULL"
"1294","All right, I'll do that then, before I try and schedule something. It's 9:21. I'm bringing up what we have. Do we still have testing the CTDI? Did they send something else yesterday?","NULL"
"1542","As a FABS user, I want to download the uploaded FABS file, so that I can get the uploaded file.","F"
"678","No, you're talking warehouse. Warehouse cycle count is different from the field.","NULL"
"1834","As a agency user, I want to map the FederalActionObligation properly to the Atom Feed.","A"
"4695","OK. We have new view. A couple of more changes left to be made, but this gets it started.","NULL"
"4871","I think it actually said that if it ran out of ports it would match up with some of the things that we've been seeing where it appeared to be a network issue, but maybe it's actually not the network maybe it's the interface on the servers running out of resources, making it appear that the issue was a network issue. But as I gather more information I'll let you know.","NULL"
"4405","We shouldn't run that.","NULL"
"1924","build until next week.","NULL"
"1492","Yeah.","NULL"
"711","Yes, if you had his list, say the primary fields are the Afinium locations, of whatever they call it, ship to, and then the address, city, state, zip code, and I liked Brian's first suggestion if you just go by the city, state, zip code and then maybe list them all side by side, and then the ones that match versus the ones that didn't, we could possibly get somebody to help manually do some of those to at least get started.","NULL"
"1491","We're attacking it from the opposite side. We're attacking it from the top down instead of the bottom up. Now I've got a placeholder for blah, and I need it to do blah really, really well, but I don't know what blah looks like yet.","NULL"
"753","Mugshots burgers are...","NULL"
"2832","Do you know  ?","NULL"
"276","Yeah, I like that.","NULL"
"2122","Otherwise they're struggling, fishing through the errors, and I think they're overwhelmed. First of all, we have a lot of errors. They usually have that cleaned up  .","NULL"
"1183","As a Developer, I want to get a Data Package into Node, so that I can start using the data for doing analysis and visualizations.","A"
"2216","I think we're on that section. I want them to be trained.","NULL"
"609","So all the elements are there in three different languages and their manager, he can switch the language somewhere on a taco to his liking.","F"
"3754","We decided that...","NULL"
"4179","Should I have her not even create the epic in TFS, just do the user story?","NULL"
