"id","req_specification","class"
"489","I don't know how much sense this makes, but I think it, it should be possible from a technical aspect.","NULL"
"3199","So it'll really remove estimate in it?","NULL"
"492","Yes.","NULL"
"1246","Grady wasn't able to finish for Friday night's release. They were trying to . He'll run that after about six pm central time today. That should get anything that would have changed in the release and that's still sitting in the FCC screen. That should at least get rid of any of that.","NULL"
"371","Me, I, as a manager can get feedback in whether people liked and understood the question or not.","F"
"638","So what's this, what's this your question?","NULL"
"4359","You got to teach...","NULL"
"2657","The three of us we're over to where we were.","NULL"
"1679","Good.","NULL"
"190","So I think, I think, but what Mark was trying to say is that the, the, the simplicity of simply getting an email for the employee, that should be fine because, uh, if, if the project manager or the team leader simply specifies which users to tag in this, um, in this survey and say, or she's simply addressed by their email, that is fine.","F"
"3690","Well, that part I do know. The code I don't. TFS I know.","NULL"
"2298","I could just do some kind of a standardized thing, like we've received a ticket and we'll provide an update when we have more...Just something like that, to know that I've actually seen it  that response  the ticket. It can be something as simple as that.","NULL"
"1368","As a user researcher, I want to have a list of priority workflow candidates that we might test, so that I can make sure we're capturing the priority areas.","F"
"2287","On the support thing, when work stoppage issues come through and it's during the day, can we assume that you will get in touch with the right person, so I can delete that email until...","NULL"
"2366","Right.","NULL"
"1845","As an Agency user, I want FABS deployed into production, so I can submit my Financial Assistance data.","A"
"105","I'm not really sure here.","NULL"
"1840","That's because we went in and cleaned those up prior to passing the data to you.","NULL"
"531","For example,","NULL"
"2824","Please enter your PIN.","NULL"
"4867","If it's HTTP ports, or HTTP traffic, I mean that would help narrow down what the potential problem could be. If it's the ports used by SQL server that could also, that points in one direction or the other, right?","NULL"
"444","Sorry, I'm back.","NULL"
"3828",".","NULL"
"4762","The drop-downs.","NULL"
"2316","I'm trying to understand...","NULL"
"879","Your login was not successful.","NULL"
"367","Yeah.","NULL"
"4104","What's being worked on then right now?","NULL"
"4592",".","NULL"
"2234","That's exactly...close one, because we did not do one on Monday. We did one on Sunday, didn't do it on Monday. We did one Sunday with every business position.","NULL"
"4554","Oh, and me. I'm not doing anything on it.","NULL"
"1009","These don't look like anything I've ever seen before, so Ken and I were talking about it, and...","NULL"
"2781","OK. You didn't finish it Friday? You didn't find your two hours?","NULL"
"796","As a Staff member, I want to create each condo unit, so that I can associate it to the child parcel and address after the condominiums are recorded in the system.","F"
"4088","Mahesh, can you estimate doing that?","NULL"
"533","I mean, yeah, yeah.","NULL"
"815","As an Inspection Staff Supervisor, I want to Assign Inspections, so that I can make sure the appropriate Inspector receives the work.","F"
"4234","Ideally that would be great. I don't know that that's a necessarily a requirement right now. That's what I'm getting from them.","NULL"
"378","I mean, now I really liked that here with the swipe question, I, I wrote this down and also to comment the ability of questions.","NULL"
"2323","necessarily address those, upgrade and have triage   .","NULL"
"477","I really, yeah, I'm really sorry.","NULL"
"1013","As a stakeholder, I want to see the results of user research, so that I can determine if the CMS is right for me.","F"
"3273","Yeah, reuse because she says that up here. New RC five U.  Not confusing at all, because that's the whole deal, right? This equipment comes in, it's inventory held for use, they never use it, and they retire it. She says, 'Yeah, that's what we actually do on these rare occasions.' Today we have to go through these various steps down here in order to do that.","NULL"
"4775","I have some counts on the headers I'd like to change a little bit, make a little bit more sense about what's in the details and test the duplicate  thing a little more thoroughly just to make sure it's going to reach across different groupings and  . The only thing I haven't started on yet is the multi-row payroll editing.","F"
"1786","As a team member, I want to have a platform that allows me to rapidly prototype HTML ideas.","A"
"2465","A bit, so sometimes we  because what I am doing, is I am downloading from there and pasting on the desktop and working there. So the names, everything, is changing from  .","NULL"
"192","Concrete example.","NULL"
"1522","As a broker team member, I want to make some updates to the SQL codes for clarity.","F"
"3950","That's right.","NULL"
"1590","For that particular project, you guys...","NULL"
"2621","I don't need to go to TBS now, I'm just going to go and pull up those emails that have those issues that we need to decide.","NULL"
"4066","Correct, but, a project manager or ScrumMaster or a product owner think the whole notion of an epic is a set of related user stories. We haven't gone to users and said, 'Hey, what do you want this to do?' If we did, this would be a lot more trivial.","NULL"
"4158","Stating today.","NULL"
"3672","Task or anything?","NULL"
"1035","As a CSM, I want to be charged a fee once I am approved for Practitioner status, so that my certification status can be activated.","A"
"3485","He's very protective of it. That's my opinion.","NULL"
"797","I would think we would give them back, but for one spreadsheet that says, 'Here's all the stuff we've retired, in case you want to double check it. Here's all the stuff we didn't touch, that was in your spreadsheet.' Right?","NULL"
"416","Yeah, totally see this point, maybe Chris, can you elaborate or, okay.","NULL"
"241","At the bottom side is, I don't know, or I don't care.","F"
"2098","I don't remember that one.","NULL"
"1989","Alden North, I guess.","NULL"
"1233","Yes.","NULL"
"93","Maybe it's just simply, can you mute your mic if you're saying something?","NULL"
"281","But maybe I have, yeah.","NULL"
"3050","It goes to default.","NULL"
"4847","my hands.","NULL"
"4173","action. I can see the entities, I can see the contacts. I can sign in. Although there should be stories listed under there.","NULL"
"2866",".","NULL"
"73","There's just some, some small stuff that we need to specify, but, uh, I think that's the reason why we have this meeting in the end.","NULL"
"2555","It may be that...Maybe we end up with a different link when you're not logged in. Even if you're a valid user, PHI doesn't want some competitor of theirs looking at their processes, but they want to be able to see them too.","NULL"
"2503",".","NULL"
"1914","With your permission, right?","NULL"
"2727","On the second one, I think we talked about, you wouldn't want an audited adjustment anyway, right?","NULL"
"4420","Keep using it. I'm sorry.","NULL"
"1402","As a team member, I want to know when meetings are, so that I can plan accordingly.","F"
"1801","That makes sense, because it's his data.","NULL"
"3187","I can't remember the other rules.  .","NULL"
"1876","As an admin, I want to onboard recycling centers on the platform, so that I can increase information accuracy.","F"
"411","But one is a swipe question.","NULL"
"2594","Yeah, those are all bay audit screen updates. I'm shoveling through them at the moment.","A"
"1394","You did that on purpose.","NULL"
"409","But what if semantically, they don't fit?","NULL"
"3232","He's going to have to...Is this store proc?","NULL"
"2037","I'm sorry, go ahead.","NULL"
"1771","OK, so that's the validation problem, and then the other problem is connectivity. That's, again, why a laptop deals with that one.","NULL"
"4415","We do have the Mobile Collect project which has lots of demo examples. It's a different platform, but it should be universal. You need more examples than that. That's not really my only experience with demo at this point, is the Mobile Collect.","NULL"
"1229","As an Admin, I want to have a pricing plan and billing system, so that that I can charge users and make my platform sustainable.","F"
"3286","OK, anything else?","NULL"
"3921","Then the asset  .","NULL"
"709","As a site visitor, I want to do a full-text search of the FAQs, so that I can find an answer quickly.","F"
"1322","We looked at...map control. The demo bug, the map control. CS , CS file. Those two we looked at. That's where he said our focus is going to be. Yet for some reason that graph design scared me death. why we didn't look below it, the demo file. I have no idea. I discovered that five minutes after meeting with John.","NULL"
"3614","I call it five days, yeah. Around five days to implement that.","NULL"
"4446","I assume that's going to be the Telerik stuff.","NULL"
"359","Right.","NULL"
"871","As a Researcher, I want a tool that can generate basic statistics about a dataset, so that I can get a quick preview of the data.","F"
"146","I mean, we ha we, we don't, we have a lot of customers, but it's still quite, um, well, it's, we, we don't serve the whole world.","NULL"
"1459","As a site visitor, I want to view a section of the website that teaches me the basics of what Scrum is, so that I can learn that quickly.","F"
"811","As an employee from the HR department, I want to have access to the full information of all employees working for this business.","A"
"4827","I'm not touching that.","NULL"
"4476","Nobody's here.","NULL"
"3737","They gave me a hard time for being late.","NULL"
"529","Oh, I see.","NULL"
"4538","It's too heavyweight for us.","NULL"
"305","So the manager wants to find out how motivated his team is at this very moment.","F"
"2516","","NULL"
"4021","By credentials. There's things we can put in an iteration so that in two weeks when we have our...","NULL"
"3270","Yeah, because RC five U and RC five  are both  ? I don't have my little cheat sheet, here. RC five S. What are the other ones? S and T?","NULL"
"2570","You can Google. You can Google.","NULL"
"1731","Couldn't somebody just register with a fake account and get all the information anyway?","NULL"
"4363","Also, we had talked briefly about what kind of functionality it would need. Michael said disregard the boundary thing. We will care about how our company,we will care about anything except placing access on the map , so we're running differently.","NULL"
"2655","Bye.","NULL"
"2089","I don't  that.","NULL"
"1515","As a trainer, I want to load an Excel file into the site, so that the course participants are added to the Scrum Alliance records.","F"
"1982","Please enter your conference...","NULL"
"3935","The different swath of epics would be  . Not all of them would be by role. Not only would you have epics on both the slides but then you might have, underneath that, another swath of epics for that particular epic that you're breaking down by a particular role.","NULL"
"2750","OK.","NULL"
"2327","I think that it's probably a good idea to go ahead and make it 45 minutes. I think we can use the extra 15 minutes. I try to start small, see what we can get done, but it seems like...That's always my issues, too, when I was managing things, knocking things off.","NULL"
"2709","No. Basically it would  no change, the way they're saying to do it now. So like I said, it's either change that interface, or create a new interface.","NULL"
"809","The existing interface doesn't change part numbers now. We would either have to change the existing interface to make it change part numbers -- which is not what the interface is designed for -- or we create a new interface to allow them to change part numbers. That's all they're doing with it.","NULL"
"4652",".","NULL"
"572","I think so, yeah.","NULL"
"3688","OK. Because I just wing it. I haven't looked at the code, and now I just went with it.","NULL"
"1739","So I can search assets that are retired and reverse retire some.","NULL"
"1776","As a site member, I want to fill out an application to become a Certified Scrum Practitioner, so that I can earn that designation.","F"
"3236",".","NULL"
"2409","I've got a call in to  . I guess I can call again. Everybody's busy who's on call. So Ken, if we didn't have a ship-to via on some of these, I think you're going to be...I don't even know what we would ship to those pseudos.","NULL"
"4379","Do you have that port on you?","NULL"
"334","Um, maybe we could do it that way.","NULL"
"4671","Page. I cannot believe I just made a connection between the stuff I did several months ago and then now  . Page. The last name sound familiar, I don't know if it sounds familiar, but I've never met her, I'm kidding.","NULL"
"1905","Is it going to be right?","NULL"
"2246","The sooner we know things are going to meet dates,  the better we can set expectations to them.","NULL"
"292","And these people can then decide if these are good ideas or not.","NULL"
"1909","You'll add a task on that one. Who thinks he can get this done? For one thing, because, like I told him, I don't care if the tester gets updated because it needs to be tested with CTDI next week anyway.","NULL"
"1685","As an Owner, I want to invite an existing user, so that the user can become a member of my publisher.","F"
"1489","As a publisher, I want to show the world how my published data is, so that that it immediately catches consumer's attention.","F"
"1173","As a site visitor, I want to read current news on the home page, so that I stay current on agile news.","F"
"3948","I don't think we're accomplishing much right now. I'm not sure where we're going.","NULL"
"3748","Well, you can talk to Brian. Brian had a team that worked like that at the beginning, and he said it was just a nightmare to figure it out.","NULL"
"4507","Yeah. I don't recall that meeting. I didn't know there was a meeting either.","NULL"
"2889","OK.","NULL"
"231","Yeah, we need something fancy looking and also something innovative.","A"
"3601","I think that we should just, Susan and us should just go back to Kevin and tell him that DC3 can...modify DC3 with a tethered scanner would be the most feasible and cheapest way to go to be able to do what they wanted to do.","NULL"
"2286","Be able to keep  to be able to discuss that, make sure that we're good, legally, or to  .","NULL"
"2563","Login, see the home screen and then conversation page. Cool, cool, cool.","NULL"
"2190","OK I will let you know that... I'll just let you know that one of the folks that is supporting our virtual server advised us that it appears there's a possibility that the application could be using reports and not releasing them.","NULL"
"1180","Sure, I can run the scripts. Are they scripts that I need to create, or scripts that you're creating and you just need me to launch?","NULL"
"265","Just a quick input.","NULL"
"3761","What? You could have two different teams working on the same code base, and they'd still have the same release, is what Brian said. You could have people on the HTML5 team that are getting those stories, and other people...","NULL"
"5001","Yes, that's something I can do.","NULL"
"404","So some question types are, um, better to be displayed in a specific way.","NULL"
"2166","No, sir. I'm good.","NULL"
"3506","The recon process is for the whole location, and it's pretty granular as far as being able to make adjustments as you go along so you get the whole inventory for the whole office just right before you actually push the button to pump it back into LCAM.","NULL"
"2109","On the order approval screen they'd be trying to change to SE for a line item.","NULL"
"4918","We may be able to just take the first 11 or 13 of it and have the rest of it in something else, and they would send over the raw location code coaching on our part. There's only three options.","NULL"
"3108","Except...","NULL"
"1919","I could finish that story up if I could just...","NULL"
"3261","What?","NULL"
"4100","But they'll be in there.","NULL"
"4759","You can filter by the drop-downs on the grid.","NULL"
"4982","I don't have an issue with that.","NULL"
"2097","Yeah, I've done that. We're working on where that might be confusing. And the other item, I don't know if we've had it out there before, but the  group, and, well, both groups, I don't know if it's on anything, but CLLI code with the wild card...That's a big request.","F"
"1297","As a user, I want to have accurate and complete data related to PPoPCode and PPoPCongressionalDistrict.","A"
"2108","Gather up...","NULL"
"4900","It was probably on the spreadsheet that Mike sent, I think. Let's see.","NULL"
"3910","When you login on the mobile device all you see are the tiles. Once you click the tile that's when it brings up whatever you put it in. On a mobile device you can't have it to where you just logon and it  , you have to know what you're searching for.","NULL"
"2996","Another column.","NULL"
"153","Because let's say a manager runs the survey, so you will receive the survey in some form and then be able to fill it out.","F"
"4952","I was just looking at that.","NULL"
"3017","That's one of them. Then, the other thing is, if you do this and you do print update...So, when you do this...No, it's not print update, is it? Try and update...","NULL"
"2008","It is. Just looking at it's like...","NULL"
"3378","We can take those  . Get the ones out of here based on those indecipherable 08:50] . Those are the ones we...","NULL"
"2660","It's been too hot today for a sweater. Hi, who's on the call?","NULL"
"1449","As a Publisher, I want to version my Data Package and keep multiple versions around including older versions, so that that I do not break consumer systems when I change my datapackage.","F"
"2440","I've monopolized the time  , but I think that's pretty much all I had.","NULL"
"196","So as to assign, um, which team leader can interact with which employees, so where, where does, where do they belong in, in the hierarchy or maybe even from the project manager side, uh, which team leaders belong to this, uh, project manager.","F"
"10","Okay, cool.","NULL"
"4012","I would call that basically, 'You can filter your results,' because you know you're there, you're there in the conversation.","NULL"
"3396","Yeah, we'll take  . Put a lot of queries and we'd make sure it's right.","NULL"
"235","Perfect.","NULL"
"1604","As a member, I want to have the system email me a new password or a password reminder since i have short-term memory problems.","F"
"3574","Are there enough floater owner laptops around to where if a tech needs to go out and say, 'Hey, I need to spend an afternoon doing these cycle counts,' he could get one?","NULL"
"1260","Then I'm just going to do a merge after this, get the code from 109 back to the trunk.","NULL"
"3056","It's like you've got to get past this one, to get past that one, to get this one.","NULL"
"1642","As a Staff member, I want to Send a Formal Response to Applicant, so that I can satisfy communication and records responsibilities.","F"
"878","As an NSF member of the team, I want to have a place where I can access all the related reports and documentation, so that I can refer to it easily now and in the future.","F"
"2937","So, testing it is what's going to take a minute, right? Because it's the...","NULL"
"4587","You talked about sitting with somebody and then learning. Are we talking about pair programming, in essence. How's everybody feel about that? Honestly. Everybody needs to be completely honest about that.","NULL"
"220","This is solely the, um, the task of a manager.","A"
"4269","OK, so where are we at with the rest of their fallout in general? Do you know?","NULL"
"1365","","NULL"
"1981","How can we have everything in LCAM  makes it not  figure it out?","NULL"
"168","That's what I meant.","NULL"
"2114","We wouldn't unless it...","NULL"
"3107","Would you make everything the same, make it work the same for plugs and for hardwire?","NULL"
"1242","Moral of the story...","NULL"
"2849","One urgent thing we have is Brenda's  back in my group. I don't know if Adam's on.","NULL"
"3993","I like that. Now we've got all of this. Is what is in here all the Notify current functionality?","NULL"
"4378","All right,  2-3-0-1-0-6.","NULL"
"3363","Yeah, that's the part of the email where the way that we know that it's related to a CO is because if it's in the north, south, east or west location group on their system then that's the COs that he doesn't want us to touch.","NULL"
"2615",".","NULL"
"2820","So, that's not this Sunday, but next Sunday.","NULL"
"684","As an NSF employee, I want to have an updated roadmap document, so that I can see prioritized areas to focus on for the next few months and beyond.","A"
"1629","As an admin, I want to handle all users' activities, so that I can manage more efficiently.","F"
"1008","'Then, you can try it out, and then I can help you with it, and then maybe next week I'll give you just a small thing that you can do by yourself.' Then, so on and so forth. That's a huge concern of mine.","NULL"
"3742","Like, your release that's going out in a month can have an iteration of coding and an iteration of test and release it, because there's still iterations within this, so that Mahesh and Baski might be working on stuff and so that's what we have to manage is how you can work on stuff that doesn't go...","NULL"
"686","Just to say, 'This is what we're doing,' and then build from there, unless you...","NULL"
"4942","Do we actually need the list of ship tos and addresses from Afinium?","NULL"
"102","I mean, only the managers are allowed to actually run a survey.","F"
"4803","The only place it's been is that  .","NULL"
"1899","Nothing from me.","NULL"
"759","As a Publisher, I want to sign up for an account, so that that I can publish my data package to the registry and to have a publisher account to publish my data package under.","F"
"2939","The invoice  . This is a pre-defined query.","NULL"
"4084","Three devices, phone, tablet...","NULL"
"2550","Freaking paranoia, worried about  .","NULL"
"288","And maybe, I don't know, you know, where.","NULL"
"4822","That's not why you want to know.","NULL"
"1570","Yes.","NULL"
"3436","I can ask him. I can say, 'We talked about this, would you want us to verify that the clause are closed in LCAM as well, or is that not part of what we're doing?' And say, it's two if we don't have to worry about the clause, it's three if we have to worry about the clause.","NULL"
"1259","All right. I'm going to try to come up with JRM stories. Joel, I think, maybe the assignment stories. Managing project, I'll send those to Jasmine. Corey's going to create the mock up for the logon page.","NULL"
"1664","I think if the teams are structured the right way and the iterations are structured the right way, then the mix will be good on each team to where the new hire can pair program with the thing that they're interested in accomplishing.","NULL"
"274","Hm.","NULL"
"3083","I searched for retire.","NULL"
"4764","That's what I said, the drop-downs.","NULL"
"164","Uh, yeah, exactly.","NULL"
"402","Maybe you guys have some ideas, otherwise I'll give you mine.","NULL"
"3483","Patrick's our DC3 expert. It's his baby.","NULL"
"2916","A warehouse full of hungry children to feed come Monday, so...","NULL"
"3014","Do a search these, and I'll select some, and I'd better  hardware. So, that's the first thing that you're changing. You're going to allow them to change the frame for bugs. So, that's one of these, and then once you do that...","NULL"
"1721","Dopak records.","NULL"
"726","Yes, that's right.","NULL"
"3183","Both wrong  .","NULL"
"2602","Don't think I'm  .","NULL"
"439","My friends it's the only rough, but otherwise probably same as me.","NULL"
"1671","As a user, I want to contact the administrators, so that I can give feedback or ask for help.","F"
"2666","Hi, who just joined?","NULL"
"4518","What meetings are you referring to?","NULL"
"3692","We'll work it. Just make sure, if you get the latest, if it shows up, if it doesn't, let me know. Then we'll schedule...Before we finish, we do need to look at the calendar to see when some time...larger block in.","NULL"
"2489","Source control and putting everything in TFS. All of our files and everything. Right now, we're working off of  two, people are working on their desktop and files are getting written. We're not using the same stuff.","NULL"
"1091","As a team member, I want to understand what the MVP should look like, so that I can begin understanding workflow needs as they pertain to any CMS decision.","A"
"461","Then we have the same for open text question, multiple single choice and so on.","NULL"
"4964","Yes, the first ones came in about 4:28 this morning Central. I don't know which time zone that is, but 4:28 this morning was when the first new equipment message was received.","NULL"
"4752","The grid stuff is just not right.","NULL"
"1782","As a trainer, I want to show my rating up on my profile page, so that site visitors can choose wisely.","F"
"2088",", that would be best. It doesn't matter when   .","NULL"
"2675","We're working on...Last night we were talking about the ship via CLLI codes, that starts with SA-type T  , the dimension was 500 some.","NULL"
"125","Would that be a fully customizable tag or predefined texts?","F"
"3746","Because you have confirmed releases going on at the same time. We've got this HTML5 release.","NULL"
"3429","Otherwise we would be social people.","NULL"
